,Post_Date_Time,News_ID,Headline,Author,Article_Content,Related_Stock_Number,Source
0,2014-07-21 09:45,121022,〈權證〉多方熱門大立光、可成領銜 法人看好生技概念,鉅亨網記者王莞甯 台北,"【鉅亨網記者王莞甯 台北】台股上周五終場指數小跌7.27點，跌幅0.08%，收在9400.97點，由於多空陷入拉鋸戰，觀察權證市場中，認購成交額再縮至近1個月低點，使認購占比續跌3個分點，見「7字頭」至78%，續創2個月低點，在多方量能退潮中，仍有可成(2474)、宏達電(2498)認購成交不減反增，以及佳世達(2352)難得穩在認購前10大熱門榜上，可作為留意方向。
在蘋果公司公布財報前，大立光認購暴出超過2億元的大量，重拾認購王頭銜，不過，大立光上周五大跌近6%，應留意多方似乎有意拋貨而非加碼布局，且多方占比卻僅62%，顯示空方仍有意摜壓，究竟多方是趁其股價走跌之際進場搶反彈，或是等著出貨，還須密切觀察。
可成2季合併營收133.17億元，創下歷年單季新高，並優於市場預期，再加上蘋果iPhone6下半年即將亮相，身為其4.7吋版本的金屬機殼供應商，且占整體iPhone6出貨量60%以上，市場更樂觀看好拉貨需求，上周五日線翻紅有撐，股價漲超過2%，隨著蘋果財報發布在即，也是盤面上人氣超高的概念股之一。
永豐金證券衍生商品部表示，台灣生技展將展開，在題材面豐沛下，市場看好仍可擇股逢低偏多操作，其中，合一(4743)糖尿病傷口癒合新藥WH-1將申請進入美國FDA三期臨床試驗，據傳目前已有3家陸資藥廠洽談授權，股價於高點回檔摜破月線後，外資於16日開始回補，上周五大漲4.32%收在77.2元，順利收復5日線，投資人若看好近期話題加持股價將續反彈，可留意新掛牌的永豐TS(714187)，價外程度適中，或WV富邦(713297)。
另一方面，健喬(4114)子公司益得和因華生技開發新劑型新藥在美FDA臨床進度報喜，優良也將加速IPO計劃，業內外皆亮眼，法人估健喬年營收和獲利可望同步改寫歷史新高，股價目前於月線附近整理，若投資人有意進場，可留意價平的永豐RD(713623)或VN日盛(713582)，與現股連動性高。", ,wantgoo
