,Post_Date_Time,News_ID,Headline,Author,Article_Content,Related_Stock_Number,Source
0,2014-12-02 10:00,173552,〈權證〉蘋概股人氣重鎮 大立光、和碩和鴻準多方擁戴,鉅亨網記者王莞甯 台北,"【鉅亨網記者王莞甯 台北】台股昨(1)日選後第1個交易日多空大震盪，但仍守住月線、10日線和9100點，加權指數收盤時下跌69.44點，以9117.71點作收，買盤有意逢低進駐，同時，在權證市場中，認售空方並未爆出太大量能，認購額占總市場比僅下跌4個百分點至76%，其中，大立光(3008)、和碩(4938)和鴻準(2354)多方人氣最為回升，顯示市場看好的電子股仍以蘋概股為優先。
大立光大啖蘋果，後市業績維持樂觀態勢，且法人看好選後的年底作帳行情，大立光將作為電子領漲的領頭羊之一，激勵多方昨成交量日增2億元達2.8億元上，多方占比回升了8個百分點。
惟留意，蘋果公司股價昨日在美股開盤後突然暴跌，盤中最高跌幅達6.4%，收盤股價下跌3.25%，是否會影響台灣相關的供應鏈廠。
鴻準昨拉出一根長紅K棒，收盤時僅下跌逾0.2%，抗跌態勢明確，認購方搶進布局看好其短線行情，認購量暴增逾4倍來到6000萬元上，多方占比一舉回升10個百分點至92%，叫好叫座，且難得重回前10大熱門榜。
永豐金證券衍生商品部指出，機殼大廠可成(2474)將於本周召開法說會，其10月合併營收一舉衝上54.1億元，改寫單月歷史新高，隨著iPhone 6在各地上市熱銷，可成明年也有積極擴張產能計畫，預期法說會可釋出樂觀訊息。
截至28日止，外資法人連3日加碼可成近7000張，上周券商賣出認購權證數量居市場第2，若投資人欲加碼，可留意極度價平的BF永豐(084650)，與現股連動佳，或較為價平的68凱基(083589)。
同為蘋果概念股的光學元件廠玉晶光(3406)股價近1個月谷底翻揚挑戰前高，表現令人驚艷，昨再度上演驚奇秀，開盤一度重挫近5%，後拉回平盤，午盤後忽急拉漲停，上下振幅逾11%，公司表示本季將積極提升良率，有望轉虧為盈。上周玉晶光認購權證爆量，若投資人有意布局可留意新掛牌的CE永豐(084848)。", ,wantgoo
