,Post_Date_Time,News_ID,Headline,Author,Article_Content,Related_Stock_Number,Source
0,2014-06-13 11:05,103387,iWatch引爆MIN需求？晟銘電下半年產能滿載 年底擴產8成！,鉅亨網記者胡薏文 台北,"【鉅亨網記者胡薏文 台北】晟銘電(3013)今天召開股東會，晟銘電董事長林木和表示，晟銘電朝向雲端伺服器、手持式與穿戴式，轉型成功，晟銘電在MIN技術上，擁有連續燒結爐，目前產能為全球第3大。晟銘電2年前正式加入蘋果供應鏈，去年MIN占營收比重2成，看好下半年MIN產能將全數滿載，今年MIN業績將可成長5成，同時也將再新增一條連續超結爐，年底到位，擴產幅度達8成。
林木和表示，MIN具有精密且更堅固的特色，在手持式與穿戴式產品方面滲透率大增，目前在MIN產能方面，晟銘擁有1條連續爐與12個個體爐，在產能方面，僅次於鴻海(2317)與李嘉誠投資的一家香港公司，為全球第3大。
晟銘電今年上半年營收12.18億元，年增率36.19%，林木和表示，今年全年業績表現將可優於去年，上下半年將有機會呈現3比7的成長幅度。法人指出，隨蘋果下半年新產品放量，晟銘電下半年業績將有機會較上半年成長1倍。
林木和指出，看好MIN需求，已再添購一條連續燒結爐設備，產能約相當於8到10座個體爐，預定年底到位，總產能再可擴增8成。
林木和透露，下周還有專供LV等國際精品大廠扣件客戶來台洽談，也有機會打進此一國際精品供應鏈。
另外晟銘電在醫療、車用領域，也積極切入，醫療方面，已將MIN技術應用在拋棄式探針，車用部分，也已獲得認證，將是下一階段努力目標。", ,wantgoo
