,Post_Date_Time,News_ID,Headline,Author,Article_Content,Related_Stock_Number,Source
0,2014-09-04 11:00,139335,〈權證〉可成獲多方回補 寶滬深、網家黑馬衝鋒成新寵兒！,鉅亨網記者王莞甯 台北,"【鉅亨網記者王莞甯 台北】蘋果愛瘋6啟動拉貨潮，相關題材股人氣仍暢旺，推升台股昨(3)日大盤震盪走高，加權指數收盤時上漲50.63點，以9450.35點作收，觀察權證市場，認購成交額占總市場比重連2跌至77%，來到2周低點，不過，可成(2474)、宏達電(2498)再暴認購大量，寶滬深(0061)和網家(8044)也難得打入認購熱門榜中，可作為短線留意方向。
可成認購量能近倍增並衝上2億元，創近期難得大量，多方占比回升至8字頭，主因為其後市相當樂觀，可成強調目前產能仍吃緊，第4季擴產動作將持續，明年有機會也是積極擴張的一年，激勵其股價回漲逾半根停板，顯示在蘋果新機發表前後，多方仍好看其表現機會。
寶滬深在上證指數昨盤中創近1年來新高下，獲多方快速加碼，認購量能倍增至7000萬元，創下近期難得新高，多方占比已連3日高居90%上，為相當叫好叫座的多方標的。
網家相當罕見登上認購前10大熱門榜中，其近日推出以手機網路應用服務為發展核心的新事業Yiabi，再加上旗下商店街的中秋檔期月餅業績暢旺，股價昨日飆漲攻上漲停，認購量能更飆增超過2倍來到6000萬元上，若投資人有意跟進布局，可留意價平附近、且長天期的元大WC(713783)、統一TB(713728)或兆豐ZW(713721)。
永豐金證券衍生商品部則指出，近期中國華南地區水泥傳統需求旺季將至，報價底部已浮現，第4季價格將上揚，且江蘇南部地區受青奧會召開影響，多處地區被限制施工，水泥庫存壓力並未獲得緩解，原預計8月底的調漲計劃因而遞延，以目前市場預拌混凝土價格及出貨現況，市場預估台泥(1101)、亞泥(1102)等預拌混凝土廠，會有超額轉嫁獲利空間，下半年獲利成長動能佳。
台泥目前股價來到波段高檔整理，截至1日三大法人連5日回補逾1萬張，投資人若看好其近期表現，可利用永豐IY(080778)來提高獲利槓桿，若看好亞泥則不妨參考永豐I4(078725)或CN兆豐(079376)，皆為價外近價平，單價隱波相近。", ,wantgoo
