,Post_Date_Time,News_ID,Headline,Author,Article_Content,Related_Stock_Number,Source
0,2014-05-19 12:10,92771,此軟銀非彼軟銀！結盟搶親亞太電？鴻海不予置評！,鉅亨網記者胡薏文 台北,"【鉅亨網記者胡薏文 台北】針對亞太電信(3268)搶親案，近日又有最新的傳聞，傳聞指出鴻海集團(2317)有意與軟體銀行(SBI)聯手，吃下亞太電信私募現增股，以便取得亞太電信20%持股，成為最大股東，並取得主導權。但鴻海今天對此三緘其口，表示不予置評。不過業界也傳出，此次爭取亞太電信的軟體銀行，並非來自日本的軟體銀行資金，而是韓國軟體銀行資金，業界研判，如屬韓國軟體銀行，與鴻海聯手搶親的機會將微乎其微。
亞太電招親案，演變成鴻海、台灣之星、軟銀等三雄搶親，亞太電也變更釋股計畫，改採私募現增，預定發行8.26億股，每股認購價格17.44元，總金額達144.12億元。業界認為，亞太電改採私募現增後，並不便宜，且雖然是可取得2成股權，可成為檯面上最大股東，但仍非擁有絕對主導權，仍需取得官股支持。
鴻海今天對與軟銀聯手結盟搶親亞太電的傳聞，不願發表任何意見。
不過根據鴻海董事長郭台銘先前的說法，鴻海是決定參與「搶親」亞太電之後，才發現競爭者中還有「軟銀」。因此雙方在事前並不知道對方都參與「搶親」。
但業界又有最新的說法，指稱此次有意參與搶親亞太電的軟銀，並非大家所熟知的日本軟體銀行，而是來自韓國的軟銀資金，業界研判，如屬來自韓國的軟銀資金，與鴻海聯手的機率也將大減。", ,wantgoo
