,Post_Date_Time,News_ID,Headline,Author,Article_Content,Related_Stock_Number,Source
0,2014-11-26 14:40,171962,台股盤後─蘋果派想衝 金融面板不捧場！選前觀望守9100,鉅亨網記者胡薏文 台北,"【鉅亨網記者胡薏文 台北】美股感恩節前多頭暫歇，亞股多頭步調也不一，台股經過昨天MSCI降權重爆量「甩尾」，今天又恢復選前的觀望、淡定，早盤以平高盤開出後，買盤縮手觀望，大盤陷入平盤上狹幅震盪，今天震盪區間僅有34點，權值股中，以鴻海為首的蘋果派族群，包括和碩、可成、大立光等，一度想衝鋒，但面板、金融不捧場，雖有部分中小型股活蹦亂跳，但指數僅以守9100為主。加權指數收盤時上漲6.15點，以9122.39點作收，成交值縮至746.29億元。
電子權值股中，蘋果派今天表現相對搶眼，鴻海傳出大陸富士康有意大舉投資手機面板廠，業界認為可望為iPhone 7預作準備，鴻海穩盤，一度試圖挑戰季線，雖然鴻海漲幅僅0.9%，但卻激勵可成、大立光、和碩等蘋果派族群，可成強彈逾4%，大立光續漲1.6%，和碩漲幅也達2.9%，不過群創今天跌幅達2.6%，友達跌幅也逾1%，聯電、日月光也都有1%以上的跌幅，多空拉鋸。但中小型股則各自表現，包括藍寶石、NFC、中小型觸控面板等族群都出現強彈。電子指數上漲0.21%，占大盤成交比重7成。
金融權值股今天派富邦金、玉山金、元大金當代表「值班」穩盤，兆豐金守住平盤，其餘輪休壓抑在盤下，金融指數下跌0.13%，占大盤成交比重縮至4.5%。
傳產族群部分，今天跌多漲少，玻陶、橡膠、百貨跌幅都逾1%，食品、塑膠、機電、化學、鋼鐵、營建、生技雖挺住紅盤，但漲幅大都在0.5%以下，其餘各族群都壓抑在盤下。
台股今天的走勢，與「九合一」選舉選情一樣膠著，明天有摩台指結算，雖然外資傾向偏多，但選前買盤縮手觀望氣氛濃厚，讓今天大盤高低點震盪區間縮至34點。以日K線來看，上周2根長紅棒後，連續4根小黑K線，雖然指數仍守在9100點之上，但成交量能不出，多頭只能「原地踏步」。扣除今天，距離選舉投票只剩下2個交易日，成交量能恐難放大，因此盤面仍將以盤整為主，多頭想要闖關半年線，恐怕得等選後再說！", ,wantgoo
