,Post_Date_Time,News_ID,Headline,Author,Article_Content,Related_Stock_Number,Source
0,2014-07-24 19:20,122337,陳俊聖：宏碁Chromebook今年出貨倍增 目前供給嚴重吃緊,鉅亨網記者蔡宗憲 台北,"【鉅亨網記者蔡宗憲 台北】
筆電品牌宏碁(2353)執行長陳俊聖今(24)日表示，宏碁仍走在復甦的道路上，包含外部與自身能量，都有助營運表現，其中PC產業今年預期是持平，不過二合一產品是今年市場亮點，第二主要動能來自Chromebook，宏碁在這個產品上做得很好，市佔率也領先其他廠商，今年市場總量可成長7成，宏碁銷量則可望倍增，他認為，除宏碁產品好，去年宏碁基期低也是因素之一，但他坦言目前Chromebook供應量相當吃緊，已增加新生產線供應，但供給仍相當吃緊，即使增加新產能，仍有2位數的缺口，因此有一台就賣一台！
陳俊聖指出，宏碁第2季表現不錯，展望第3季，仍要看外部與自身能量，外部來看，PC產業今年預期可較去年持平，表現沒有太大亮點，但宏碁二合一產品Switch 10獲得市場好評，銷售動能也強勁，即便對手降價，產品銷售動能仍很好。
另一個產品亮點則是Chromebook，陳俊聖指出，Chromebook市場今年急遽成長，全年市場成長性約達7成，而宏碁在Chromebook市場表現很好，市佔率領先對手，今年銷售成長率將超越市場平均7成，約可達1倍以上。
陳俊聖強調，Chromebook今年市場成長強，除一般零售市場，標案市場需求也很旺，目前宏碁已在美國、英國、澳洲、紐西蘭等地區上市，亞洲也已上市在多數國家上市，日本下周也將上市，但坦言供給面相當吃緊，近期已新增產能，但仍供不應求。
此外，陳俊聖也說，桌上型電腦今年受惠微軟停止支援XP系統，出貨表現也央當強勁，而宏碁的成長性也超越筆電出貨成長力道。
陳俊聖認為，上半年宏碁表現不錯，下半年市場動能仍存在，且現在經營團隊很有變好與變強的意志力及決心。", ,wantgoo
