,Post_Date_Time,News_ID,Headline,Author,Article_Content,Related_Stock_Number,Source
0,2014-10-27 09:20,159382,環瑞醫三響炮 前3季營收平去年 多國銷售證入手 明年出貨倍增,鉅亨網記者張旭宏 台北,"【鉅亨網記者張旭宏 台北】環瑞醫(4198)今年在高階移動式X光機推升下，加上Norland骨質密度檢測儀及Novadaq分子影像設備兩大新產品線挹注下，前9月營收達4.26億元，追平去年整體營收，隨著產品陸續獲得中國CFDA銷售輸入證，Novadaq分子影像設備也紐、澳及菲律賓當地輸入許可，明年出貨台數估計倍數成長，全力搶攻全球2400億元市場商機。
環瑞醫表示，公司具有制定下一代醫療產品規格能力，響應政府「一醫材、一聯盟」的發展策略，結盟產官學研建構台灣醫材產業供應鏈，協助台灣產業升級。
環瑞醫積極擴充醫材版圖，去年9月簽下加拿大商Novadaq 5年的授權代理，包括內視鏡螢光影像系統PINPOINT及外科手術SPY影像系統，代理區域有澳洲、紐西蘭、馬來西亞、新加坡、泰國、緬甸、印尼、菲律賓及越南等9個國家。Novadaq基於今年之銷售業績及在亞太地區通路佈局，於近期再取得日本的獨家銷售代理。今年度上半年Novadaq分子影像設備已佔合併營收將近10%，新的代理區域擴增及認證陸續取得，分子影像產品線將可大幅度增長。
另外環瑞醫去年11月由美國子公司SRI向美國上市公司Cooper Surgical100%購買Norland骨質密度檢測儀事業部，Norland為全球骨質密度檢測三大品牌之一，由於美國醫療協會已正式將肥胖列入疾病，未來將加入體脂肪檢測功能，透過Norland DXA可準確檢驗全身體脂肪分佈，今年上半年骨質密度檢測儀已佔合併營收將近10%，今年銷售區域由北美延伸大中華區域，未來成長可期。
環瑞醫2013年推出高階移動式X光機(ddR CruzeTM Plus)，具有獨家雙螢幕、支援床邊診斷、行動偵測顯示及解析度等競爭優勢，成為今年X光機成長主力產品，另為搶佔亞太新興市場，研發數位落地式X光機，因性價比高，將使X光機產品線更加完整，加上Norland骨質密度檢測儀及Novadaq分子影像設備兩大產品線挹注，今年累計前9月營收已達4.26億元，已追平去年全年營收。
環瑞醫指出，旗下全自動C型臂數位X光機(ddR Formula®)已於今年4月取得CFDA中國大陸輸入許可，手動C型臂數位X光機(ddR ElementTM)9月取得CFDA輸入許可，同時Norland骨質密度檢測儀也CFDA中國大陸輸入許可；代理Novadaq分子影像設備同步紐、澳及菲律賓當地輸入許可，三大產品線在亞洲新興國家市場及大中華通路趨於完整，法人估計明年出貨台數將會倍數成長。
環瑞醫強調，2013年以前北美及歐洲佔合併營收約90%，其中又以北美佔有80%最高；而2014年度上半年由於其他區域銷售金額提升，區域佈局在產品陸續取得認證及新產品線挹注下效益逐漸發酵，北美及歐洲佔銷售金額下降至70%，其他區域銷售金額則由原10%提升至30%。
根據統計，一般型數位X光機、骨質密度儀、嬰幼兒用及移動式數位X光機等高階醫材，2013年全球市值為65億美元，預估至2018年全球市值可成長80億美元，且一般型X光機巿場超過70%主要分佈在北美、歐洲、日本、中國大陸及其他亞洲國家，環瑞醫強調，透過自主研發、併購策略、技術合作及OEM、ODM等商業模式，產品與區域的水平延伸，加上在台研發中心關鍵零組件垂直整合，全力搶攻2400億元市場商機。", ,wantgoo
