,Post_Date_Time,News_ID,Headline,Author,Article_Content,Related_Stock_Number,Source
0,2014-06-25 08:55,109506,〈權證〉鴻海、華亞科多方加碼夯爆！微星崛起成新黑馬,鉅亨網記者王莞甯 台北,"【鉅亨網記者王莞甯 台北】台股加權指數昨(24)日收盤時上漲17.85點，以9245.2點作收，站回10日均線，但從權證市場觀察，認購額轉趨下滑，占總市場比重續降3個百分點至82%，再創1個半月來新低。不過，今(24)日召開股東常會的鴻海(2317)認購額續飆高，加上華亞科(3474)、可成(2474)多方力守，以及微星(2377)難得再打入認購前10大熱門，多方控盤樂觀氣氛未散。
鴻海召開股東會話題正夯，激勵多方積極進場布局，認購額連2日穩居3.5億元上下，多方占比更高達95%，相當叫好叫座，不過，鴻海集團旗下富士康(HK-2038)重慶廠爆發勞資糾紛，再加上鴻海無預警宣布股東會不開放媒體入場，此狀況已多年未再發生，反而使股東會釋出訊息更加受到關注，本周股價表現勢必將持續左右台股氣氛。
DRAM供貨吃緊，市場預期第3季合約價格上漲幅度上看10%，推升華亞科昨續漲逾2%，股價已處高檔卻看回不回，多方更有恃無恐持續在此擴大交投意願，認購成交額再推升6000萬元來到2.5億元上，多方占比達87%。
而微星董事長徐祥表示，今年板卡銷量目標超過2600萬片，以提高市占率為目標，另外伺服器、一體機(AIO)、工業電腦、車載和掃地機器人皆持續成長，後市樂觀，昨股價大漲逾4.5%，認購額更倍增至5000萬元上，是相當吸睛的黑馬標的。
永豐金證券衍生商品部表示，半導體展望佳，需求暢旺，相關供應鏈雨露均霑，其中，封測一線大廠矽品(2325)對下半年展望樂觀，今年已2度調升資本支出，隨著廠商拉或趨勢向上，整理營運可望隨著高階封測產能擴充而成長，近10個交易日外資法人回補矽品近7000張，目前股價自前波高點回檔於月線附近整理，中長期多頭格局不變，投資人若有意布局，可留意永豐7M(077384)，價外程度適中槓桿高，或群益6G(077141)。
而以生產鑽石碟、再生晶圓為主的中砂(1560)，因台積電占其營收比重逾40%，其12吋再生晶圓新產能開出後拉貨動能強勁，產能滿載，法人看好其6月營收有機會續創新高，第2季營收也有望改寫新高，投資人若有興趣可留意永豐2U(076624)或更為價平的日盛H2(077282)，槓桿皆有4倍。", ,wantgoo
