,Post_Date_Time,News_ID,Headline,Author,Article_Content,Related_Stock_Number,Source
0,2014-11-24 09:35,171101,〈權證〉蘋概股可成、和碩強者恆強！毅嘉、頎邦跟進造勢,鉅亨網記者王莞甯 台北,"【鉅亨網記者王莞甯 台北】台股上周五陷入平盤和9100點間狹幅震盪，加權指數收盤時上漲12.66點，以9091.53點作收，觀察權證市場，則突顯投資人看好選前行情的氣氛，認購成交額占總市場比重連4增來到78%，創近2個月高點，其中，還是以高價蘋概股人氣最為熱絡，包括可成(2474)和和碩(4938)量能再破億元，另有毅嘉(2402)和頎邦(6147)中小電子股量能放大，可作為短線留意方向。
可成上周漲幅超過5%，主因為可成看好需求強勁，明年仍定調積極的擴張路線，法人估計資本支出可能續飆新高。投資人看好其長期業績樂觀，股價近期有望持續反彈，近2日認購成交額均破億元，多方占比也維持在近80%的水準。
另一方面，由於蘋果21日收盤持續上漲0.14%，以116.47美元作收，不斷改寫新高紀錄，近1個多月來波段漲幅更高達22%，相關概念股持續受到激勵，其中，和碩1周來大漲近12%，多方也同步大幅加碼，認購量能近倍增至1.1億元，多方占比連3日穩居80%上，是最叫好叫座的電子標的。
投資人若有意跟進布局和碩，可留意微價外的7R元大(084797)，與現股連動佳，或富邦BJ(084784)。 
毅嘉第3季稅後淨利2.36億元，EPS 0.71元；而前10月營收96.4億元，創下同期歷史新高，近期股價有發動的跡象，周線連2紅，認購量由日前不到千萬元的水準大幅提升至3000萬元之上，多方占比更連續2日衝至97%，明顯優於日前僅8字頭的表現。
永豐金證券衍生商品部則指出，小米機需求暢旺，激勵相關供應鏈成為盤面關注焦點之一，其中，英業達(2356)隨著訂單需求成長宣布於南京擴產，第4季在手機旺季帶動下全年出貨可望拉升至5000萬。
英業達近期股價於低檔整理，但近2個交易日三大法人轉賣為買，投資人若看好近期將有反彈，可留意價平的8W永豐(083110)，較積極的投資人則可留意價外程度較高的3B元大(084238)。
同為小米供應鏈的光學大廠致伸(4915)第3季合併營收136.2億元，創下重掛牌上市以來單季新高，第4季營收在終端需求強勁帶動下可望維持高峰。
致伸股價自上月底反彈至今已來到季線上，認購權證也增近3倍來到2000多萬元，投資人若看好反彈行情將持續，不妨參考價平，單價稍高的G9永豐(083867)，成交量大。", ,wantgoo
