,Post_Date_Time,News_ID,Headline,Author,Article_Content,Related_Stock_Number,Source
0,2014-09-05 08:22,139756,台股盤前─中秋長假前買盤觀望 蘋果魔咒恐再現 短線盤整守9400點,鉅亨網記者楊伶雯 台北,"【鉅亨網記者楊伶雯 台北】台股連續兩個交易日留下長下影線，昨日成交量更降至下半年新低，IFA展三星、索尼等大廠發表旗艦新機，企圖搶占蘋果iPhone 6發表前的市場，蘋果股價連2日下跌，恐怕拖累相關概念股的表現，美股周四紅翻黑，台股今(5)日雖有政策將開放第三方支付業務的利多，但在中秋長假前，買氣如果無法回升，恐怕仍將陷入整理，值得觀察的是，歐洲央行宣布降息，可望帶來新一波的資金活水，有助台股力抗賣壓，加大反彈機率。
台股周四力守9400點的企圖明顯，尾盤強拉金融股墊高指數，留下長下影線作收，成交量則是降至下半年新低，中秋節長假前觀望氣氛濃厚，無量之下，多頭也難展身手，短線來看9400點成為多空角力關鍵。
歐洲中央銀行宣布降息，且推出收購資產計畫對抗通貨緊縮壓力，激勵歐美股市表現，但美股周四卻是出現由紅翻黑的表現，主要是今日將公布最新非農就業數據及8月美國失業率，投資人保守因應。
美股周四道瓊工業指數下跌8.7點，或0.05%，收在17069.58點；NASDAQ指數收跌10.28點，或0.22%，收在4562.29點；S&P500指數收跌3.07點，或0.15%，收在1997.65點；費城半導體則是收紅1.63點，漲幅0.25%，收在645.72點。美股漲跌不大，倒是歐洲央行宣布降息，國內法人認為，可望刺激台股資金面，有助台股今日的表現。
蘋果iPhone 6外傳預計在9月9日發表，將有兩款不同尺吋的手機同時上市，但是股價卻在近兩個交易日出現下跌，蘋果概念股恐將受到拖累，市場上向來流傳蘋果魔咒的說法，短線恐怕對蘋果相關概念造成衝擊，今日仍要留意包括股王大立光、鴻海、可成等股的表現。
政策面部分，行政院會通過第三方支付專法(電子支付機構管理條例)草案，將開放第三方支付業務，開放線上儲值服務、辦理離線實質支付、電子支付帳戶間的匯款移轉等3種電子商務。金管會主委曾銘宗則是強調，希望下會期列入優先法案，一旦立法院通過，年底前就可推行，目前預估約有5-10家業者將會提出申請。據了解，包括台灣大等電信業、網家、智冠等業者都在積極準備進軍第三方支付領域。
值得注意的是，國內再爆出食安問題，不法業者用餿水油製造黑心油，目前已知國內食品大廠味全使用到問題油品，台北市衛生局表示，味全主動通報有味小寶純豬肉酥等12項產品使用「全統香豬油」問題油，已主動回收涉案產品及封存；食安問題再起是否造成衝擊值得觀察。
法人指出，整體來看，台股中多趨勢持續，惟需留意未來美股反應QE結束及首次升息，及觀察10月滬港通之後對台股資金流動的影響；另外，蘋概股短線漲多震盪仍守住支撐，iPhone 6發表後預期將會熱賣，配合營收成長利多有利台股盤堅；政策上兩岸金融會議、政策偏多，加上中國十一假期題材，有利台股類股輪動。", ,wantgoo
