,Post_Date_Time,News_ID,Headline,Author,Article_Content,Related_Stock_Number,Source
0,2014-09-03 18:59,139124,外資自拉自唱？買超71億元 台指萬口淨空單不退,鉅亨網記者胡薏文 台北,"【鉅亨網記者胡薏文 台北】亞股隨陸股回神，台股也在財長信心喊話激勵下，由金融股扮先鋒，展開反彈，但5日均線下彎，成交量能不出，加權指數收盤時上漲50.63點，以9450.35點作收，成交值維持在884.21億元水準。台股今天呈現反彈走勢，依舊由外資自拉自唱獨角戲，外資買超71.2億元，買盤觸角擴及金融股，不過在台指期部分，雖然多單小幅歸隊，但淨空單仍逾萬口不退！投信賣超5.46億元，自營商賣超5.75億元，三大法人共買超59.98億元。
外資買超群創1.9萬張，台新金、第一金各逾1.7萬張，友達、緯創、富邦金各逾1萬張，中鋼、兆豐金各逾8000張，玉山金7000多張，中信金、華南金各逾6000張，華亞科、矽品各逾5000張，聯電、遠東新、台積電、遠百、新光金各逾4000張。
外資賣超英業達、晶電各1.2萬張，鴻海4000多張，勝華、微星、日月光各3000多張，隆達、遠傳、智寶各2000多張。
投信買超國巨、第一金各逾2400張，漢翔、友達、隆達各逾900張，大眾銀、建大、勤誠各逾500張。
投信賣超毅嘉、華亞科各逾2000張，英業達1400多張，致伸、聯電、嘉聯益、寶滬深、瑞儀各逾500張。
自營商買超寶滬深1.1萬張，友達7000多張，台灣50、群創、和碩各逾3000張，元上證2000多張，大成、FB上證、第一金各逾1100張，陽明、大眾銀、可成、鴻海各逾800張。
自營商賣超華亞科6000多張，和大3000多張，華邦電、玉山金、台積電、勝華、台新金、宏碁各逾1100張，嘉聯益、金寶、聯電、亞太電各逾800張。
台股昨天大跌逾百點，今天回神，不過成交量能仍未見升溫，反彈觸及下彎的5日均線，旋即回頭，指數雖暫守9400點，但多方仍未能搶回盤勢掌控權。今天的台股盤面，墊高指數的功臣為金融股，電子族群僅透過題材維繫人氣，整體而言，盤面仍缺乏強勢的主攻部隊，大盤現階段仍以盤整為主要基調。如果遲遲未見多頭帶量反攻，多空決戰點恐將延至中秋節後，而節前將以9400點為中線，呈現上下震盪格局。", ,wantgoo
