,Post_Date_Time,News_ID,Headline,Author,Article_Content,Related_Stock_Number,Source
0,2014-08-11 14:40,131523,台股盤後─「天龍地虎」快攻 金傳當後衛 連闖9100、5日線2關！,鉅亨網記者胡薏文 台北,"【鉅亨網記者胡薏文 台北】美軍正式發動對伊拉克空襲，美股上演「利空出盡」，道瓊指數上演強彈，帶動亞股多頭趁勢反攻，台股一早開盤即跳空站回9100點，連日來被壓抑的電子股，今天由股王大立光搭配面板雙虎，上演「天龍地虎配」，發動快攻，金融、傳產也發揮團隊精神，擔任「後衛」，讓大盤震盪走高，也順利突破5日均線。加權指數收盤時上漲86.95點，以9172.91點作收，成交值仍僅828.73億元。
電子今天一吐悶氣，股王大立光漲幅1.8%，順利站上2400元大關，面板雙虎今天表現也可圈可點，友達、群創漲幅都約在3%上下，鴻海即使7月合併營收創17個月新低，但買盤依舊力挺，讓鴻海收紅，下午將召開法說會的可成，漲幅也逾3%。盤面上「自救」氣氛瀰漫，上周五多檔弱勢指標股，包括華亞科、毅嘉等，今天紛紛強彈漲停，但是台積電、台達電、廣達等大型股，依舊略見調節賣壓，使得電子指數上漲1.05%，占大盤成交比重73%。
金融族群部分，今天也上演新經濟部長慶祝行情，開發金漲幅逾3%，富邦金漲幅逾2%，官股行庫一片紅通通，第一金、兆豐金、彰銀漲幅都逾1%，金融指數上漲1.29%，占大盤成交比重降至5.9%。
傳產族群部分，今天大多也展開反彈走勢，僅有營建、百貨、化工仍被壓抑在盤下。包括食品、紡織、機電、造紙反彈都逾1%。
台股周K線連5黑，波段跌幅逾500點後，今天終於隨國際股市展開反彈，包括電子、金融、傳產今天的反彈走勢相當整齊，短線跌深股，更是盤面率先反彈指標，多頭順利連闖9100點與5日線2關，但美中不足之處，還是成交量能，仍僅達800多億元水準。台股已經連續3個交易日都維持在800多億元水準，跌也殺不出量、反彈也沒量，讓5日、10日均量轉為退潮，讓大盤的「盤跌」疑慮依舊未能化解。短線上需觀察這波反彈強度，10日線9242、季線9270點，為下一階段反彈目標區，多頭必須衝過10日線與季線，大盤才有機會翻多，如成交量能不出，仍暫以季線至半年線間區間震盪看待。", ,wantgoo
