,Post_Date_Time,News_ID,Headline,Author,Article_Content,Related_Stock_Number,Source
0,2014-09-01 18:20,138335,伺服器、MIM雙動能 晟銘電：佈局完成等收成！Q3、Q4季季高,鉅亨網記者胡薏文 台北,"【鉅亨網記者胡薏文 台北】晟銘電(3013)第2季因添購MIM設備，加上強化研發，費用大增，上半年每股稅後盈餘0.01元，但晟銘電指出，新添購的MIM連續爐年底到位，且除智慧型手機外，穿戴式裝置對MIM的需求更大，晟銘電在台廠中，MIM產能已躍居僅次於鴻海(2317)的第2大供應商。法人指出，晟銘電2大主力產品，伺服器今年年增率將可成長2成，智慧型手機部分，蘋果今年交貨量預估將可成長5成，且晟銘電在連接器公座的占比攀升至5成，整體佈局已完成，第3、4季業績將可成現季季高，且費用率也可降低。
法人指出，晟銘電為蘋果供應鏈，包括蘋果iPhone 6、新款iPad Air與iPad mini共用的連接器公座，晟銘電獲得的訂單比重也攀升至5成，且蘋果iPhone 6可望引爆蘋果歷年來最大規模換機潮，看好今年交貨量將可成長5成，而相關訂單，也自8月起升溫，晟銘電業績將可同步推升，今年業績高峰將落在第4季。
而在伺服器部分，目前占晟銘電營收比重約5成，除了富士通、NEC、日立等日矽品牌客戶，晟銘電也積極搶進白牌伺服器與大陸資料處理中心市場，都陸續有所斬獲，今年伺服器部分營收將可成長約2成，下半年也同步進入旺季。
至於市場關注的另一項蘋果新品--iWatch，法人指出，目前遞延至明年首季上市的機率大增，由於穿戴式裝置產品，零組件更微小，且更不規則，對MIM工法需求更高，晟銘電年底新擴產的MIM連續爐到位，也剛好可配合蘋果iWatch上市，包括iWatch零組件、錶扣等，均可望採用MIM工法生產。
晟銘電在MIM產能部分，目前擁有1座連續爐與12個個體爐，一座連續燒結爐設備，產能約相當於8到10座個體爐，目前MIM產品占晟銘電營收比重已達3成，而新的連續爐年底到位，明年首季加入量產，晟銘電MIM營收比重也可望往5成邁進，與伺服器形成「雙動能」，帶動業績獲利成長。", ,wantgoo
