,Post_Date_Time,News_ID,Headline,Author,Article_Content,Related_Stock_Number,Source
0,2014-06-20 09:45,106987,〈權證〉多方熱門標的輪流登場 大立光、伍豐和矽品出線！,鉅亨網記者王莞甯 台北,"【鉅亨網記者王莞甯 台北】台股昨(19)日盤中最高來到9316點，創下6年半來新高，收盤加權指數上漲 39.33點，以9279.93點作收，也再度改寫馬總統就職以來新高，觀察權證市場，多方買盤萎縮顯示高檔追價熱門標的的意願稍減，不過伍豐(8076)、大立光(3008)矽品(2325)在前10大熱門排行榜中多方量能逆勢飆升，值得留意。
認購熱門榜前3名依然由華亞科(3474)、可成(2474)和聯發科(2454)包辦，量能卻同步縮減，顯示多方持續進場的激情稍稍退卻，不過，此3檔標的的多方占比皆穩居80%上，空方難上下其手，對於後市仍提供一定的穩盤作用。
博弈概念股伍豐投資俄羅斯賭場潛力大，昨股價再度強勢表態，午盤過後攻上漲停站上200元整數關卡，成為工業電腦第2高價股，激勵多方有意再度搶短進場加碼近8000萬元來到1.2億元上。
智慧型手機往高規格發展，大立光執行長林恩平表示，由於今年有4G，市況感覺更好一點，基於往年經驗，第4季是全年高峰，下半年會比上半年好。大立光在全年沒淡季下，昨股價再度大漲，盤中突破2100元，再創台股新天價，認購方也快速跟進，多方量能倍增突破億元，顯示多方對於大立光的天價無所畏懼，更看好其後市將可持續走揚。
永豐金證券衍生商品部表示，智慧型手機和平板電腦進入旺季，帶動半導體廠第2季營運表現亮眼，其中，瑞昱(2379)、義隆(2458)紛來到波段新高。
網通晶片廠瑞昱布局行動裝置及電視有成，4月和5月營收連續改寫單月新高紀錄，6月也值得期待，投資人若看好其6月營收有望再創佳績，欲先行布局，可留意成交量大的永豐6G(077143)，價外程度適中，或長天期的凱基E8(072744)。
而義隆近5個交易日三大法人回補近4000張，目前周KD交叉向上，投資人若看好其短期仍有行情，可留意價平的永豐8K(077468)，或較為價外的凱基CP(075805)。", ,wantgoo
