,Post_Date_Time,News_ID,Headline,Author,Article_Content,Related_Stock_Number,Source
0,2014-06-24 13:29,108820,台股盤中—鴻海領軍權值股撐盤 高價股扯後腿 量縮反彈小漲,鉅亨網記者蔡宗憲 台北,"【鉅亨網記者蔡宗憲 台北】台股今(24)日量縮反彈，盤面上權值股帶頭撐盤，權值龍頭台積電今舉行股東會，董座張忠謀對下半年營運仍看好，股價平盤附近震盪，鴻海、臺塑、南亞與金融股國泰金等個股則小漲，宏達電盤中也黑翻紅，支撐大盤走勢，傳產股方面則由汽車及塑化股領頭，多頭展企圖心，無奈整體盤面被高價股壓盤，大立光、漢微科與碩禾等股價在盤下游走，打擊反彈氣勢，午盤前僅小漲10點左右，量能約900億元，指數力守9250點。
台股今日進行反彈，量能仍不及昨日，預估量約900億元，盤面權值股表現穩定，電子權值由鴻海出頭撐盤，上漲近1%，帶動集團股廣宇、鴻準、建漢、維熹與撼訊等股價也在盤上游走；傳產則由台塑亮牌，臺塑、台塑化等股價也維持盤上小漲，金融股則由國泰金領頭，支撐大盤維持盤上震盪格局。
權值龍頭股台積電今日召開股東會，董事長張忠謀對下半年景氣樂觀，預期產能利用率皆可維持滿載，同時也對股價表現樂觀，不過今日盤中股價僅平盤震盪，並未有效帶起台股走勢。
相對權值股，高價股表現則較為平淡，股王大立光下跌1.5%以上，漢微科也有近3%跌幅，碩禾則重摔4%，聯發科、基亞、F-鮮活、瓦城等股價也都在盤下震盪，接近1%左右跌幅。
金融股成交比重僅在5%附近，族群股價表現多空不一，旺旺保、元大金、台中銀、國泰金上漲1%以上，開發金、聯邦銀、彰銀、高雄銀、玉山金與台新金等股價則在平盤附近遊走。
電子股則以電腦股漲幅最整齊，精英亮燈漲停，承啟、廣達、宏碁、奇鋐、喬鼎等股價都在盤上遊走；蘋概股表現也不俗，玉晶光、華通、國巨、嘉聯益、欣興等股價也有2%漲幅，但部分個股如可成，則受消息面影響重摔逼近跌停。
傳產股由台塑集團帶頭衝鋒，其中臺塑家族臺塑、南亞、台塑化、華亞科與南電等股價都在盤上震盪；汽車股表現更強勢，和泰車、F-廣華漲幅達3%以上；造紙股台紙亮燈漲停；電器股華電、大山與聲寶也都上漲1%以上；生技股科研、亞諾法、葡萄王等股價也都維持平盤以上小漲格局。
整體而言，台股今日量縮反彈，午盤前量能略微升溫，不過仍在900億元左右附近徘徊，法人認為，資金輪動速度快，權值股與中小型個股較有表現空間，指數上檔留意5日線反壓，下檔則觀察月線支撐。", ,wantgoo
