,Post_Date_Time,News_ID,Headline,Author,Article_Content,Related_Stock_Number,Source
0,2014-09-29 14:25,148610,台股盤後─佔中、匯市干擾揮不去 股王發威 力守8900不破！,鉅亨網記者胡薏文 台北,"【鉅亨網記者胡薏文 台北】美股大漲，但台股一早以平高盤開出後，多頭僅短暫在9000點停留不到2分鐘，隨即受到香港「佔中」衝突擴大、新台幣匯率急貶等因素干擾，加上今天又逢摩台指結算，買盤觀望氣氛濃厚，大盤迅速翻黑，被壓抑在盤下，一直到後半場，股王大立光發威，往漲停叩關，帶動漢微科等高價股與蘋果派回神，讓台股尾盤跌幅縮小，加權指數收盤時下跌29.06點，以8960.76點作收，成交值831.76億元。
電子族群部分，經過連日的壓抑，今天已有太陽能、LED等次族群，搭配尾盤大立光發威，而有抗跌表現。大立光雖再度被列為警示股，但開高墊高，尾盤一度衝上漲停，股價漲幅6.7%，成為多頭信心指標，漢微科也受到激勵，漲幅4.5%，蘋果iPhone 6傳出10月10日將登陸銷售，鴻海也穩在盤上，可成漲幅逾2%，鴻準也獲外資青睞，力守紅盤，太陽能族群由新日光領軍，漲幅逾4%，跌深的LED族群也出現反彈，但DRAM指標華亞科由紅翻黑，聯發科跌幅也逾2%，仁寶跌幅逾3%，讓電子指數仍下跌0.19%，占大盤成交比重縮至69%。
金融權值股部分，今天只剩下富邦金力守紅盤，國泰金、元大金收平盤，企圖穩盤，但官股行庫並無表現，兆豐金、華南金跌幅都達1%以上，讓金融指數下跌0.41%，占大盤成交比重攀升至7.8%。
傳產族群部分，包括生技、觀光、橡膠、化工、紡織今天都冒出頭，逆勢收紅，其餘各族群依舊壓抑在盤下，其中以玻陶、鋼鐵、汽車跌幅較重，跌幅達1%以上。今天紡織股王儒鴻一馬當先衝上漲停，生技指標股基亞也再攻漲停，讓這2個族群都有逆勢表現。
香港「佔中」衝突擴大，港股開盤後，台股也跟著軟腳，但今天另一個值得留意的狀況，則是新台幣兌美元匯率午盤急貶1.68角，也讓市場擔心外資是否有開始「匯出」的動作。今天雖為摩台指結算，但以今天大盤表現來看，外資並未積極摜壓，使得指數並未跌破上周五低點，加上尾盤股王大立光發威，再度登高一呼，反而讓多頭稍微振作起來。雖然今天大盤未破周五低點，成交量也稍稍放大，但多頭要讓盤勢止跌回穩，還是得再加把勁，站上5日均線已成為最低要求，否則大盤仍難擺脫下降軌道。", ,wantgoo
