,Post_Date_Time,News_ID,Headline,Author,Article_Content,Related_Stock_Number,Source
0,2014-10-28 12:30,159802,台股盤中－外資歸隊 電子金融股王股后狂奔！飛躍3關漲百點,鉅亨網記者陳慧菱 台北,"【鉅亨網記者陳慧菱 台北】外資昨日買超60億元且回補期貨空單，融資也減少約29億元，台股今(28)日開盤後以台灣50成分股為主、搭配電子金融都打出「股王、股后」登高一呼的強棒，一舉跳空收復10日線、8700點、5日線連過3關，盤中大漲百點，成交量也跟著增加，由於外資有歸隊跡象，短線有機會向上持續反彈看月線。
金融股在富邦金、國泰金上演金融股王、股后追逐戰之下，股價雙雙向上突破、漲逾3%，富邦金領先重登50元大關，開發金、中信金、台新金等也都漲逾2%，激勵金融類股指數大漲超過2%，成為盤面上最火熱族群。
電子股股王、股后也不遑多讓，大立光勁揚4%、收復2000元大關，漢微科亮燈漲停。其他還有華邦電挾第3季稅後淨利9.62億元，年增5.8倍，創16季來的新高，開盤走高後拉上漲停板；華亞科、可成、鴻海、聯發科、友達與群創等權值股也大舉漲升，漲幅超過2%。
五大泛用樹脂報價可望止跌，塑化股今日強勢反彈，台塑家族領銜衝鋒，台塑、台化、台塑化勁揚約2.5%，南亞亦走強約1.5%；其餘二線塑化股方面，國喬也一度大漲3%，F-再生、F-勝悅、萬洲都有2~2.5%漲勢，成為台股領漲族群之一。
今日開盤後的類股齊揚，以玻陶類表現最強，類股漲幅2.57%；食品類股指數漲幅約0.3%，相對較弱，但歷經食安風暴中心的個股包括味全、統一都出現止跌回穩。昨天崩跌的上櫃指數，今天也強勢反彈。
外資昨天大幅平倉台指期空單，加上現貨買超60億元，激勵多頭信心，讓加權指數今天火力全開收復10日線、8700點、5日線，月底摩台指即將結算，外資空單僅剩7000口水準，外資有歸隊跡象，接下來上檔看月線8825點。", ,wantgoo
