,Post_Date_Time,News_ID,Headline,Author,Article_Content,Related_Stock_Number,Source
0,2014-12-11 09:00,178553,eBay擬切割PayPal 傳將裁員3000人 首要衝擊賣場人力,鉅亨網編譯許家華 綜合外電,"【鉅亨網編譯許家華 綜合外電】知情人士透露，eBayInc.((US-EBAY)) 明年初考慮裁員數千人，係因eBay正在切分PayPal付費單位。 
此次裁員預計最初將影響eBay核心賣場部門的員工。其中一位知情人士表示，eBay已討論裁員至少 3000人或整體人力 10%的計畫。
此裁員計畫顯然是eBay成為獨立公司的準備工作，並可成為潛在具吸引力的併購目標。賣場部門包括eBay.com 和 StubHub，其獲利高於PayPal，但成長卻較緩慢且面臨的競爭日益增強，例如亞馬遜 （Amazon.com)和阿里巴巴與其他公司的競爭。
分析師曾表示，獨立的eBay將成為收購的選項，裁員有助於降低營運成本，是收購公司的關鍵指標。該公司全體今年頭9個月的營運成本上升 14%至 64億美元，大概是整體營收的一半。
發言人拒絕回應公司的裁員計畫，但eBay曾表示打算成立一家獨立公司。", ,wantgoo
