,Post_Date_Time,News_ID,Headline,Author,Article_Content,Related_Stock_Number,Source
0,2014-06-24 14:40,108865,台股盤後─外資沒落跑！護航鴻海登高 中小型股回神守9220,鉅亨網記者胡薏文 台北,"【鉅亨網記者胡薏文 台北】美股小小黑，無礙亞股多頭反攻，台股昨天上演多殺多的中小型股，昨天盤後公布三大法人進出，發現外資並未落跑，今天也隨亞股多頭反攻，稍稍回神，大盤早盤以平高盤開出後，台積電股東會一如預期釋出利多，雖未激勵股價再往上攀高，但鴻海、NB下游，以及金融、傳產權值股多穩在盤上，讓大盤全場維持盤上，加權指數收盤時上漲17.85點，以9245.2點作收，站回10日均線，成交值縮至886.72億元。
股東會今、明2天的「壓軸秀」分別由台積電、鴻海擔綱，台積電一如外界預期，董事長張忠謀釋出利多，但台積電股價淡定，僅以平盤作收，反而是明天將召開股東會的鴻海，持續往百元關靠近，收盤登上98.2元，創26個月新高，電子權值股中，展開反攻的還包括NB下游族群，廣達漲幅逾2%，華亞科也反彈逾2%，綏然大立光遭遇獲利調節賣壓，跌幅逾2%，可成也被傳聞愛瘋6認證為過關干擾，重挫5%，但中小型股回神，微星大漲4%，精英、揚明光、亞光均漲停，電子指數仍上漲0.13%，占大盤成交比重73%。
國泰金繼富邦金之後除權，不國填權息走勢相當緩慢，僅上漲0.4元，反而是即將除權息的元大金走強，漲幅逾1%，不過開發金、台新金都翻黑，金融指數也因國泰金除息影響，下跌0.06%，占大盤成交比重5.5%。
傳產族群今天一吐悶氣，由塑膠、汽車領銜反彈，漲幅都逾1%，各族群漲多跌少，僅有紡織、橡膠、玻陶收黑。
台股昨天內資自亂陣腳，內資法人結帳，加上融資恐慌大減，讓中小型股兵荒馬亂，不過昨天盤後公布三大法人進出，外資並未落跑，使得多頭軍心稍稍穩定。今天以平高盤開出後，全場都力守盤上，收盤也站回10日均線，唯一美中不足仍是成交量能，又縮至900億元以下。今天的股東會大秀，台積電僅撐住平盤，明日換鴻海接棒，鴻海的表現將更加關鍵，如鴻海能順利登高，搭配各族群維持良好輪動，台股仍有機會站回9269點5日均線之上，繼續呈現沿5日線往上的軌道行進。", ,wantgoo
