,Post_Date_Time,News_ID,Headline,Author,Article_Content,Related_Stock_Number,Source
0,2014-11-18 14:40,169622,台股盤後─選戰倒數主力快閃！太陽能生技重傷 棄守8888月線,鉅亨網記者胡薏文 台北,"【鉅亨網記者胡薏文 台北】美股道瓊、那斯達克指數漲跌互見，依舊維持高檔，亞股漲跌互見，不過台股部分，一早開高試圖反彈，但多頭信心脆弱，籠罩在九合一選戰倒數緊張氣氛中，電子軟腳，金融勉強撐盤，但今天災情最重的則是在中小型股，尤其是內資主力最愛的太陽能、生技，都出現「快閃」賣壓，大盤又上演開高走低，剛好位於8888點的月線，今天也未能守住。加權指數收盤時下跌25.32點，以8859.07點作收，成交值放大至787.16億元。
電子權值股部分，雖然股王股后力圖振作，挺住紅盤，但台積電、鴻海都被壓抑在盤下，華亞科成為權值股的領跌指標，跌幅逾半根，宏達電今天也疲軟，賣壓湧現，重挫逾4%，聯發科跌幅也達2%，所幸仁寶、可成等反彈，減緩電子指數跌幅。不過電子次族群部分，太陽能族群又被雙反干擾，烏雲罩頂，綠能、國碩、昱晶等多檔被打至跌停。電子指數下跌0.87%，占大盤成交比重71%。
金融族群今天默默扮演支撐大盤角色，兆豐金獨挑大樑，漲幅逾1.2%，華南金、第一金、永豐金、中信金也挺住紅盤，力挺金融指數上漲0.07%，占大盤成交比重4.9%。
傳產族群部分，今天仍以汽車類股最飆，漲幅達3.9%，油電燃氣反彈逾2.5%，塑膠族群也有特定買盤守護，漲幅逾1%，水泥、玻陶、造紙、百貨撐住紅盤，其餘各族群收黑，機電、電器、運輸、生技跌幅都逾1%。
在九合一選前，法人多認定大盤將以月、季線間盤整為主，不料電子無力、加上內資主力快閃，中小型股災情擴大，讓指數未能撐住8888點月線。以今天大盤失守月線來看，已跌破6條均線支撐，下檔無均線可依靠，如果要為大盤找支撐點，只有8788-8821點跳空缺口了。而此一跳空缺口，也被部分技術分析派認為是「島狀反轉」缺口，如果也守不住，大盤整理區間下檔，恐將續往8501點靠近。以今天盤面結構來看，權值股明顯抗跌，隨選戰進入倒數計時，也不排除權值股與小型股分道揚鑣，弱勢中小型股仍需提防有破底可能。", ,wantgoo
