,Post_Date_Time,News_ID,Headline,Author,Article_Content,Related_Stock_Number,Source
0,2014-07-29 18:30,124832,長黑破9400！外資又玩兩手策略？買超79億元 台指佈空,鉅亨網記者胡薏文 台北,"【鉅亨網記者胡薏文 台北】台股今天在亞洲股市中，再度「獨憔悴」，大盤開高走低，今天包括雙D、蘋概股、金融股都遭摜壓，加權指數收盤時下跌28.3點，以9391.88點作收，成交值放大至1329.5億元。大盤已連3天告別月線。外資今天在台股現貨市場買超79.74億元，不過在台指期貨部分，卻又開始佈空，轉為淨空單2000多口，頗有大玩「兩手策略」意味。內資在殺破9400點後，出現停損動作，投信賣超7.4億元，自營商大砍33.38億元，三大法人合計買超38.95億元。
外資買超玉山金、開發金各逾1.6萬張，中鋼1.5萬張、元大金1.1萬張，中信金、台積電各逾9000張，新光金、台新金、兆豐金、台泥各逾7000張，國泰金、南亞、華南金各逾6000張，佳世達各逾5000張，統一、F-中租、東元、遠東新各逾4000張。
外資賣超群創2.2萬張，宏碁1.1萬張，日月光6000多張，大眾銀5000多張，華邦電、華亞科各逾4000張，友達、昱晶、可成各逾3000張。
投信買超F-中租5000多張，群創、寶滬深各逾2000張，兆豐金、緯創各逾1400張，統一、聯詠、奇力新、瑞昱、東元、國泰金各逾800張。
投信賣超華亞科7000多張，聯電5000多張，中信金4000多張，日月光、元大金各逾3000張，仁寶2900多張，英業達、新日光、景碩、億光、潤泰新、晶電、長榮航、矽格各逾1000張。
自營商買超第一金、開發金各逾2000張，華新、合庫金、榮成各逾1000張，力成、台泥、聯強各逾700張。
自營商賣超群創1.7萬張，寶滬深1.6萬張、友達1萬多張，華亞科、佳世達各逾7000張，彰銀各逾5000張，緯創、聯電、新日光、國泰金各逾3000張，華邦電、FB上証各逾2000張，國碩、F-中租、彩晶、FH滬深、勝華、南科各逾1500張。
台股今天以長黑摜破9400點，雖然觀察盤後三大法人進出，外資仍站在買方，但內資大舉調節持股，也是導致盤面中小型股災情擴大的主因之一。外資今天雖在現貨市場買超，不過在台指期部分，卻出現空單加碼，轉為淨空單，近日外資在台指期佈局多空搖擺，也顯示外資對於指數部分，仍採取「邊看邊做」，並無明確方向。大盤已經連3天失守月線，且如未能儘速站回月線，月線恐將轉為下彎，對多頭更加不利，短線上大盤也恐有續往9220點與季線回測的壓力。", ,wantgoo
