,Post_Date_Time,News_ID,Headline,Author,Article_Content,Related_Stock_Number,Source
0,2014-12-08 14:50,175759,台股盤後─外資喊收割 內資憂大戶條款！9200站不穩,鉅亨網記者胡薏文 台北,"【鉅亨網記者胡薏文 台北】美股、陸股多頭續強，不過亞洲股市中，今天僅有韓股與台股面露愁容，台股早盤開高後，電子蘋概股隨外資喊「收割」，包括大立光、鴻海皆軟腳，聯發科也湧現賣壓，而內資部分，因傳出「大戶條款」只修不廢，內資氣勢也不如上周強勁，僅有生技、汽車續強，但大盤陷入盤下震盪，9200點未能站穩。加權指數收盤時下跌19.28點，以9187.29點作收，成交值縮至918.65億元。
電子權值股中，雖然大立光、可成等蘋概股11月業績續創新高，但有外資高喊「收割」，讓蘋概股今天臉綠，大立光跌幅達半根，可成跌幅也逾2%，鴻海跌幅逾1%，鴻準跌幅近5%，連面板雙虎也隨之軟腳，跌幅逾2%，IC設計龍頭聯發科跌幅達4.8%，讓電子指數無力回天，被壓抑在盤下，雖然中小型電子股中，包括網通等，搭上副閣揆張善政概念股題材，設備、零組件、車用等族群也各自表現，但電子指數仍下跌0.52%，占大盤成交比重降至66%。
金融族群中，今天由富邦金掌旗撐盤，漲幅逾1%，今天召開股東會的彰銀，也全場力守紅盤，雖然兆豐金跌幅逾1%，但其他官股行庫仍表態力撐，讓金融指數上漲0.16%，占大盤成交比重4.7%。
傳產族群部分，整體傳產族群表現相對抗跌，生技漲幅逾2%最強，汽車、化工漲幅都逾1%，水泥、食品、紡織、機電、玻陶、造紙、橡膠、運輸都挺住紅盤，其餘雖被壓抑在盤下，但僅有塑膠類股跌幅逾0.7%，其餘跌幅都在0.5%以內。
亞洲股市今天只有韓股與台股臉綠，其餘在陸股持續大漲帶動下，仍是一片紅通通。新閣揆毛治國今天正式上任，但台股並未上演慶祝行情，電子權值股反而籠罩在外資高喊「收割」蘋概股的陰霾中，股王大立光、鴻海等指標股都軟腳臉綠，雖然金融、生技、汽車等族群抗跌，但9200點還是未能站穩，所幸指數仍力守在5日線與各短中長期均線之上，盤勢雖陷入震盪，但短線暫時無礙偏多氛圍。這波台股成交量能明顯回升，上周日均量重回千億元水準內資歸隊為重要因素之一，而內資是因期待立法院可望廢除證所稅大戶條款，才進場卡位，但如今又傳出傾向「只修不廢」，也讓今天內資買盤力道似乎受限。短線上多頭如期盼攻勢再起，成交量能必須再度升溫，否則指數恐將再度陷入9100點上下橫盤震盪。", ,wantgoo
