,Post_Date_Time,News_ID,Headline,Author,Article_Content,Related_Stock_Number,Source
0,2014-11-10 11:36,164955,台股盤中─利多匯集＋選舉行情量能增溫 權值股領攻逾百點,鉅亨網記者楊伶雯 台北,"【鉅亨網記者楊伶雯 台北】美股上周五漲跌互見，台股本周10月營收及第3季財報都將全數出爐，加上新台幣升值、油價下跌、外資買盤回流及勞退基金將撥款可望為股市注入資金活水等利多消息，台股今(10)日開高走高，盤面上由權值股、電子股、金融股領軍，搭配集團年底作帳及選舉題材的激勵，預估量能可增至近千億元，盤中指數再攻上9000點，一度攻高至9062.25點，大漲149.63點。
美股上周五漲跌互見，道瓊工業指數收漲19.46點以17573.93點作收；NASDAQ指數收跌 5.94點以4632.53點作收；S&P500指數收漲0.71點，以2031.92點作收；費城半導體指數收跌5.81點，收在637.48點。
台股今日以8937.59點開出，上漲24.97點，在權值股、電子股、金融股領攻下，指數開高走高，盤中各類股齊揚，指數一度大漲逾140點，順利攻上9000點關卡之上，國泰證期顧問處協理簡伯儀指出，大盤在量能增溫下開高走高，預估量能可達約950億元，可望續向9100點關卡挑戰。
不過，由於KD指標出現高檔背離，在短多反彈的過程中，股價表現相對大盤弱勢的股票仍應適時減碼，今日推升大盤上漲的因素相當多，包括韓股大漲、新台幣升值、外資回流甚至是選舉行情的題材股表現等，都牽動大盤的表現。
盤面上電子權值股是領攻主流，以台積電的表現最為亮眼，法人預估台積電10月營收仍可望再創新高，加上外傳台積電有意攻封測將購買高通龍潭廠，股價以132.5元開高，一度拉高至134元，創下近3個多月來的高點；聯發科10月營收表現亮眼，激勵股價開高走高，盤中漲幅逾4.6%，同時帶動IC設計瑞昱、聯詠等股的漲勢。
蘋概股部分則是由股王大立光領軍，股價走高，一度衝達2220元，盤中漲幅逾2%，法人看好鴻海10月營收表現，股價以小黑盤開出後盤中翻紅漲幅逾1.8%，不過，可成盤中則是下跌，封測股的日月光、矽品，面板股的友達則是走弱。
在油價下跌的消息激勵下，汽車股包括和泰車、中華車、裕日車受惠於油價下跌及日圓貶值雙重因素，激勵股上漲，和泰車盤中攻達478元近漲停價位，創下波段高價；另外，航空股的華航、長榮航、航運股的長榮、陽明股價也上漲。
國際油價下跌，雖然對塑化原料報價造成衝擊，造成台塑四寶第4季營運展望保守，但台塑集團總裁王文淵喊話，認為油價再跌空間有限，台塑四寶台塑、南亞、台化、台塑化今日齊漲，也是多頭重要指標。
台股盤中大漲百點，各類股齊揚，電子股漲幅逾1.6%，尤以半導體股盤中漲幅逾2%最強勢，金融股也是強勢指標，盤中漲幅逾1.5%，汽車股漲幅逾4.6%，居各類股之冠，漲幅逾2%的還有塑膠、玻陶股等；以盤面上領漲指標來看，今日的利多激勵不同族群及個股的表現。", ,wantgoo
