,Post_Date_Time,News_ID,Headline,Author,Article_Content,Related_Stock_Number,Source
0,2014-10-02 16:13,150124,統一超Mister Donut估周年慶百貨門市業績成長2-3成,鉅亨網記者王莞甯 台北,"【鉅亨網記者王莞甯 台北】統一超(2912)轉投資甜甜圈專賣店「Mister Donut」今(2)日發表同步日本的全新秋冬季節商品「香橙巧克力系列」，其中更有台灣店獨家商品，藉此搭上百貨周年慶活動搶攻輕熟女下午茶市場，統一多拿滋總經理洪堯欣樂觀預期，周年慶期間百貨門市可望受到帶動，平均單店業績約可成長20-30%。
瞄準周年慶周邊龐大商機，Mister Donut以台灣消費者最愛的巧克力口味為基底並結合符合時令氣息的香橙，打造季節限定新口味，尤其添加只有在製作高級巧克力才會使用的cocoa mass(可可膏)，創造小資卻具高質感的甜點體驗，預期在百貨商場內的23家門市業績將可大幅受到帶動，估計單店至少可成長20-30%，
Mister Donut目前在台共有55家門市，預計年底前可達58家，其中5家是二代店，同時已有2家一代店正進行討論改裝中。
Mister Donut二代店擴大商品結構例如提供拉麵系列切入正餐市場，也提供手作咖啡，順利引進新來客、提高客單價，洪堯欣表示，二代店推出以來，業績平均較未改裝前成長達30%，也將陸續評估將此店型擴大引進百貨商場。
被問及是否因應日元貶值趨勢降價？洪堯欣回應，從日本原廠進口的原物料合約是一年一簽，進價非快速波動，且進口比重不高，多採用在地食材，再加上部分原料來自馬來西亞等非日本產地，採美元計價，所以暫無降價計畫，但未來簽約會跟日本廠商討論。", ,wantgoo
