,Post_Date_Time,News_ID,Headline,Author,Article_Content,Related_Stock_Number,Source
0,2014-07-29 09:50,124597,〈權證〉群創多方買盤燙手！寶滬深罕見成10大熱門標的,鉅亨網記者王莞甯 台北,"【鉅亨網記者王莞甯 台北】儘管台股大盤昨(27)日跌幅收斂，挺住9400點，加權指數收盤時下跌19.11點，以9420.18點作收，但觀察權證市場，在認售空方買盤持續轉強之際，認購成交額占總市場比重大減7個百分點至75%，創去(2013)年12月中旬以來新低，其中，群創(3481)買盤領先其他電子權值股，再加上罕見連結陸股的寶滬深(0061)、緯創(3231)等標的量能攀升，顯示大盤仍以各自表現為主要格局。
群創第2季全球9.1吋以上大尺寸面板和超高畫質(Ultra HD)電視面板，市占率都超越三星顯示器，拿下世界第2，僅次於南韓樂金顯示器(LGD)，消息激勵買盤，昨股價漲幅逾1.3%，認購成交額大增近5000萬元突破1.5億元，認購占比續增4個百分點至92%並創近期高點，也罕見拿下「認購王」寶座。
除了群創外，包括大立光(3008)、F-中租(5871)、聯發科(2454)、華亞科(3474)、可成(2474)和鴻海(2317)等皆為熱門標的，多方成交額均在億元之上，惟留意，量能皆為近期的相對低點，顯示多方擁護權值股的意願稍稍轉弱。
寶滬深是相當罕見進入前10大熱門榜的標的，在其股價日線連4紅，昨日更大漲超過5%下，多方也快速布局認購權證，欲搭上短線行情，認購量由日前僅千萬元左右一舉衝高至6000萬元上，其中，價內外15%以內、漲幅超過100%且成交量也突破千張的標的可參考富邦E9(072976)、EE中信(072236)。
永豐金證券衍生商品部進一步解釋，匯豐公布7月中國PMI初值升至52，創18個月新高，加上人行暫停收水、國務院會議提10項措施緩解企業融資成本高的問題，多項利多因素帶動陸股走高。
連結滬深300的ETF寶滬深近期表現亮眼，在打底約3個月後，近期股價突破頸線，昨日股價以一根帶量長紅K，一舉突破年線，相當強勢，投資人若持續看好陸股，可留意新掛牌、價平的永豐FE(079806)或AG兆豐(079109)。", ,wantgoo
