,Post_Date_Time,News_ID,Headline,Author,Article_Content,Related_Stock_Number,Source
0,2014-06-13 14:11,103493,禾瑞亞今年營運靠工控觸控支撐 消費觸控等待市場回溫,鉅亨網記者蔡宗憲 台北,"【鉅亨網記者蔡宗憲 台北】禾瑞亞(3556)今年受觸控筆電需求放緩影響，前5月營收為4.4億元，較去年同期減少22.4%，禾瑞亞指出，消費性電子觸控需求放緩，影響營收表現，不過隨著工控產品開始導入投射式電容觸控介面，禾瑞亞過去在此領域耕耘許久，因此可望受惠，也將是今年營運主軸，且工控觸控進入門檻高，不擔心對手進來搶單，預期今年工控觸控營收可逐季上揚，禾瑞亞也認為，工控觸控訂單穩定度高，獲利較好，將可成為禾瑞亞每年的穩定收益，至於消費性筆電觸控產品訂單波動度較大，但看好若需求回升，對禾瑞亞營運將是錦上添花。
禾瑞亞去年在筆電導入觸控的需求帶動下，營收衝上15.3益元，年增116.7%，隨著整體觸控筆電市場並未順利成長，禾瑞亞今年訂單明顯降溫，累計前5月營收僅達4.4億元，年減22.4%。
禾瑞亞表示，消費性機種訂單需求降溫，受限於終端市場對觸控筆電、二合一裝置與變形筆電等產品之接受度仍低，雖然產品趨勢正確，但市場仍偏觀望。
為穩定獲利，禾瑞亞積極布局工規觸控，禾瑞亞認為，在消費性電子大量採用觸控介面帶動下，工規產品也開始跟進，過去電阻觸控仍占一定比例，不過隨著時間演進，工規廠商也開始導入電容式觸控。
但由於工規需求數量少，樣式多，因此禾瑞亞認為，多數過暨大廠對此領域沒有太大意願，因此競爭情況較不激烈，且訂單周期長，客戶也穩定，因此利潤較好。
禾瑞亞指出，今年工控將扮演營運主力火車頭，但坦言要較去年成長有難度，而雖然短期消費性電子觸控需求仍有許多挑戰與不確定性，但禾瑞亞強調在該處也有所布局，因此若市場需求回升，對禾瑞亞營運將是錦上添花。", ,wantgoo
