,Post_Date_Time,News_ID,Headline,Author,Article_Content,Related_Stock_Number,Source
0,2014-10-14 14:30,155660,台股盤後─破底翻？電子反攻 護盤守金融 量縮先撐8700,鉅亨網記者胡薏文 台北,"【鉅亨網記者胡薏文 台北】美股又上演「殺尾」跳水，不過亞股投資人今天相對冷靜，韓股、港股小跌開盤後隨即翻紅，台股早盤也以低盤開出，失守8700點，但開盤2分半鐘就拉回到平盤，今天由電子族群中的聯發科、群創演出復仇秀，領軍反攻，護盤則是守護金融族群，讓金融免於被頂新、勝華拖累，大盤幾乎全場都力守8700點之上，「神秘客」尾盤集中火力砸下54億元，將指數拉高21點。加權指數收盤時上漲57點，以8768.39點作收，成交值縮至736.97億元。
電子今天展開反攻，聯發科、群創扮演「復仇」指標，雙雙漲幅都逾3%，和碩、可成、華碩、鴻準、矽品、台達電漲幅都逾2%，台積電、鴻海也都力守紅盤，中小型股部分，昨天在融資「自斷」後，今天賣壓稍緩，盤面也見到少數搶短資金卡位，太陽能族群中美晶、新日光，車用族群同致等，也都展開反彈走勢，勝華因聲請重整打入全額交割，持續重挫跌停，盤面上僅拖累介面，跌停家數已較昨日大減。電子指數上漲0.88%，占大盤成交比重降至68%。
金融權值股部分，今天由永豐金領軍，漲幅逾2%，彰銀、富邦金、國泰金、開發金、元大金漲幅都逾1%，穩住大盤陣腳，金融指數上漲1.11%，占大盤成交比重7.49%。
傳產族群部分，今天也努力打起精神，包括機電、橡膠、運輸、生技反彈都逾1%，不過觀光、營建跌幅仍逾1%，食品、塑膠、紡織、電器、造紙、油電燃氣仍壓抑在盤下。今天食品類股的災情已減緩，僅有味全、福懋油、興泰等3檔跌停，但尾盤生技族群又見買盤搶進，基亞又再衝上漲停。
以大盤今天的K線來看，開低拉高，以一根中紅K線，完全吞噬昨天的黑K實體，今天收盤指數甚至比昨天開盤指數還多出「1點」。雖然國安基金沒進場，官股行庫「天天買」，讓大盤跌勢減緩。以今天大盤走勢來看，開低後迅速拉回平盤之上，幾乎全場都力守紅盤，顯然「神秘客」努力守穩8700點，不過成交量縮，依舊是大盤隱憂。明日有10月台指期結算，以外資在台指期淨空單水位仍高，仍需提防外資壓盤，阻礙多頭往年線8860點回補。", ,wantgoo
