,Post_Date_Time,News_ID,Headline,Author,Article_Content,Related_Stock_Number,Source
0,2014-07-14 14:35,118681,台股盤後─台積電除息 股王＋金融補位！重登9500站回5日線,鉅亨網記者胡薏文 台北,"【鉅亨網記者胡薏文 台北】趁美股反彈，亞股多頭急忙回防，台股今天雖有台積電除息，蒸發指數21點，但早盤仍以平高盤開出，雖然台積電尾盤轉為貼息，但股王大立光補位，一鼓作氣衝過2500元，收盤登上2560元新天價，加上金融轉守為攻，成功彌補台積電除息蒸發的指數，大盤震盪走高，不僅重登9500點，也站回5日均線。加權指數收盤時上漲24.46點，以9520.30點作收，成交值縮至1098.88億元。
台積電今天除息3元，預估蒸發指數21點，雖然早盤台積電一度奮力往上，努力展開填息走勢，但中場過後不敵賣壓翻黑，讓台積電跌幅0.75%，轉為貼息，所幸股王大立光奮勇往上，登上2560元新天價，漲幅2.6%，鴻海也力守紅盤，面板雙虎友達漲幅6.5%，群創漲幅逾2%，聯發科、宏達電也都獲得買盤力挺，宏達電漲幅4.9%，不過中小型股仍然展現出「居高思危」相對疲弱，台達電、華亞科、可成、和碩等也被壓抑在盤下，電子指數仍下跌0.17%，占大盤成交比重72%。
金融今天再度上場救援，轉守為攻，國泰金大漲逾4%，富邦金漲幅逾3%，開發金、玉山金、永豐金漲幅也都逾2%，雖然官股行庫相對淡定，兆豐金僅守住平盤，但金融指數上漲1.97%，占大盤成交比重10.6%。
傳產族群今天漲跌互見，機電、橡膠、運輸、觀光漲幅都逾1%，但水泥、食品、塑膠、造紙、鋼鐵都被壓抑在盤下，其餘各族群則挺住紅盤。
台股多頭控盤技巧高超，今天台積電等多檔股票除息，蒸發指數達31點，原本空方打算以逸待勞，只要台積電不填息，指數即有跌破10日線的可能，沒想到多頭轉向拉抬金融股，並搭配股王大立光、面板雙虎等電子權值股，救援成功，空方沒討到便宜，指數登上9500點，也重返5日線之上，空方又挨了一巴掌！台股今天雖然量縮，但指數站上5日均線，仍是相當重要的關鍵，暫時化解5日均線下彎的危機。短線上，空方仍趁除權息高峰期虎視眈眈，多頭如未能儘速拉開與9500點差距，則近日的9500攻防戰，得時時提高警覺，提防空方偷襲。", ,wantgoo
