,Post_Date_Time,News_ID,Headline,Author,Article_Content,Related_Stock_Number,Source
0,2014-06-24 11:01,108747,愛瘋6認證未過關？可成：新專案照規劃進行 對傳聞不評論！,鉅亨網記者胡薏文 台北,"【鉅亨網記者胡薏文 台北】蘋果iPhone 6預定第3季季末上市，供應鏈都動起來，但外資圈傳出，有關iPhone 6金屬機殼部分，可成(2474)尚未通過蘋果認證。可成今天表示，對於新專案部分，目前仍照規劃進行中，對相關傳聞不評論。
可成今天股價表現，受到傳聞影響翻黑走軟，早盤跌幅逾1%。
可成約2周前召開股東會，當時可成董事長洪水樹以「豔陽天」來形容可成後續的業績表現，並表示可成自今年起，智慧手機可攜式產品占可成營收比重，正式超越NB。且可成今年的表現，下半年比上半年好，將呈現逐季往上，如以全年度的成長表現來看，今年將可優於去年的16.8%。
法人原本看好可成打進蘋果iPhone 6供應鏈，並成為iPhone 6金屬機殼訂單分配中，主要受惠者，但近日外資傳出可成金屬機殼部分，尚未獲蘋果認證通過，也擔心恐影響可成下半年業績成長力道。
不過可成重申，對於新專案目前仍照規劃進行中，且對6月業績仍有相當把握。", ,wantgoo
