,Post_Date_Time,News_ID,Headline,Author,Article_Content,Related_Stock_Number,Source
0,2014-10-03 17:20,150663,股王大立光達成點火 今成交值43.7億元僅次台積電,鉅亨網記者張欽發 台北,"【鉅亨網記者張欽發 台北】
台股股王大立光(3008)在成功投標標下台中精密機械科技創新園區的擴廠土地之後，昨日並通過資格審查，向取得土地再跨進一步，今天收盤上漲達120元，以2390元作收，其收盤漲幅達到5.29%，而今天成交量並走高到1855張，其成交值高達43.7億元，僅次於台積電(2330)64.46億元。
由蘋果推出的iPhone 6產品包括4.7吋及5.5吋手機在全球熱賣，10月17日並將正式在中國大陸的此一超大規模市場發售，今天由大立光早盤的開高走高並且帶動包括可成(2474)、華通(2313)、鴻海(2317)等蘋果概念股的走強，台股在半導體、光電及金融三大權值類股的強勢走高之下，集中市場加權股價指數收盤站上9106.28點。
就台北股市集中市場加權股價指數收盤上漲131.09點而言，大立光對於大盤雖然有點火立功，但由外資券商的統計顯示，今天貢獻集中市場加權股價指數漲點是台積電貢獻31.8點、鴻海貢獻9.3點、國泰金(2882)貢獻6.1點，再來才是輪到大立光的貢獻5.6點，第5名則是日月光(2311)的上漲貢獻5.5點。
聯華投顧證券及期貨分析師張陳浩說，在過去3天台股的盤勢明顯是市場以期貨帶動現貨的走勢，而在今天很明顯是市場操盤人以拉抬現貨以牽動期指上揚，藉此壓迫期指的空方勢力，這一股市場力道自然除了點火大立光個股之外，則以權值個股為主要的作多拉抬標的。
國泰證期顧問處協理簡伯儀則強調，不僅大立光今天的亮點表現，台股今天集中市場加權股價指數以跳空開高越過前3天高點，有助於醞釀出一個小規模的「島狀反轉」型態，也因此今天大盤漲幅超過2%的類股包括了光電、半導體及金融，但主要走勢是究竟是反彈亦或是回升，仍須視後續的人氣、量能及走勢才能研判，10月6日台股的表現也明顯相當關鍵。", ,wantgoo
