,Post_Date_Time,News_ID,Headline,Author,Article_Content,Related_Stock_Number,Source
0,2014-06-18 19:06,105961,亞太電、國碁合併換股比0.4975：1 鴻海持股23%成最大股東,鉅亨網記者楊伶雯 台北,"【鉅亨網記者楊伶雯 台北】
亞太電(3682)今(18)日在證交所召開重大訊息，說明董事會通過與鴻海(2317)集團旗下國碁電子簽定合併契約案，將經由換股方式進行吸收合併，亞太電為合併後存續公司，換股比為國碁1股換發亞太電0.4975股，合併後鴻海預計持有亞太電23%股權，成為最大股東；合併基準日暫訂為2015年6月30日。
亞太電發言人洪龍珠表示，亞太電為綜合性電信服務公司，主要業務是第一類及第二類電信事業，包含市內網路、長途網路、國際網路、第三代行動電話、且在2013年10月30日競標取得行動寬頻業務700MHz頻譜上下行各10MHz，目前第三代行動通信用戶約200多萬，行動上網用戶約70多萬戶；國碁則是取得700MHz頻譜上下行各10MHz及900MHz上下行各10MHz頻譜。
洪龍珠指出，合併將經由換股方式進行吸收合併，亞太電為存續公司，國碁為消烕公司，國碁目前最大股東鴻海預計持有亞太電23%股權，成為最大股東；目前每股淨值9.95元，合併加上註銷庫藏股後的資本額為430億元，雙方的合併將在各自取得4G特許執照後進行，暫訂訂合併基準日為2015年6月30日，她表示，亞太電預計第3季送件申請，預計在年底前開台。
她表示，這次吸收合併的換股比例以雙方約定基準日的亞太電每股市價與國碁每股淨值計算，亞太電每股市價定義為亞太電通過合併契約之董事會前20個營業日收盤價簡單算術平均數；但若計算結果低於每股20元，以20元為亞太電每股市價，國碁每股淨值以今年第1季經會計師核閱預計增資139.4億元(增資後國碁實收資本額為200億元)之擬制資產負債表為基準計算。
洪龍珠說，合併後亞太電將擁有700MHz頻譜上下行各20MHz及900MHz上下行各10MHz，合計上下行共各30 MHz的行動寬頻業務頻寬，將在未來行動寬頻業務上更具競爭力。
她表示，透過雙方垂直整合，亞太電將可順利與鴻海集團配合，進而成為其八屏一網一雲策略中重要的一網，此外，亞太電可成功整合串聯鴻海集團海內外的資通訊事業，並創造出有別於國內其他電信同業的差異化發展。", ,wantgoo
