,Post_Date_Time,News_ID,Headline,Author,Article_Content,Related_Stock_Number,Source
0,2014-09-18 08:55,145430,〈權證〉4大電子巨頭買氣飆 伍豐新黑馬助陣！,鉅亨網記者王莞甯 台北,"【鉅亨網記者王莞甯 台北】台股昨(17)日尾盤未能守穩9200點，加權指數收盤時上漲61.77點，以9195.17點作收，但盤中大漲百點的態勢已激勵權證市場多方信心，成交額明顯回升，推升認購成交額占總市場比重拉升8個百分點至73%，其中，聯發科(2454)、可成(2474)、鴻海(2317)和台積電(2330)多方量能大幅回升，再加上伍豐(8076)認購成交量倍增，成為另一匹黑馬。
工業電腦廠伍豐昨除權息，盤中漲停至162元成功步上填息路，伍豐轉投資的俄羅斯賭場預計12月前陸續完工，明年第2季開始營運，填息強勁力道推升多方在認購市場的表現，認購量倍增至逼近7000萬元，再創近期高點，多方占比則一舉回升11個百分點至86%。
認購王聯發科多方氣勢轉強，認購占比日增11個百分點至78%，創1周高點，量能也回升至1.7億元的高檔水位，同時，可成、華亞科認購量和多方占比也同步拉升，量能均增超過千萬元，其中，可成多方比提升6個百分點至84%，華亞科更一舉飆升23個百分點至60%，顯示權值股轉強的態勢已使多頭軍心轉穩。
永豐金證券衍生商品部表示，第三方支付專法將於年底前通過上線，其中，精誠(6214)搶攻行動支付商機，搭上iPhone6的「Apple Pay」風潮，近期股價帶量上攻收復所有均線，短中期均線翻揚，公司預估行動支付將於第4季開始貢獻營收。
若投資人看好精誠近期話題熱度，將帶動股價續攻挑戰年線60元以上價位，可留意新掛牌微價外的永豐NT(081654)，或極度價平的日盛HV(081247)。
另一方面，國內POS大廠飛捷(6206)的Mobile POS新品內建磁碼、晶片、NFC及二維條碼掃描器四合一載具，可支援NFC讀卡機功能，預計年底可開始出貨，飛捷股價近期自前波高點回落後反彈，若看好近期有表現，不妨參考新掛牌近價平的永豐nl(081610)。", ,wantgoo
