,Post_Date_Time,News_ID,Headline,Author,Article_Content,Related_Stock_Number,Source
0,2015-10-15 19:21,292185,外資大買權值股 買超台股114億元 惟蘋概股不受青睞,鉅亨網記者李宜儒 台北,"【鉅亨網記者李宜儒 台北】亞股大漲，激勵台股也擺脫前2天的盤整格局，開盤就跳空越過8600點大關，指數一度大漲近130點，全場指數都在8600點之上，終場上漲79.01點，以8601.52點作收。三大法人中以外資買超動作最大，大舉買超114.38億元，為9月17日以來單日最大量，投信買超2.83億元，自營商賣超3.63億元，合計三大法人買超113.58億元。
期貨部分，三大法人則是相對淡定許多，淨口數變化都不大，其中外資加碼多單786口，淨部位淨多單回升到2.4萬張以上，達24141口；自營商則是加碼空單626口，淨部位淨空單續升到3357口；投信回補空單74口，淨部位淨空單微降到4563口。合計三大法人今天加碼多單234口，淨部位淨多單微升到16221口。
今天矽品股東臨時會登場，確定鴻海與矽品結盟宣告失敗，不過外資卻出乎意料的，大買矽品、日月光及鴻海股票，而鴻海高居外資買超第3名、矽品與日月光也分居第5名及第7名。
面板雙虎群創，則因為有急單出現，也獲得外資買盤挹注，買超張數達40066張，高居外資買超首位；不過友達則反遭外資賣超1046張，外資操作呈現配對交易。
至於台積電及大立光今天下午雙雙舉行法說會，儘管台積電大砍資本支出，不過外資今天仍大買台積電達23068張，也是外資買超第2名。另外外資今天也暫緩對大立光提款，微幅買超12張。
蘋概股部分，除了鴻海、日月光獲外資大買外，外資買盤主要集中在鴻海旗下相關蘋果供應鏈，包括鴻準獲外資買超879張，F-GIS獲買超137張，F-臻鼎獲買超37張。其他像是華通，遭外資賣超2416張；F-TPK遭賣超1911張；可成遭賣超866張；國巨遭賣超473張；台郡遭賣超398張；F-鎧勝遭賣超340張；正崴遭賣超71張；和碩遭賣超61張。
另外外資對於金融股賣壓則稍有減緩，包括買超台新金、第一金、新光金、華南金、合庫金、遠東銀、兆豐金、永豐金、富邦金、國泰金、玉山金、三商壽、京城銀、國票金等。不過開發金則連續2天居外資賣超首位，中信金、元大金、台企銀仍仍遭外資賣超。
今天外資集中市場買超第1名為群創，買超張數40066張，第2名台積電，買超23068張，第3名鴻海，買超19883張，第4名聯電，買超12913張，第5名矽品，買超11498張。6到10名依序為，台新金，買超10615張；台灣50，買超8837張；中鋼，買超8481張；日月光，買超7739張；彰銀，買超5905張。
外資集中市場賣超第1名開發金，賣超張數12293張，第2名中信金，賣超4765張，第3名T50反1，賣超4723張，第4名中壽，賣超3806張，第5名華通，賣超2416張。6到10名依序為，台灣大，賣超2180張；晶電，賣超1956張；F-TPK，賣超1911張；華邦電，賣超1903張；台達電，賣超1598張。
法人指出，台股今天順利站上8600點大關，最主要的關鍵就是外資大買權值股，包括台積電、鴻海、矽品、日月光等，甚至對於大立光也轉賣為買，不過台積電下修今年全球半導體成長率為0，是否會引發外資在明天減碼台積電持股，值得觀察。另外，外資的台指期多單依然維持在相對高水準，基本上顯示外資仍看多台股後市，不過距離台指期10月契約結算僅剩不到1周，外資對於台指期11月契約的布局也值得注意。", ,wantgoo
