,Post_Date_Time,News_ID,Headline,Author,Article_Content,Related_Stock_Number,Source
0,2015-12-23 11:25,312584,台股盤中─集團、投信作帳 一舉突破月線及8300點雙關卡,鉅亨網記者楊伶雯 台北,"【鉅亨網記者楊伶雯 台北】美股周二大漲，台股連日則是在量能不彰下無力向上衝關，但距年底封關僅剩7個交易日，雖然外資開始放假，但投信及集團作帳行情啟動，成為今(23)日多頭衝關主力，早盤開小紅後一路往上拉升，一舉突破外攻不下的8300點及月線壓力，指數往上拉升呈現高檔震盪，集團股、原物料族群及股價淨值比低的個股表現相對搶眼。
在油價回穩下，美股周二收高，道瓊工業指數盤中一度大漲近200點，終場收高165.65點或0.96%至17417.27點；Nasdaq指數收高32.19點或0.65%至5001.11點；S&P 500指數收高17.82點或0.88%至2038.97點；費城半導體指數收高0.98點或0.15%至667.11點。
美股收高，有助穩定投資人信心，台股今日以8296.58點開出，小漲3.84點，指數開小紅後往上拉升，權值股、集團股聚集人氣，落後補漲股、原物料股也是資金青睞指標，大盤指數順利突破月線反壓，盤中拉升至8359.25點，上漲66.51點。
由於距年底封關僅剩7個交易日，投信及集團股作帳行情啟動，包括佳世達友達集團、中鋼集團、統一集團、台泥集團、永豐餘集團、長榮集團、億光集團、華新麗華等集團股都可見到著墨痕跡。
日月光(2311)再宣布公開收購矽品(2325)，將公開收購矽品24.7%股權，總持股將達49.71%，兩家公司今日股價齊揚，蘋概股部分，股王大立光(3008)走跌，但權值股台積電(2330)、鴻海、可成等股則是上漲的攻勢，面板雙虎友達、群創走揚。
NIKE概念股的寶成、豐泰股價齊揚，重新上市的億豐延續蜜月行情，傳產股幾乎是齊漲，其中水泥、橡膠、觀光等股盤中漲幅逾1%，金融股由富邦金、國泰金領攻推升指數。
法人認為，今日權值股回神，成為領攻指標，加上落後補漲及年底作帳等題材，大盤指數突破月線後續往上拉抬，維持高檔震盪，後續先守穩月線有助再往上攻。", ,wantgoo
