,Post_Date_Time,News_ID,Headline,Author,Article_Content,Related_Stock_Number,Source
0,2015-11-05 14:45,296593,台股盤後－和平紅利僅一日行情 獲利回吐賣壓湧 力守8800點,鉅亨網記者李宜儒 台北,"【鉅亨網記者李宜儒 台北】儘管總統馬英九出面召開記者會說明馬習會，不過市場持股過周末信心不強，股王撐盤也難擋高檔賣壓出籠，加上台積電、聯發科走弱，指數在平盤上下震盪，盤中一度回測8800點支撐，終場指數下跌6.84點，以8850.18點作收，成交量依然維持在千億元以上，為1061.38億元。
櫃檯指數則是在半導體及網路通信類股支撐下，指數全場都在平盤之上，終場小漲0.46點，以129.61點作收，成交量稍稍萎縮到274.86億元。
台股今天類股以玻陶類股表現最弱，跌幅達2.33%，至於油電燃氣、塑膠、觀光、半導體、汽車、食品、水泥、紡纖等走勢也偏弱。光電類股則是在大立光大漲推升下，類股指數大漲2.84%，生醫、貿易百貨、資訊服務、金融、電器電纜、化學生醫、網路通信、電子零組件等則力撐收紅。
今天台股強勢指標為股王大立光，走勢開高走高，開盤站穩2800元大關後，股價持續走揚，午盤過後攻克2900元大關，終場上漲130元，以2940元作收。股后漢微科則是虎頭蛇尾，盤中一度企圖挑戰1500元大關，終場漲幅收斂，僅小漲15元，以1430元作收。
另外第3季單季大虧55元的觸控面板廠F-TPK，儘管開盤一度大跌4.9元，不過在公司庫藏股發威下，股價隨即拉回到平盤附近整理，中場過後追價買盤湧現，股價持續拉高，終場攻上漲停，成交量更暴增到近9.8萬張，單日股票週轉率達27.8%。
蘋概股今天則是漲跌互見，指標股鴻海今天回跌0.5元，和碩則是小漲0.4元，機殼股表現最佳，可成上漲2元，鴻準也上漲1.1元，軟板廠F-臻鼎也小漲0.4元，台郡則是小跌0.4元。
金融股則是今天台股撐盤要角，兩大金控股國泰金及富邦金分別上漲3%及0.9%，至於統一證、元富證也因為台股成交量回升，表現穩健。彰銀、國票金、合庫金、中信金、兆豐金也收紅。
法人指出，近期台股漲多後，以目前台股主要均線均維持向上態勢來看，基本上還是多方氣勢較強，只要台股仍可守穩5日線、月線及季線，後市還是有挑戰9000點的機會，但漲多獲利了結賣壓難免，建議缺乏基本面支撐的個股仍不宜追高。", ,wantgoo
