,Post_Date_Time,News_ID,Headline,Author,Article_Content,Related_Stock_Number,Source
0,2015-03-30 14:45,214780,台股盤後─櫃買生技慘綠！封測雙雄、兆豐金力挺 搶救9500,鉅亨網記者胡薏文  台北,"【鉅亨網記者胡薏文  台北】美股反彈、陸股再創7年多來新高，台股今天略遭到摩台指結算干擾，反彈力道似乎遭到壓抑。台股早盤以平高盤開出後，台積電出現大單多空對決，努力穩住平盤，電子權值股轉由日月光、矽品封測雙雄，搭配鴻海穩盤，金融股也由兆豐挑大樑穩盤，讓大盤全場力守在9500點之上，橫盤狹幅震盪。不過櫃買生技族群一片慘綠，檢調查名嘴炒股加上美股生技傳出「泡沫化」疑慮，成為盤面重災區！加權指數收盤時上漲18.15點，以9521.87點作收，成交值縮至901.55億元。
電子權值股部分，今天台積電盤中明顯見到多空對決，台積電力守平盤，鴻準財報報喜，法人也預期鴻海財報亮眼，雙雙漲幅都逾1%，不過日月光、矽品挺身而出，漲幅都在半根以上，連台達電、華碩、可成漲幅都逾1%，抵銷研華、面板雙虎的弱勢表現。電子指數上漲0.03%，占大盤成交比重66.9%。
金融權值股部分，今天由官股行庫兆豐金領軍穩盤，兆豐金大漲2.4%，穩住多頭陣腳，國泰金、富邦金都力守紅盤，救援指數成功。金融指數上漲0.54%，占大盤成交比重5.4%。
傳產族群部分，今天上市部分，大部分均回穩，但上櫃族群，生技類股為重災區，重挫3.9%，拖累上櫃指數跌幅達1.2%。上市部分，今天包括水泥、紡織，漲幅都逾1%，成衣股王儒鴻並登上400元，再創掛牌以來新高價。機電、電器、化學、造紙、橡膠、汽車、營建、生技雖壓抑在盤下，但跌幅都在1%以內。
陸股再創7年來新高，亞股多頭趁機反攻，台股明顯受到摩台指結算干擾，台積電盤中出現頻頻大單多空對決，所幸台積電仍守穩平盤。電金權值股今天都有特定買盤守護的跡象，讓大盤全場穩在盤上狹幅震盪，指數也力守9500點之上，不過沒有特定買盤照拂的櫃買中小型股，生技股今天一片慘綠，上市、上櫃走勢再度呈現兩樣情！摩台指結算後，明日多空將另起新局，多頭力守的區間為前低9472點至9500點間，而空軍則是在月線9613點至跳空缺口9653點間，以逸待勞。清明連假前，盤勢暫以9500點上下震盪為主，多空雙方將在清明連假後，展開大部隊作戰！", ,wantgoo
