,Post_Date_Time,News_ID,Headline,Author,Article_Content,Related_Stock_Number,Source
0,2015-11-05 19:13,296816,自營商避險狂買ETF 外資重押大立光 三大法人買超118億,鉅亨網記者李宜儒 台北,"【鉅亨網記者李宜儒 台北】馬習會和平紅利效應僅一日行情，台股在電子權值股台積電、聯發科漲多回檔壓抑下，指數陷入高檔震盪整理，盤中一度回測8800點支撐，終場下跌6.84點，以8850.18點作收。三大法人今天持續同步買超台股，外資續買超45.36億元，自營商買超71.96億元，投信也買超0.6億元，合計買超117.92億元。
期貨部分，外資繼昨天減碼多單後，今天再減碼多單2462口，淨部位淨多單降到20995口。自營商續加碼多單290口，淨部位淨多單增加到969口，投信則持續小幅加碼空單110口，淨部位淨空單為7349口。合計三大法人今天減碼多單2282口，目前淨部位淨多單跌破1.5萬口，僅剩14615口。
自營商今天大買71.96億元，其中有68.13億元是來自於避險需求，其中主要買超的標的又是陸股ETF，包括滬深2X及上証2X買超張數分別高達16.2萬張及11.6萬張。法人指出，陸股近期稍有回穩跡象，加上券商又發了不少陸股ETF權證，因此被迫回補陸股ETF持股部位。
F-TPK今天高居外資買超第1名，張數達15928張，不過法人指出，這其中大多數應該是公司護盤的買超動作。另外外資今天買超的個股還是以電子權值股為主，包括晶圓雙雄台積電及聯電、封測廠日月光、DRAM股華亞科、NB代工股仁寶等，值得注意的是，外資今天對於金融股的賣壓也開始減緩，其中國泰金高居外資買超第1名，另外玉山金、台新金、合庫金、國票金、聯邦銀、永豐金、台企銀、台中銀、華南金、兆豐金、高雄銀等，外資買盤也都有進駐。
不過以消金為主的金融股，今天外資賣壓依然沉重，其中中信金高居外資賣超首位，元大金、新光金、富邦金、三商壽等，則仍遭外資賣超。
股王大立光今天大漲130元，外資是最大功臣，今天大舉買超658張，買超金額高達19.34億元，換言之，光是大立光一檔就佔了外資買超金額的42%。
另外蘋概股今天也成為外資倒貨的標的，其中軟板廠台郡遭外資賣超2298張，華通也遭賣超2167張，鴻準、和碩、F-GIS、可成、國巨等，也遭外資賣超。至於外資買超的蘋概股，則以買超欣興張數最高，但也僅有1015張，F-鎧勝、F-臻鼎、鴻海、正崴的買超張數都在300張以下。
今天外資集中市場買超第1名為F-TPK，買超張數15928張，第2名國泰金，買超9971張，第3名日月光，買超7152張，第4名聯電，買超6861張，第5名台積電，買超5290張。6到10名依序為，上証2X，買超4868張；玉山金，買超4804張；華亞科，買超4496張；智邦，買超4253張；仁寶，買超3937張。
外資集中市場賣超第1名中信金，賣超張數32466張，第2名群創，賣超12191張，第3名元大金，賣超5369張，第4名友達，賣超4994張，第5名新光金，賣超3812張。6到10名依序為，華航，賣超2606張；台郡，賣超2298張；華通，賣超2167張；富邦金，賣超2057張；瑞儀，賣超1940張。
法人指出，雖然今天外資大買F-TPK，但是就外資整體買超對象來看，主要還是以電子權值股為主，儘管外資持續調節台指期多單部位，但就外資在台期指多單部位還有超過2萬口來說，外資偏多的心態還是沒變，只不過在短線漲多下，進行的部分獲利了結動作。隨著台股5日線、10日線、月線及季線都維持向上走勢，目前半年線雖然還是呈現向下，若是短期均線能向上突破半年線，則台股還是偏多看待。", ,wantgoo
