,Post_Date_Time,News_ID,Headline,Author,Article_Content,Related_Stock_Number,Source
0,2015-08-21 19:15,274760,10年線失守 三大法人賣超98億元 外資淨部位多單近8000口,鉅亨網記者李宜儒 台北,"【鉅亨網記者李宜儒 台北】台股今天受到國際股災蔓延，開盤就跌破8000點，指數開低走低，7900點及7800點也接連遭摜破，終場大跌242.89點，以7786.96點作收，跌幅達3.02%，10年線宣告失守。外資今天續賣超73.27億元，投信賣超6.31億元，自營商賣超19.35億元，三大法人合計賣超98.94億元。
外資雖然持續在現貨市場賣超，不過在期貨市場卻是連續4天加碼多單，今天又再加碼多單4408口，淨部位擴大到淨多單7990口，淨多單口數也是7月1日以來新高。另外自營商今天則是持續加碼空單3745口，淨部位淨空單增加到9310口；投信則是小幅加碼空單371口，淨部位為淨空單664口。合計三大法人加碼台指期多單292口，淨部位淨空單為1984口。
今天外資買超標的轉為以電子股為主，包括中華電、華通、茂矽等，另外鴻海也重回外資買超標的，而今天被打到跌停的F-TPK，外資今天也大買2059張。至於光碟股中環及錸德，也紛紛獲外資買超。傳出將併購矽品的日月光，更成為外資今天買超第1名。
外資賣超部分，面板雙虎群創及友達依然遭外資賣超，群創更是外資賣超首位，晶圓雙宏台積電及聯電也雙雙遭外資賣超，DRAM股華亞科及南科也續遭外資賣超。
至於外資對於金融股依然站在賣方，除了玉山金、大眾銀及永豐金是外資買超，其他包括中信金、開發金、元大金、兆豐金、華南新、新光金、第一金等，外資依然將金融股當成提款機。
權值股部分，外資賣超大立光40張，賣超台塑2947張，連12賣；買超南亞736張，終止連6賣；賣超中鋼11438張，連21賣；賣超台達電2114張，連5賣；買超日月光8791張，連4買；買超矽品244張，終止連4賣；賣超華碩45張，連2賣；賣超可成2742張，連6賣；賣超富邦金669張，連2賣；賣超國泰金2204張，連9賣。賣超聯發科2057張。
今天外資集中市場買超第1名為日月光，買超張數8790張，第2名中環，買超8708張，第3名中華電，買超8364張，第4名鴻海，買超7859張，第5名華通，買超7187張。6到10名依序為，玉山金，買超5221張；大眾銀，買超4764張；統一，買超3938張；茂矽，買超2105張；F-TPK，買超2059張。
外資集中市場賣超第1名群創，賣超張數28823張，第2名聯電，賣超18981張，第3名台灣50，賣超16106張，第4名台積電，賣超13678張，第5名中信金，賣超11849張。6到10名依序為，中鋼，賣超11437張；開發金，賣超9004張；元大金，賣超8757張；華航，賣超8452張；兆豐金，賣超8254張。
外資店頭市場買超第1名世界，買超1633張，第2名海灣，買超427張，第3名樂陞，買超352張，第4名合晶，買超315張，第5名東洋，買超313張。6到10名依序為，F-泰鼎，買超253張；華美，買超250張；F-通訊，買超195張；擎泰，買超194張；皇田，買超189張。
外資店頭市場賣超第1名台燿，賣超680張，第2名千附，賣超511張，第3名璟德，賣超480張，第4名茂迪，賣超470張，第5名同亨，賣超465張。6到10名依序為，廣積，賣超459張；日盛金，賣超448張；先豐，賣超373張；單井，賣超355張；旺矽，賣超352張。
法人指出，以今天台股大跌的點數來看，外資雖然賣超，但是幅度並不算太大，不過外資已經在期貨市場先行布局，加碼多單，因此短線上台股因為國際股市震盪而出現重挫，但是如果外資沒有大量的將資金匯出，基本上還可以不用太擔心，應該還是要觀察政府後續還會不會哪些救市動作，來讓台股重新回到10年線之上。", ,wantgoo
