,Post_Date_Time,News_ID,Headline,Author,Article_Content,Related_Stock_Number,Source
0,2015-11-12 08:34,300825,券商分析摘要,鉅亨台北資料中心,"【鉅亨台北資料中心】◆券商推薦個股排行： ◆ 統一證：
自上周五起陸續傳出MSCI台股權重可能遭到下調，證所稅不會修正疑慮升溫，美國於12月升息機率增加及台灣出口連九黑等利空消息衝擊台股影響，台股連續五個交易日收黑下挫，加上外資現貨操作自上周五開始由買轉賣，且淨多單也累計減少了7000餘口，和平紅利利多夢碎，台股走勢疲弱。後勢多空觀察重點如下：第一、上週五美國10月非農人數遠優於市場預期，強化市場對美國升息預期，加上本周一Fed波士頓分行總裁羅森格倫表示強勢美國經濟，可望增加Fed在12月升息的可能性。由於羅氏向來為鴿派，因此他的升息言論被視為Fed鴿派也開始向12月升息的立場傾斜。美國12月可能升息的預期增溫，資金有回流美國疑慮，資金面不利台股後續表現。第二、國內經濟部份，財政部公布10月海關進出口貿易概況，10月出口僅239.4億美元，出口年減11%，出現連9黑，雖然減幅已創近五個月最小，但市場仍難掩擔憂情緒，恐不利台股後續表現。第三、立法院國民黨團版證所稅修正案周五闖關，由於議程的延後加上朝野黨團傳出意見分歧消息，原本預期證所稅可望廢除的利多恐生變數，恐將使台股投資人心態轉趨保守。第四、就技術面觀察，台股昨日跌破8500點的頸線支撐點位，加上五日均線與十日和月均線死亡交叉且將加速下彎，台股先前的多頭格局已經被明顯破壞，加上外資近四個交易日中有三個交易日大賣台股百億元，台股後勢失去資金動能加持，整體後勢看法轉為保守。 ◆ 大昌證券：
台股昨日開高走低，早盤一度在平盤附近震盪，但不見買盤介入，反倒賣壓湧現一路摜壓，失守8500整數關卡，終場以下跌121.89點作收。三大類股全盤皆墨，金融指數跌破月線、季線支撐，目前尚未止穩跡象。而電子族群也跌破月線支撐，也有回測季線之疑慮，權值股持續走弱，強勢族群表現零星，觀察接下來有無主流族群出現。傳產類股僅觀光、塑化、食品族群逆勢抗跌表現，另外汽車零組件部分個股創波段新高。而櫃買指數相對加權指數弱勢，跌破月線，但仍需留意營收表現較不佳的中小型個股。 ◆ 新光證：
蘋果股價重挫、MSCI週五可能連九降台股權重、美12月可能升息、證所稅朝野仍未完成協商，11日台股開高走低，除食品、塑膠及觀光股逆勢上漲外，其餘慘跌，使得大盤再失8500點關卡，終場加權指數收在 8415.01點，下跌121.89點或1.43%，成交額979.94億元。OTC指數收在 124.02點，下跌2.2點或1.74%，成交額269.86億元。雖然蘋概股 10月營收亮眼，國安基金只進不出，但市場充斥利空消息，使得台股連五天收黑K棒。籌碼方面，外資及投信連四天賣超，金額擴大逾125億及5.14億，自營商則是連二賣，金額為38.04億。考量技術及籌碼面偏空，12月美國可能升息，外資不停調節台股，證所稅不確定性因素仍大，指數恐再下探季線，建議觀望為宜。
◆ 大慶證：
從昨日盤面來看， 受到美元指數持續攀升，使得外資持續將資金自台股中抽離，加上本週五證所稅將再度三讀闖關，在諸多不利因素以及不確定性刺激下，電子股再度成 為外資調節重點，半導體權值股龍頭台積電雖然跌幅有限，但 包括之前因合併題材而暴漲的聯發科、聯詠都成為外資調節首選，半導體族群內僅有部份個股因季報以及十月業績優於預期而上漲，其餘大多修正。蘋 果概股方面也維持弱勢，包含可成、大立光、F-臻 鼎都 持續下跌，加上市場對蘋概股有所疑慮，因此在大盤面臨轉折之際，不建議低接。 傳產股部份，族群性也不明顯，僅有F-美食季報表現優異，以及神隆業績有轉折而大漲，其餘多是跌深反 彈，建議先行觀望為佳。盤面特色仍是反應季報與營收，可持續尋找績優標的操作，長線主流仍以非手機用PA、汽車電子、光纖、環保、業績生 技股為主流，為可持續偏多操作的方向。", ,wantgoo
