,Post_Date_Time,News_ID,Headline,Author,Article_Content,Related_Stock_Number,Source
0,2015-11-04 08:00,296057,台股盤前─兩岸關係或將突破 資金助攻台股走揚,鉅亨網記者張欽發 台北,"【鉅亨網記者張欽發 台北】台北股市在11月2日出現由傳產、金融及電子多重主力引導的反彈格局，其中蘋果概念股走勢仍為市場一大重心，而在今天台北股市呈現價量齊揚的走勢中，大盤上漲98.42點衝破8700點以8713.19點作收，成交值放大為964.59億元，在總統馬英九及中共國家主席習近平敲定將會面同時，被視為兩岸關係歷年最大的突破，國泰證期顧問處協理簡伯儀指出，這對兩岸產業的整合將有助益。
同時，簡伯儀也針對台股今天可能的走勢指出，昨天台股集中市場出現價量齊揚的走勢，同時，在月線上揚的助漲威力之下，市場氣氛也轉佳，外資台指期多單未平倉口數躍升到2.6萬口的近期新高，顯示台股在各項期待之下，進一步挑戰集中市場加權股價指數轉向上挑戰8800點。
而再以今晨收盤的美股收盤數據來看，也有不錯的表現，收盤道瓊工業指數上漲 89.39 點，或 0.50%，收在 17918.15 點。標普 500 指數上漲 5.74 點，或 0.27%，收在 2109.79 點。那斯達克指數上漲 17.98 點，或 0.35%，收在 5145.13 點。
就台北股市而言，大盤上漲98.42點衝破8700點以8713.19點作收，成交值放大為964.59億元，其中5大蘋概股今天囊括了台股177億元的成交值，其中大立光(3008)個股的成交值以51.61億元居台股個股第一名；而台股成交值第2名的則為中國大陸紫光集團點名參股的IC設計業龍頭聯發科(2454)成交值48.1億元。
事實上，大立光11月2日早盤以2680元高盤開出後即呈現高檔振盪，終場以2745元作收，較昨日上漲105元或3.98%，成交量放大為1896張，個股的成交值以51.61億元居台股第一名，市場專家陳唯泰則指出，大立光的收盤股價已明顯突破其下降趨勢線，更成市場多頭的重要指標。
而外資昨日在台北股市買超金額為105億元，其中買超大立光358張，這是大立光連兩日獲外資的買超；大立光預計5日公布其10月營收，在蘋果新機出貨及非蘋陣營的手機上市案加速之下，預計其10月營收明顯優於9月的表現。
台股集中市場成交值昨天為964.59億元勝過昨日的787.62億元，昨日台北股市的成交值前5名蘋概股，合計今天囊括了台股177.84億元的成交值，以大立光的51.61億元居第一，台積電(2330)成交值46.13億元居次，F-TPK(3673)33.78億元，機殼廠可成(2474)23.98億元排名第4名，第5名鴻海(2317)成交值22.34億元。
簡伯儀也強調，在各上市櫃公司第3季財報公布的效應也為幫助台北股市的重大聲勢，也值得投資人引以為參考。
如PCB上游原物料玻纖布廠富喬工業(1815)2015年第3季財報單季稅後盈餘達1.44億元，較上季大增95%，股價昨天大受激勵，股價以開高走高並鎖住漲停11.4元價位。", ,wantgoo
