,Post_Date_Time,News_ID,Headline,Author,Article_Content,Related_Stock_Number,Source
0,2015-10-01 12:20,287903,台股盤中—國安基金說好隨侍 大漲百點站回8300點,鉅亨網記者蔡宗憲 台北,"【鉅亨網記者蔡宗憲 台北】台股今受美股大漲帶動，加上國家隊護盤，國安基金年底前不會退場，以及台幣強升，早盤指數平盤附近震盪，不過午盤前多頭奮起，指數向上強攻，一度站回8300點以上，收復5、20日均線，盤面上電子與金融權值股扮領頭羊，台積電、國泰金、富邦金、台塑等漲幅都逾1%以上，高價股由漢微科大漲逾4%領軍，碩禾、為升也有3%以上漲幅，盤面類股以運輸、汽車股漲勢更猛，電子股則由半導體帶頭衝，指數開平走高大漲百點站回8300點，指數帶量可望持續往季線關卡靠攏。
美股昨日大漲235點作收，帶動亞股今日表現強勢，台股電子與金融權值股多頭回神，台積電漲幅近2%，國泰金、富邦金上漲逾1%，傳產權值如台塑、南亞、台化等也有逾2%漲幅，電子股聯發科、台達電、中華電、台灣大等也都撐在平盤以上。
高價股表現更強，大立光小漲震盪，漢微科則強攻半根漲停，為升、和泰車等漲幅也逾4%，儒鴻、可成、精華、浩鼎與網家等，也都撐在平盤上小漲。
盤面上運輸類股走勢最猛，長榮航、萬海大漲逾6%，華航、陽明、興航、長榮、宅配通、大榮、漢翔等漲幅都逾2%以上；汽車股走勢也強競，和泰車大漲5%，F-廣華、中華、裕隆等漲幅也逾1%。
電子股則由半導體領軍，台積電大漲衝鋒，威盛漲停鎖住，祥碩、敦泰、偉詮電、致新等漲幅逾4%，菱生、聯傑、華亞科、聯發科、聯詠、瑞昱、迅杰、日月光、嘉晶與華邦電等，也有逾2%漲幅。
電子零組件表現也亮眼，康舒漲停鎖住，宏致、環科、南電、欣興、連昌、全漢、健鼎、漢荃等漲幅也逾3%以上。
金融股成交比重也達1成，京城銀、華南金、中壽、富邦金、永豐金、開發金、元大金、大眾銀、國泰金、國票金、三商售、第一金、台企銀等漲幅都逾1%以上。
整體而言，雖然金管會主委曾銘宗強調今日國家隊並未進場護盤，不過資金點火權值股，多頭持續表態上攻，指數今日預估量未破千億元，但已收復8200點支撐，法人看好後續指數量能跟上，可望持續往季線與8500點反壓靠攏，盤勢有利多方。", ,wantgoo
