,Post_Date_Time,News_ID,Headline,Author,Article_Content,Related_Stock_Number,Source
0,2015-10-21 18:58,293193,外資台指期多單跌破2萬口 三大法人買超59億元,鉅亨網記者李宜儒 台北,"【鉅亨網記者李宜儒 台北】台股今天受到台指期10月契約結算干擾，獲利了結賣壓湧現，權值股台積電、鴻海、聯發科等走跌，盤中一度跌破8600點，終場指數下跌44.37點，以8609.23點作收。三大法人則是持續由外資領軍買超，外資續買超40.06億元，投信賣超2.43億元，自營商轉為買超 22.28億元，合計三大法人買超59.90億元。
期貨部分，儘管台指期今天結算，三大法人則是轉倉到11月合約，但均呈現減碼多單的操作方式，其中又以自營商最為看空，一口起減碼多單達4144口，目前淨部位轉為淨空單3610口。外資也減碼多單2000口，不過淨部位仍維持淨多單近2萬口，為19113口。投信則持續加碼空單353口，淨部位淨空單繼續維持在5000口以上，為5437口。合計三大法人今天減碼多單6497口，淨部位淨多單降到10284口。
儘管今天外資在現貨市場仍持續買超，不過值得注意的是，外資一手賣超台灣50，另一手也買超T50反1，顯示台股目前到了8600點附近，外資態度不看空，但是對於台股是否能繼續攻高已經有所懷疑，再加上外資也減碼台指期多單部位，預料台股後續恐將陷入盤整格局。
外資今天買超金融股相當用力，雖然包括中信金、開發金、兆豐金、華南金、台新金仍維持賣超，不過在買超前10名當中，金融股就佔了6檔，包括富邦金、玉山金、三商壽、彰銀、國泰金、新光金等，另外第一金、永豐金、元大金、合庫金、國票金等，外資也是買超，顯示外資已提前押寶明天即將召開的金保會。
股王大立光今天力守平盤，不過外資賣超仍未減少，繼昨天大賣342張後，今天續賣超48張。
同時外資對於蘋概股今天買賣超的個股檔數差不多，但買超力道略大於賣超，買超的蘋概股部分，則是以F-TPK最多，達2948張，買超日月光2106張，買超和碩1208張，買超正崴1001張，買超F-臻鼎951張，買超瑞儀669張，買超F-GIS 183張。
至於外資賣超蘋概股部分，其中賣壓最重的是機殼股，外資今天大砍可成1480張，鴻準也遭賣超1117張，其他包括欣興遭賣超873張，台郡遭賣超211張，鴻海遭賣超87張。
另外在紡纖族群部分，儒鴻今天重回500元之上，外資今天也貢獻不少，買超張數達1847張，不僅是連5天買超，同時也是今年1月21日以來單日買超最大量。
雙D族群今天因為報價趨跌而重挫，不過外資卻勇敢搶進華亞科15421張，為今天買超首位，同時外資也買超南科217張；然而外資對於面板雙虎則缺乏信心，大砍友達30816張，是今天外資賣超首位，另外也賣超群創2878張，終止連4買。
今天外資集中市場買超第1名為華亞科，買超張數15421張，第2名台積電，買超8801張，第3名富邦金，買超7361張，第4玉山金，買超6766張，第5名南亞，買超4674張。6到10名依序為，中華電，買超4106張；三商壽，買超3867張；彰銀，買超3614張；國泰金，買超3453張；新光金，買超3101張。
外資集中市場賣超第1名友達，賣超張數30816張，第2名中信金，賣超27822張，第3名兆豐金，賣超6694張，第4名旺宏，賣超5153張，第5名開發金，賣超3958張。6到10名依序為，群創，賣超2877張；億光，賣超2484張；台灣50，賣超2289張；華南金，賣超1977張；益航，賣超1741張。
法人指出，台指期結算後，目前干擾台股的因素也減少，目前最大的變數在於廠商即將陸續公布的第3季財報及法說會。由於台股今天收盤跌破5日線，顯示指數在8600點附近要再大幅上攻的難度已明顯增加，如果明天能重新站回5日線，則台股還有機會維持之前沿5日線緩步墊高的走勢，反之，若無法站回5日線，台股就可能回到5日線及月線之間進行盤整。", ,wantgoo
