,Post_Date_Time,News_ID,Headline,Author,Article_Content,Related_Stock_Number,Source
0,2015-12-03 18:00,306569,資金輪動題材股吸金 月季線糾結 三大法人買超15億,鉅亨網記者李宜儒 台北,"【鉅亨網記者李宜儒 台北】國際股市回檔整理，台股一度跌破季線及8400點，隨著資金從生技股回流到電子股，指數也緩步拉回到平盤上，終場小跌1.34點，以8456.06點作收，稍稍跌破季線8457點，但也順利收復月線8444點。三大法人持續由自營商表現，買超21.97億元，外資轉為賣超1.85億元，投信續賣超4.91億元，合計仍買超15.2億元。
期貨部分，外資今天則是加碼多單919口，淨部位淨多單為22605口；自營商也回補空單258口，淨部位為淨空單19口；投信持續回補空單75口，淨部位淨空單為8061口。合計三大法人今天加碼多單1252口，淨部位淨多單為14525口。
台股今天在成交值不足以推升指數大舉強彈下，仍由題材股負責撐盤，包括奇鋐、智邦、新日光、華亞科、微星，甚至是集團作帳目標的華邦電，都見到外資買盤湧進。權值股部分，則是以IC設計為主，其中外資仍看好並加碼龍頭廠聯發科，同時也加碼買超台積電。
反觀LED及面板因為中國產能持續開出，外資也持續砍單，其中晶電遭外資大賣1.2萬張，友達也遭外資賣超1.05萬張。另外金融股持續遭外資賣超，包括台新金、第一金、兆豐金、國泰金、富邦金、永豐金、華南金等，外資都繼續減碼。
另外外資對於蘋概股，今天則是轉為保守，包括華通、鴻準、鴻海、F-TPK、正崴、日月光、可成、F-臻鼎、大立光、都均遭外資賣超。
值得注意的是，功率放大器族群也默默成為外資加碼對象，包括全新，以及上櫃的宏捷科及穩懋，今天也都是外資加碼標的。
而今天生技股王浩鼎遭主管機關關禁閉，外資並未受到影響，反而是逢低加碼，今天買超66張，中止連2賣，反倒是中裕新藥、東洋，卻反遭外資賣超，顯示外資對於浩鼎的信心依然相當充足。
今天外資集中市場買超第1名為玉山金，買超張數7702張，第2名中壽，買超5490張，第3名奇鋐，買超4855張，第4名華亞科，買超4794張，第5名新日光，買超3212張。6到10名依序為，華邦電，買超3095張；中信金，買超3056張；全新，買超2989張；台塑，買超2745張；聯發科，買超2741張。
外資集中市場賣超第1名晶電，賣超張數12008張，第2名中鋼，賣超11514張，第3名友達，賣超10558張，第4名仁寶，賣超6888張，第5名台新金，賣超6533張。6到10名依序為，第一金，賣超6393張；T50反1，賣超6020張；台玻，賣超5382張；陽明，賣超5158張；兆豐金，賣超4946張。
國泰證期顧問處協理簡伯儀表示，這兩天外資在台股現貨及台指期的操盤動作明顯減小，主要的控盤者還是內資，因此權值股的買盤力道本來就會比較弱，中小型股還是主流，而且對盤勢比較健康的是，台股今天資金呈現輪動，包括從生技及太陽能，轉到IC設計，而生技股內部也有輪動跡象，高價的新藥股如浩鼎、中裕新藥等休息，改由中低價位的個股表現的。
另外從技術線型來看，台股今天的月線是向下穿越季線，不過就近期台股表現來看，包括5日線、10日線都在月線之下，並逐漸翻揚向上，等到5日線、10日線向上穿越月線後，月線就有機會反轉向上。", ,wantgoo
