,Post_Date_Time,News_ID,Headline,Author,Article_Content,Related_Stock_Number,Source
0,2015-09-09 08:34,280783,統一期貨台股期指盤前－利空量縮，台股重拾8000點,鉅亨台北資料中心,"【鉅亨台北資料中心】◆盤勢分析
週一美國因勞動節休市，週二亞洲股市普遍在平盤附近震盪，台指期在周一財政部公布8月出口年減率達14.8%的利空下以小低盤開出，早盤多方買盤進駐穩盤，包括台積電、可成、聯發科與友達等大型股走升穩定盤勢，隨後大盤在盤上小幅震盪整理，尾盤加權指數拉抬收復8000點大關，不過觀望氣氛濃厚成交量依然低迷，現貨成交量僅661億元創下今年次低量；台指期同樣在平盤附近震盪觀望，尾盤在現貨指數站回8000點激勵下拉升，終場台指期以小漲作收，最大特色在於逆價差持續收斂至-25.50點，技術面呈現反彈後收斂整理型態，短期趨勢可能偏向區間盤整。電子在指標權值股回穩的激勵下同樣開低走高，月均線成功站穩，短線趨勢可能呈現盤堅格局，金融雖開低震盪尾盤積極撐盤仍以小黑作收，均線反壓仍未突破，短期盤勢可能震盪偏弱，非金電開低走穩，為盤收紅，盤勢軟中透堅；台指期上漲46點，逆價差25.5點，電子期上漲2.3點，逆價差1.49點，金融期下跌2點，逆價差0.09點。台指期上漲逆價差縮小，期貨追價力道相對強勁。
台指期未平倉部位分析，自營商淨空單減少1,046口，淨空單部位10,712口；投信淨空單減少45口，淨空單部位1,758口；外資淨多單增加383口，淨多單部位24,511口；外資賣超現股31.3億元，期貨淨多單增加，看法中性偏多。
技術面觀察，台灣出口衰退利空再度測試大盤，國際股市震盪整理加權指數量縮觀望，所幸中國股市再度測試3000大關後出現反彈，有望激勵國際股市回穩，不過台股現貨量能再度萎縮，觀望氣氛濃厚，市場追價力道偏向保守，終場台股雖收漲站回8000，短線仍可能持續震盪。外資現貨賣超，期貨淨多單小增，8000點整數關卡附近區間盤整格局居多。
◆選擇權分析
多空就選擇權籌碼觀察，賣權/買權未平倉比由0.88小升至0.89，仍為偏空格局。在最大未平倉量序列部份，買權維持為8300點，賣權維持為7400點，外資選擇權淨空單部位約4.14萬口。", ,wantgoo
