,Post_Date_Time,News_ID,Headline,Author,Article_Content,Related_Stock_Number,Source
0,2015-08-31 18:45,276825,神奇拉尾盤 三大法人卻賣超18億 外資期貨減碼5800口,鉅亨網記者李宜儒 台北,"【鉅亨網記者李宜儒 台北】MSCI季度權重調整在今天台股尾盤發酵，最後一檔爆出205.84億元大量，推升指數暴漲108.54點，終場台股上漲155.74點，以8174.92點作收，攻克月線，成交量1008.89億元。不過外資則由買轉賣，賣超3.61億元，投信賣超3.78億元，自營商賣超10.73億元，合計三大法人賣超18.12億元。
另外外資在期貨市場也中止大幅減碼多單5874口，淨部位淨多單縮小為21603口。自營商及投信則是雙雙回補空單，分別回補1935口及165口，淨部位分別維持淨空單11527口及242口；合計三大法人減碼多單3774口，淨部位淨多單跌破萬口，僅剩9834口。
新的MSCI季度權重在今天台股盤後生效，根據外資買賣超紀錄觀察，其中群創成為外資今天買超首位，中止之前連11賣超，另外台積電、鴻海也分獲外資買超，其中鴻海更是外資在8月以來，第2次連續2天買超。
觀察權重遭調降個股，除了群創及台積電獲買超外，聯發科也獲買超613張，研華買超27張，潤泰新買超116張，台新金買超2603張；至於開發金續遭外資賣超6374張，連續9天賣超；宏達電賣超3338張，聯電也遭賣超9588張，另外在權重調升個股部分，除了仁寶，外資買超3074張外，其他均為賣超，包括遠傳賣超539張，F-臻鼎賣超1115張，玉山金賣超3292張，華航賣超3958張，陽明賣超6587張，可成賣超185張，日月光賣超23912張，中鼎賣超174張。
外資今天主要買超的標的，除了群創、台積電、鴻海外，華亞科、中華電、華通、欣興、台郡、金像電、廣達、台達電、華碩、力成、南亞科、中磊、緯創、燿華等。金融股部分則有永豐金、第一金、台新金、遠東銀、元大金、彰銀、大眾銀、三商壽、台中銀。
外資賣超標的則包括矽品、日月光、友達、聯電、宏碁、英業達、中環、錸德、和碩、新日光等。至於金融股部分，則有中信金、開發金、兆豐金、國泰金、玉山金、富邦金、新光金、合庫金、華南金、聯邦銀、京城銀等。
法人指出，外資今天賣超台股，但是台股卻在最後一盤大漲，除了八大行庫今天買超12.9億元，不排除可能是國安基金又進場拉抬，這也是國安基金慣用的手法之一。
值得注意的是，封測雙雄矽品及日月光今天分居外資賣超前2名，是否對這樁合併案已開始看淡，值得觀察。
今天外資集中市場買超第1名為群創，買超張數20953張，第2名永豐金，買超9454張，第3名台積電，買超9274張，第4名華亞科，買超7164張，第5名中華電，買超6163張。6到10名依序為，中纖，買超5914張；鴻海，買超5145張；第一金，買超4654張；寶成，買超4347張；華新，買超4023張。
外資集中市場賣超第1名矽品，賣超張數32802張，第2名日月光，賣超23192張，第3名中信金，賣超21119張，第4名友達，賣超14996張，第5名聯電，賣超9587張。6到10名依序為，宏碁，賣超9174張；台灣50，賣超8104張；陽明，賣超6587張；開發金，賣超6374張；兆豐金，賣超5891張。
外資店頭市場買超第1名元太，買超1759張，第2名世界，買超947張，第3名宏捷科，買超730張，第4名F-立凱，買超628張，第5名新普，買超456張。6到10名依序為，台半，買超364張；益通，買超302張；中天，買超225張；日盛金，買超210張；精華，買超184張。
外資店頭市場賣超第1名頎邦，賣超1172張，第2名穩懋，賣超1062張，第3名網家，賣超637張，第4名中美晶，賣超436張，第5名橘子，賣超414張。6到10名依序為，F-譜瑞，賣超391張；茂迪，賣超364張；同亨，賣超310張；中光電，賣超297張；中探針，賣超287張。
法人指出，今天台股因為尾盤急拉大漲而攻上月線，接下來要觀察台股能否守穩月線，畢竟台股在連接收復5日線、10日線及月線後，短線漲幅已高，要延續這樣上攻氣勢，是有一定難度的，如果在台股先在月線附近打底，重新蓄積能量，對於接下來的季線反壓才會有比較大的上攻動能。", ,wantgoo
