,Post_Date_Time,News_ID,Headline,Author,Article_Content,Related_Stock_Number,Source
0,2015-10-23 14:53,293600,台股盤後－歐美股市報喜 追高意願不足 8700點得而復失,鉅亨網記者李宜儒 台北,"【鉅亨網記者李宜儒 台北】歐盟暗示可能再度實施量化寬鬆，美股廠商財報亮眼，激勵台股今天指數開高，最高來到8740.08點，站上8700點整數關卡，不過追高買盤力道不足，加上之前的強勢族群，包括第三方支付及紡纖股走弱，指數漲幅收斂，終場上漲65.35點，以8673.81點作收，成交量回升到920.06億元。周線上漲68.86點，連4紅。
櫃檯指數則受到資金排擠效應影響，漲幅略低於集中市場，終場小漲0.28點，以124.30點作收，成交量為295.17億元。周線上漲3.21點，連4紅。
各大類股今天以油電燃氣類股表現較優，指數上漲達2.7%，塑膠、貿易百貨、半導體、電子零組件等漲幅逾1%，金融、電器電纜、鋼鐵、觀光、電機機械、水泥等，漲幅也達0.5%以上。至於弱勢族群則有汽車、光電、生醫、紡纖、通信網路、航運等。
台股今天電子權值股主要還是看台積電表現，上漲2.5元，以140元作收，重新站上5日線，帶動封測股、IC設計股跟進反彈，日月光上漲1.2%、矽品上漲逾3.5%、群聯上漲近2%，至於聯發科則收在平盤。
生醫類股也是今天強勢指標，其中智擎因為新藥MM-398獲美FDA新藥核准，盤中一度亮燈漲停，終場上漲4.8%，帶動生醫股包括健亞大漲7.3%，基亞上漲4.7%，安成藥上漲4.5%，美時、佰研、聿新科、永昕、盛弘等，漲幅也超過3%。
蘋果拉供應鏈一起打造乾淨能源，英業達董事長李詩欽也看好明年太陽能一整年都會好，激勵元晶、嘉晶、新日光、益通等太陽能族群也同步反攻。
另外集團股也跟進反彈，由華新集團開第一槍，包括被動元件廠華新科上漲近8%，PCB廠瀚宇博、封測廠華東漲幅也在3%以上。
不過股王大立光則相對疲弱，股價呈現開高走低，終場下跌10元，以2440元作收。股后漢微科也同樣走弱，全場在平盤上下震盪，終場下跌20元，以1220元作收。
美國運動服飾品牌廠UA第3季毛利率下滑，加上庫存增加拖累台系供應鏈走跌，儒鴻開高走低收最低，收在472元，下跌17.5元，得力也下跌近1%，銘旺實也下跌近2%
近期軋空指標股宏達電今天也欲振乏力，午盤過後翻落平盤之下，終場下跌2.2元，以77元作收，拖累供應鏈美律、位速、洋華、天宇、F-TPK、晟銘電也收黑。
蘋概股則是漲跌互見，鴻海上漲0.8元，可成上漲6.5元，F-臻鼎上漲0.9元，和碩下跌0.9元，鴻準下跌0.4元，台郡下跌0.1元， F-GIS下跌1.5元，F-TPK下跌1.7元。
法人指出，今天台股呈現開高走低，早盤在國際股市利多消息頻傳下，指數順利站上8700點，不過追高買盤意願明顯不足，使得漲幅收斂，尤其股王大立光跟股后漢微科等仍持續偏弱，也拖累投資人信心。基本上台股依然維持沿5日線走揚趨勢，接下來只要不要出現太大的利空衝擊，預料台股還是會以盤整向上、墊高底部的方式，持續向8700點、甚至是9000點叩關。", ,wantgoo
