,Post_Date_Time,News_ID,Headline,Author,Article_Content,Related_Stock_Number,Source
0,2015-03-11 14:45,206059,台股盤後─台積電、鴻海、富邦金救援成功！縮腳打樁撐9500,鉅亨網記者胡薏文  台北,"【鉅亨網記者胡薏文  台北】儘管美股擔心提前升息，道瓊指數重挫逾300點，亞股今天一早也多臉綠！不過台股早盤開低，指數失守9500點後，包括台積電、鴻海、富邦金等3大權值股，聯手上場救援，讓多頭信心稍稍回穩，接著股王大立光也翻紅，帶動指數跌幅縮小，指數不僅守穩9500點之上，中場過後甚至翻紅。雖然最後一盤遭到空軍偷襲摜壓，還是未能翻紅，但加權指數收盤時僅下跌13.35點，以9523.18點作收，成交值放大至969.05億元，頗有在9500點之下「縮腳打樁」意味。
電子權值股部分，台積電今天開低拉高，漲幅達1.39%，穩住多頭陣腳，鴻海2月營收雖月減29%，但仍創歷年同期新高，且首季合併營收可望突破1兆元，股價由黑翻紅，撐住季線。股王大立光今天也重新振作翻紅，友達、群創、鴻準、可成以及和碩，也都守穩紅盤，穩住多頭軍心。不過昨天強勢的日月光，今天湧現獲利調節賣壓，重挫逾5%，中小型股眼見權值股出面撐盤，包括光通訊、USB 3.1等族群，也都有買盤力挺。電子指數下跌0.1%，占大盤成交比重65%。
大盤今天得以撐住9500點，富邦金居首功！富邦金一馬當先漲幅達3.8%，國泰金緊跟在後，漲幅1.4%，兆豐金也出面表態翻紅，雖然其餘金融權值股壓抑在盤下，但金融指數仍上漲0.6%，占大盤成交比重9.8%。
傳產族群部分，今天雖然依舊跌多漲少，但大部分跌幅都略見收斂，汽車、運輸翻紅，運輸類股漲幅達1.3%，僅有玻陶、造紙、橡膠跌幅逾1%。
在外資連續2個交易日賣超後，台股多頭已開始有「危機意識」，除了繼續動用金融股撐盤，台積電、鴻海、大立光等主要權值股，盤中也率先見到買盤點火翻紅，穩住多頭陣腳。大盤今天開低拉高，明顯抗跌，守穩9500點企圖強烈。雖然最後一盤空軍突襲，讓指數未能翻紅，不過以今天K線來看，卻拉出紅K棒，明顯有在9500點之下縮腳打樁意味。台股要化解盤整時間拉長、或回檔修正幅度擴大的危機，今天低點9472點不宜再破，而多頭最好能儘速站回月線之上，讓月線發揮「護城河」作用。", ,wantgoo
