,Post_Date_Time,News_ID,Headline,Author,Article_Content,Related_Stock_Number,Source
0,2015-05-12 16:03,230593,承業醫首季虧損4000萬 EPS -0.31元 上半年拚轉盈,鉅亨網記者張旭宏 台北,"【鉅亨網記者張旭宏 台北】國內腫瘤醫材代理龍頭承業醫(4164)首季在認列併購十陸所產生的勞務費用7300多萬元，導致營運虧損，稅後淨損4025萬元，每股虧損0.31元，公司表示，第二季將會有大機台入帳，第二季營收相比第一季倍數成長，有信心轉虧為盈，上半年有信心維持獲利格局。
承業醫表示，第一季表現不如預期主要1月底子公司杏霖醫管併購十陸，產生相關併購勞務費用7300多萬元，由於是一次性費用認列，導致首季虧損，但若扣除該筆費用，則第一季仍為獲利。
承業醫今年已與多家醫院簽訂放射腫瘤大機台安裝及升級合約，目前部分機台已進行安裝中，預計在第二季就能有大機台入帳，第二季營收相比第一季將有機會倍數成長，其他機台也將依實際安裝完成時間在今年下半年分別認列營收，今年上半年即可由虧轉盈，法人預期全年營收雙位數成長目標不變。
承業醫下半年開始取得大中華區獨家代理Novadaq與Swissray，其中Novadaq手術影像導引系統的兩種機型SPY與Pinpoint分別在今年1月底及5月初拿到中國CFDA的兩張許可證，對今年營收產生一定的貢獻。另外Swissray數位X光機的中國市場，法人看好今年將有10台以上的銷售貢獻。
另外承業醫中國市場的放射腫瘤服務，也將挹注新成長動能，包含湖南郴州第一人民醫院的「硬體銷售+醫管顧問服務」的模式獲得醫療市場認同，該模式已在中國與多家醫院簽訂合約及意向書，預計今年即可成功複製多個郴一獲利模式；最後與印尼前三大集團之一力寶(Lippo)結盟，初步將先在印尼雅加達合資成立醫療管理公司，對印尼輸出醫管、藥品、醫材等，並且協助當地醫院成立放射腫瘤科及安裝設備，預計3年內至少10台直線加速器的安裝，營運再添柴火。", ,wantgoo
