,Post_Date_Time,News_ID,Headline,Author,Article_Content,Related_Stock_Number,Source
0,2015-10-28 17:52,294585,華信投顧－視大盤強弱，被動操作,鉅亨台北資料中心,"【鉅亨台北資料中心】◆盤勢分析
今天蘋概股普遍走弱，尤其是台積電、鴻海、大力光、可成等具有指標意義的權值股的走弱，是今天加權指數收黑的最主要原因。今晚是蘋果公佈財報後的第一個交易日，也將正式反應法人對蘋果財報的看法，也就是說，今晚蘋果股價的漲跌，將決定台灣蘋概股的短期趨勢方向。如同我們之前提示，由於蘋概股涵括甚廣，因此蘋概股的漲跌，就等於是電子股的強弱，當然也就等於是加權指數的走向。因此，今晚蘋果股價的表現，將是觀察重點之一。
明天凌晨，美國聯準會利率決策會議結束後，將舉行記者會，宣示利率政策。如果如同絕大多數人的預測，聯準會繼續擱置升息案，那麼全球股市走向的發球權，又將回到中國大陸手上，也就是說，中國週四十三中全會結束後，週五走勢的強弱，就將成為全球股市的指標。
繼昨天之後，今天大盤連續第二天拉尾盤，並且守住10日線，自技術面看，盤勢應該還在多頭掌控之中。不過，除了上述蘋果和聯準會的影響因素外，明天又是摩台指平倉日，因此明天大盤的走勢，可以說完全掌握在外界手中，技術面的影響力實在有限。
李永年 分析師
★ 此研究報告著作權屬華信證券投資顧問(股)公司，切勿盜用或翻印，否則追究責任，決不寬貸 ★ 所有資料僅供參考，本公司不負盈虧責任", ,wantgoo
