,Post_Date_Time,News_ID,Headline,Author,Article_Content,Related_Stock_Number,Source
0,2015-05-14 16:14,231702,顧德投顧盤後－MSCI的藉口 剛好補缺口,鉅亨台北資料中心,"【鉅亨台北資料中心】◆盤勢分析
MSCI昨天公布MSCI指數權重、成分股半年度調整，台股成分股中，增加權重的個股有20檔，其中鴻海 (2317) 權重調升約0.385個百分點，升幅最大。而整體調整出現連7降。
(US-EN); mso-fareast-language: ZH-TW; mso-bidi-language: AR-SA;"">►其餘權重被調升個股，包括F-鎧勝 (5264) 、豐泰 (9910) 、亞泥 (1102) 、F-中租 (5871) 、儒鴻 (1476) 、群創 (3481) 、寶成 (9904) 、永豐金 (2890) 、聯強 (2347) 、大聯大 (3702) 、F-臻鼎 (4958) 、晶電 (2448) 、宏?? (2353) 、聯發科 (2454) 、可成 (2474) 、長榮航 (2618) 、合庫金 (5580) 、和碩 (4938) 、陽明 (2609) 。
(US-EN); mso-fareast-language: ZH-TW; mso-bidi-language: AR-SA;"">►權重遭調降個股有21檔，其中華新 (1605) 權重遭調降約0.179個百分點，降幅居冠。其餘權重遭調降個股包括藍天 (2362) 、遠百 (2903) 、欣興 (3037) 、晶華 (2707) 、神隆 (1789) 、遠雄 (5522) ，台積電 (2330) 、聯電 (2303) 、宏達電 (2498) 、日月光 (2311) 、華亞科 (3474) 、力成 (6239) 、彰銀 (2801) 、台新金 (2887) 、仁寶 (2324) 、研華 (2395) 、潤泰新 (9945) 、潤泰全 (2915) 、中鼎 (9933) 、萬海 (2615) 。
(US-EN); mso-fareast-language: ZH-TW; mso-bidi-language: AR-SA;"">►MSCI權重及成分股調整1年4次，分別在每年2月、5月、8月、11月。
這是昨日MSCI公佈後市場空頭的一個解讀?我想先用一個歷史數據來看這是否有意義吧!首先我們連7季在降喲！但外資這兩年統計下來，對台股是淨買超還是淨賣超呢？2014年除了8-9-10-12是賣超？其它月份淨匯入共計161.04億。今年第一季再匯入70億美元，4月再入36.87美元，是台股碰一下萬點的功臣。故調降又如何？惦惦買，台灣的好公司都變成外資的。
今天的殺盤在於主流指標完全不動，金融摜破月線，大盤破季線。一早訊息是:多空交戰9700，昨日也說要守9715就可偏樂觀，結果一破這些點位指數就兵敗如山倒，今天是轉倉第一天，一早在9730出現大量轉倉，空頭先出手，大盤轉不轉強呢？9730就成第一個壓力關卡囉！今天是星期四，出現這樣黑K對於下週月週結算區間又跑出來了，莊家又想收權利金，而今日正式來回補缺口。
空頭轉的位置已清楚，就看多頭要在何處轉？上個月是低結算，本月目前看起來差不了多少，財報還有一天，轉倉還有4天，震盪都是正常，指數跟誰動呢?仍是問金融。
作者：顧德投顧 程敦玉分析師
以上資料僅供參考,投資時應審慎評估", ,wantgoo
