,Post_Date_Time,News_ID,Headline,Author,Article_Content,Related_Stock_Number,Source
0,2015-06-10 21:15,244034,台股大漲不是外資功勞！現貨連9賣 台指期淨空單再升高,鉅亨網記者陳慧菱 台北,"【鉅亨網記者陳慧菱 台北】MSCI未將中國A股納入指數，台股資金外流疑慮暫時緩解，加權指數今(10)日大漲106.63點，不過，台股今天的強彈，功勞並非來自外資轉買，外資連9賣，續賣超35.1億元，在台指期也依舊偏空操作，加碼淨空單335口至18481口，外資淨空單還是居高不下。
台指期今天開高後迅速上攻，衝破9300點，帶動現貨也大漲超過100點，不過台指期多方攻勢在10:00之前就突然結束，轉為震盪收斂漲幅，終場台指期只上漲49點，期、現貨價差由正轉逆，且由前一天的正價差43點一口氣轉為逆價差15點，差距將近60點，可以看出期貨市場多空氛圍轉換快速，追價意願明顯轉弱。
觀察法人籌碼變化，外資在現貨連9賣，賣超金額達35.1億元，自營商小賣0.4億元，投信則買超4億元，三大法人合計賣超31.5億元；而在台指期淨部位方面，外資並不因指數反彈而回補，反而加碼淨空單335口至18481口，自營商加碼淨多單80口至536口，三大法人合計淨空單減少190口，仍有20811口的水準，需留意整體法人期貨部位做空態度依然相當堅決，也限制了上檔反彈空間。
外資買超中信金20106張、鴻海13600張、元大金9223張、陽明8375張、兆豐金7456張、宏碁6661張、長榮5603張、友達5216張、中工5067張、華航3062張。
外資賣超日月光31162張、台積電14453張、台新金7975張、華亞科7712張、中鋼6838張、仁寶6383張、富邦金4930張、廣達3937張、台灣50遭賣3930張、緯創3888張。
投信買超台郡1303張、中信金1239張、宏益1101張、華邦電1000張、國喬950張、富邦金922張、兆730張、可成724張、儒鴻715張、全新588張。
投信賣超旺宏3094張、華航2800張、群創2598張、友達2136張、榮創1565張、FB上証1436張、長榮航1390張、彰源1300張、華夏1142張、億光1073張。
自營商買超友達7774張、上証反6213張、群創5591張、國泰JZ獲買5507張、群益56獲買5461張、中信金4097張、永豐CG獲買3521張、永豐5Y獲買3294張、元大H2獲買3270張、日月光3269張。
自營商賣超滬深2X遭賣20880張、F4元大6271張、元大金5014張、上証2X遭賣4828張、富邦1P遭賣4221張、4C元大3244張、30元大3159張、華航3123張、元大XT遭賣2754張、4M凱基2491張。
台股今天成交金額縮小到982億元，呈現價漲量縮，台股自6/2日起就一直維持價漲量縮、價跌量增的空頭慣性，加上5日線持續下壓，並已向下摜破年線，仍會對多方動能造成影響，不過，台股低檔應該就在年線9200上下附近最後打底，待籌碼清洗後，預期將反彈一波上看季線。", ,wantgoo
