,Post_Date_Time,News_ID,Headline,Author,Article_Content,Related_Stock_Number,Source
0,2015-01-21 19:30,192681,HTC RE新色搶眼！董俊良：春節、情人節搶市鎖定5大族群,鉅亨網記者楊伶雯 台中,"【鉅亨網記者楊伶雯 台中】
宏達電(2498)去年推出創新產品HTC RE，成功吸引消費者的注意，北亞區總經理董俊良今(21)日指出，RE目標對象有5大族群，包括有小孩的夫妻、愛跑時尚派對、愛旅遊、愛運動、愛自拍的年輕人等；鎖定即將到來的浪漫情人節及農曆年，特別推出豔陽紅新色，希望進一步拉抬銷售量。
董俊良表示，2015年HTC品牌願景是「HTC Everywhere」，今年將是非常關鍵的一年，除了在智慧手機部分，將推出更完整的產品線之外，更積極行銷HTC RE，「透過HTC專賣店VIP尊爵服務，今年從1月15日起推出『Eye自拍，愛分享』HTC全國攝影競賽，且將推出全新熱情新色豔陽紅，除是情人節最獨樹一幟的貼心好禮外，也可成為與親朋好友共享農曆年團圓氣氛的最佳幫手」。
董俊良說，「Eye自拍，愛分享」全國攝影競賽，提供五大攝影作品類別首獎各等值10萬元的獎品及其他共超過百項的獎項，以回饋所有支持並喜愛HTC的消費者，同時也讓消費者更進一步體驗及知道HTC品牌。
董俊良表示，有5種情境適合使用RE，第一種族群是有小孩的夫妻，買給小朋友使用；第二種是年輕人參加時尚派對時；第3種則是喜好運動者在戶外使用；第4種為旅遊時方便使用，不需帶著笨重的相機；第5種則是自拍族群，是年輕人最喜歡的情境。
董俊良先前曾表示，RE的銷售目標為整體智慧型手機銷售量中5%的滲透率，如果以全台灣每年約有800萬支手機銷售量來推算，5%滲透率約達40萬支；董俊良認為，物聯網是今年CES展的熱門趨勢，RE熱銷有助宏達電布局物聯網相關產品，可望縮短發展物聯網產品的時程。", ,wantgoo
