,Post_Date_Time,News_ID,Headline,Author,Article_Content,Related_Stock_Number,Source
0,2015-11-26 18:37,305296,悶夠了！外資感恩行情 期現貨同步作多 三大法人大買104億,鉅亨網記者李宜儒 台北,"【鉅亨網記者李宜儒 台北】國際股市回穩，台股在生技股、太陽能股及半導體股聯袂大漲，順利收復8400點及季線8425點之上，更直逼月線8519點，終場大漲98.77點，以8484.9點作收。三大法人包括外資及自營商則同步翻多，外資大買96.19億元，自營商買超10.06億元，投信續賣超1.28億元，合計買超達104.97億元，為11月5日以來最大買超金額。
期貨部分，三大法人也同步站在多方，外資加碼多單動作更是擴大到4199口，為10月22日以來單日加碼多單最多口數，淨部位淨多單回升到2萬口以上，達24133口，也是11月3日以來淨多單最大口數。自營商則是回補空單426口，淨部位淨空單縮小到874口；投信也回補空單311口，淨部位淨空單為8241口。合計三大法人今天加碼多單4936口，淨部位淨多單也一舉回到15018口。
今天外資的買盤終於回到電子及金融權值股身上，也讓台股成為今天亞股的強勢指標，包括台積電、鴻海、聯電、群創、和碩等，均是外資主要買超個股。值得注意的是，其中外資對於金融股的買超標的，更是遍及富邦金、中信金、開發金、國泰金、新光金、玉山金、元大金、兆豐金、台新金等主要金控股，更是近期少見的買超動作。
外資加碼電子權值股，也沒忘記回補蘋概股，除了鴻海、台積電及和碩外，其他包括日月光、鴻準、華通、F-鎧勝、可成、台郡、F-GIS、F-臻鼎、大立光，也都獲外資買盤青睞，其中值得注意的是，外資今天中止了對鴻準的連續10天賣超，外資或許認為蘋果砍單衝擊已淡，蘋概股有機會重新取得盤勢主導權。
至於外資之前主要的買超標的，包括微星及智邦，今天股價表現呈現拉回整理，不過外資操盤動作卻是兩樣情，儘管微星大跌逾6%，外資卻不改其買超態度，持續買超4406張，也是連續18天買超。然而智邦卻遭外資大賣2900張，是否外資認為智邦股價已到高點，值得觀察。
今天外資集中市場買超第1名為友達，買超張數12820張，第2名鴻海，買超11567張，第3名台積電，買超10315張，第4名群創，買超8347張，第5名緯創，買超8164張。6到10名依序為，富邦金，買超6829張；中信金，買超6418張；開發金，買超5936張；聯電，買超5608張；宏碁，買超5415張。
外資集中市場賣超第1名台灣大，賣超張數5293張，第2名智邦，賣超2900張，第3名康舒，賣超1936張，第4名凌巨，賣超1876張，第5名中華，賣超1731張。6到10名依序為，中鼎，賣超1687張；台玻，賣超1603張；華亞科，賣超1574張；華新，賣超1573張；大同，賣超1538張。
國泰證期顧問處協理簡伯儀表示，今天外資現貨及台指期都出現近期難得一見的大舉買超動作，主要是因為台股目前的基期相較於國際市場，因此儘管即將進入感恩節假期，外資還是很勇敢的買下去。不過外資大舉買超，還不能證明台股後市就可以一帆風順，尤其在成交值仍持續低迷的狀況下，外資的資金還是只會著重在權值股，何時台股成交值可以擴大到900億元以上，解決台股缺血的問題，才有機會出現較大幅度的漲幅，預料台股短線還是以區間整理為主，區間將維持在季線8425點及半年線8602點之間。", ,wantgoo
