,Post_Date_Time,News_ID,Headline,Author,Article_Content,Related_Stock_Number,Source
0,2015-05-05 14:40,227261,台股盤後─陸股玩過山車 融資斷頭股受驚！量縮回防9800,鉅亨網記者胡薏文  台北,"【鉅亨網記者胡薏文  台北】美股道瓊指數仍維持在1萬8000點之上震盪，但大陸PMI指數持續走軟，今天走勢大玩「過山車」，到午盤重挫逾2%，台股早盤開平後，市場瀰漫濃厚觀望氣氛，朱習會落幕，「喊燒」的金融股出現獲利調節賣壓，但本周起融資維持率調高至130%，部分高融資股價偏弱的電子股率先軟腳，華亞科、美律都重挫逾6%，宏達電也破低，盤面陷入盤下狹幅震盪，指靠股王大立光，率領蘋果派，以及台塑四寶力撐。加權指數收盤時下跌24.91點，以9820.13點作收，成交值再縮至911.56億元。
電子權值股部分，今天強弱勢分明，股王大立光收上3220元，以收盤價來看，創下歷史新高，而蘋果概念股中，包括可成、和碩、廣達等也都守穩，搭配LED、車用等族群，力撐指數。不過在弱勢股部分，高融資的華亞科、美律，都重挫逾6%，4月營收低於預期的宏達電，股價也在創今年新低，跌幅逾2%，華碩、聯發科、台達電跌幅都逾1%，部分高融資弱勢中小型股，也略見融資「自斷」賣壓。電子指數下跌0.35%，占大盤成交比重57%。
金融族群部分，今天獲利調節賣壓陸續湧現，富邦金、開發金跌幅都逾1%，金融權值股大多翻黑，僅靠玉山金、元大金、台新金、永豐金等撐盤。金融指數下跌0.41%，占大盤成交比重14%。
傳產族群部分，今天走勢大多沈悶，小漲小跌為主，汽車類股表現最亮眼，漲幅逾1.4%，塑膠、紡織、玻陶、觀光、生技與油電燃氣力守紅盤，其餘都翻黑。
台股今天指數雖僅小跌24.91點，大盤仍力守9800點與10日均線之上，不過盤面個股表現歧異擴大。股王大立光、股后漢微科收盤價仍雙雙改寫新高，但華亞科、美律、宏達電等弱勢股持續破低。為讓投資人適應6月起漲跌幅放寬至10%，本周起先行將融資維持率拉高至130%，許多高融資、弱勢股，明顯湧現投資人「自斷」賣壓。多頭如欲在5月間，還想再挑戰萬點，電子、金融不能雙雙走軟，甚至轉為輪跌。而這波日K線已連續出現5根黑棒，近2日指數明顯在力撐9800點，因此短線上9800點將是關鍵位置，多頭不宜再棄守！", ,wantgoo
