,Post_Date_Time,News_ID,Headline,Author,Article_Content,Related_Stock_Number,Source
0,2015-11-04 08:39,296078,券商分析摘要,鉅亨台北資料中心,"【鉅亨台北資料中心】◆券商推薦個股排行： ◆ 統一證：
昨日指數大漲逾百點重回8700點大關，距離上檔半年線反壓8762點僅一步之遙。考量美國企業財報多數優於預期，激勵歐美股市維持多方走勢，加上證所稅修正案將再次進入立院討論事項，此次若能順利通過將有利資金回流台股。另就技術面觀察，現階段月、季線同步走揚，指數下檔有撐，加上外資於期貨現貨偏多操作，台股短線有利多方。選股上可著墨基本面良好之PCB、塑化、生技、鞋材、汽車零組件及十三五規劃概念股。 ◆ 大昌證券：
台股昨日開高走高，盤中買盤點火，一路推升站回8700點整數大關，漲幅領先所有亞股表現，終場以上漲98.42點作收。三大類股呈現收紅，其中以金融指數漲勢較佳，且由證券類股最為強勢，紛紛攻高。而電子族群在權值股普遍收紅，以及股王大立光走強之下強勢，另外像是IC設計也有續強表現。傳產類股則由生技續強以及航空強勢收紅的情況下走揚。而櫃買指數相對加權指數強勢，中小型個股可觀察營收較佳，或第四季展望不錯的標的。 ◆ 新光證：
財新中國10月製造業指數優於預期，歐洲及美股經濟數據亦傳佳音，激勵歐美股市走揚，3日台股開高走高，在權值及題材股大漲下，站回8700點關卡，終場加權指數收在 8713.19點，上漲98.42點或1.14%，成交額976.1億元。OTC指數收在 127.63點，上漲1.59點或1.26%，成交額310.5億元。3日台股日線連二紅，站上五日及十日均線，成交量明顯放大逾九百億，惟高點未過前高，9日KD值仍為死亡交叉。籌碼方面，外資連二日買超，金額放大至105.84億，內資則是同步賣超。考量美、中、歐經濟數據轉佳，國際股市走揚，外資大幅買超，台期期未平倉量淨多單增至2.6萬口，預期在選舉效應下，本月可望通過新版證所稅案，預期將釋出更多利多政策，配合補量至九百億以上量能，大盤有機會向上攻高，選股留意連三季財報穩定成長、二胎、蘋概、汽車零組件等族群。 ◆ 大慶證：
從昨日盤面來看， 隨紫光表達有意收購聯發科，讓市場意識到國內IC設 計本身具有物美價廉的特質，並重新檢視其價值所在，也讓目前因為需求不佳而評價不高的IC設 計族群普遍上漲，不論是身處核心的的聯發科，甚或是近期同樣業績不佳的驅動IC龍 頭聯詠，以及老牌IC廠 的瑞昱，皆業績展望平淡卻逆勢上漲的狀況，證明族群出現資金回籠的現象，因此在佈局上可選擇獲利穩定但股價基期偏低，以及營收創高的個股佈 局。而蘋果供應鏈雖在大立光轉強帶領下普遍上漲，上漲的個股如可成、台郡等線型仍屬弱勢，因此在蘋果展望未見明朗前，族群性要大漲的機率不高，權值股表現主 軸仍在半導體族群身上。 傳產股部份，證券股因受到證所稅將在本週五闖關激勵上漲，但依過去的紀錄來看，未必會迅速過關，因此以題材視之即可，金融股則反應資金行情上 漲，加上馬習會題材，金融、中概、以及陸資參股相關概念股亦可偏多操作。中 小型股方面，二胎概念、紡織等題材股開始有利多出盡的味道，長線來看，非手機用PA、 汽車電子、光纖、環保、業績生技股仍是主流，建議以第四季展望向上者進行長線佈局。", ,wantgoo
