,Post_Date_Time,News_ID,Headline,Author,Article_Content,Related_Stock_Number,Source
0,2015-11-03 15:10,295819,5大蘋概股今奪下台股177億元成交值 大立光衝第一,鉅亨網記者張欽發 台北,"【鉅亨網記者張欽發 台北】
台北股市在今天出現由傳產、金融及電子多重主力引導的反彈格局，其中蘋果概念股走勢仍為市場一大重心，而在今天台北股市呈現價量齊揚的走勢中，大盤上漲98.42點衝破8700點以8713.19點作收；其中5大蘋概股今天囊括了台股177億元的成交值，其中大立光(3008)個股的成交值以51.61億元居台股個股第一名。
大立光今天早盤以2680元高盤開出後即呈現高檔振盪，終場以2745元作收，較昨日上漲105元或3.98%，成交量放大為1896張，個股的成交值以51.61億元居台股第一名。國泰證期顧問處協理簡伯儀指出，今天股王大立光明顯為跌深反彈的格局。
台股集中市場成交值今天為964.59億元勝過昨日的787.62億元，而包括大立光等前5大蘋果概念股的今天的成交值已占大盤的18%。
今天台北股市的成交值前5名蘋概股，合計今天囊括了台股177.84億元的成交值，以大立光的51.61億元居第一，台積電(2330)成交值46.13億元居次，F-TPK(3679)33.78億元，機殼廠可成(2474)23.98億元排名第4名，第5名鴻海(2317)成交值22.34億元。
不過，今天成交值前5名的蘋果概念收盤股盤以大立光3.98%漲幅最高，而F-TPK為其中唯一收黑的的個股，F-TPK終場以88.5元作收，較昨日下跌0.6元或0.67%。", ,wantgoo
