,Post_Date_Time,News_ID,Headline,Author,Article_Content,Related_Stock_Number,Source
0,2015-11-12 14:55,300920,台股盤後－曾銘宗喊話 MSCI衝擊不大 日線中止連5黑,鉅亨網記者李宜儒 台北,"【鉅亨網記者李宜儒 台北】受到MSCI明天恐將調降台股權重影響，台股今天開平高後，指數在10點過後開始下殺，一度摜破8400點，最低來到8374點，距離季線8337點僅差不到40點，不過午盤過後，在政府基金連續4天買超下，金管會主委曾銘宗信心喊話，即使MSCI調降權重 ，幅度不至於太大，且外資持續匯入，大盤重新回到平盤上下震盪，終場小漲13.08點，以8428.09點作收，日線中止連5黑，成交量縮小到819.44億元。
櫃檯指數同樣呈現開平走低，中場開始拉高的走勢，終場小漲0.75點，以124.77點作收，成交量280.7億元。
台股今天各大類股走勢漲跌互見，其中汽車、玻陶、油電燃氣、光電、化學、化學生醫、生醫、半導體均維持收紅表現，平均漲幅在0.5%以上；至於弱勢族群則包括紡纖、水泥、觀光、鋼鐵、電器電纜、電腦設備、金融、建材營造、航運等。
台灣50成分股今天成為台股撐盤要角，裕日車大漲逾5%，DRAM股華亞科上漲逾3%，股王大立光漲2.8%，矽品上漲逾2%，其他包括廣達、台新金、台塑化、玉山金等，漲幅也超過1%。
其中台積電跟大立光今天扮演台股撐盤要角，大立光順利收復2500元大關，台積電雖然尾盤漲幅收斂，不過終場仍小漲1元，以138.5元作收。
值得注意的是，部分第3季財報績優個股，今天則是呈現利多出盡走勢，股價表現相當弱勢，包括光通訊族群的華星光及光環，都被打到跌停，另外F-環宇、F-IET盤中也一度跌停。不過包括穩懋、神隆等財報績優股，則展現抗跌氣勢。
蘋概股今天也是各有漲跌，鴻海小漲0.5元，和碩下跌0.3元，可成下跌8元，鴻準上漲0.1元，台郡上漲1元，F-臻鼎下跌1.2元，F-TPK上漲0.9元、F-GIS上漲2元。
另外金融股今天表現也稍弱，雖然下跌家數僅有7家，不過由於國泰金及富邦金雙雙走跌，是拖累金融類股下跌的主因。
法人指出，由於外界都預期明天MSCI半年度的權重調整，台股權重將遭到調降，不過市場對於這樣的利空消息已稍有免疫效應，加上政府基金趁低進場拉抬權值股，使得8400點整數關卡失而復得。基本上，季線的支撐力道並不弱，加上短線跌幅已深，市場中瀰漫著反彈的氛圍，預料明天即使台股權重遭調降，比例也會太高，等到權重調整底定後，台股可望出現波反彈走勢，不過包括5日線、10日線、月線、半年線，目前在8550-8700點呈現糾結，將是反彈壓力區所在。", ,wantgoo
