,Post_Date_Time,News_ID,Headline,Author,Article_Content,Related_Stock_Number,Source
0,2015-06-09 08:21,241297,台股盤前─超級股東會台積電領銜演出 年線附近震盪築底,鉅亨網記者楊伶雯 台北,"【鉅亨網記者楊伶雯 台北】台股6月漲跌幅放寬至10%以來，大盤指數連續下跌直到昨日首度止跌小紅作收，守住年線，但從成交量並未放大的情況來看，顯示投資人仍存有疑慮，本周進入股東會高峰期，今(9)日更有重量級值股台積電股東會登場，市場密切期待董事長張忠謀將釋出的消息，期望可以進一步支撐大盤，另外，蘋果舉辦開發者大會，蘋果概念股的表現也是重要觀察指標，法人認為，大盤有機會在年線附近整理築底。
台股昨日開低走高，指數翻紅收在9368.43點，上漲28.3點或0.3%，市場成交值為952.65億元，在買盤拉抬權值穩盤下，技術線型K棒明顯留下下影線，守住年線9326點；三大法人合計賣超72.94億元，外資及陸資賣超91.6億元、投信賣超5.81億元、自營商買超24.47億元，外資台指期空單淨空單逾2萬口顯著偏空。
美股周一也是齊跌的表現，受Fed可能9月升息，及希臘債務談判不如預期等因素影響，造成美股收黑，道瓊工業指數收跌82.91點，或0.46%，收在17766.55點；NASDAQ指數收低46.83點，或0.92%，收在5021.63點；S&P500收跌13.55點，或0.65%，收在2079.28點；費城半導體指數收跌13.92點，或1.92%，以712.37點作收。
台股從4/28高點10014點拉回整理以來，下跌天數明顯較上漲天數多，顯示多方力道較弱，近日兩度死守年線，在短線指數跌幅乖離過大下，有機會在年線附近整理，國泰證期顧問處協理簡伯儀認為，台股量能並未放大，顯示出市場對台股仍有高度的疑慮，台新中國通基金經理人施昶成表示，預期台股指數有機會在年線附近開始築底。
今日有98家公司同步召開股東會，指標公司首推台積電、聯電且都將進行董監改選，另外還有可成、精華、鼎翰、威剛、力旺、遠雄、世德、瑞昱、互盛電、東碩也是在這天舉辦股東會。
另外，6月10日則有高達104家股東會同時舉辦，由股王大立光領軍，昨日召開股東會的群創，世界，及今日將上場的台積電、聯電等公司股價的表現，將牽動大盤的漲跌，另外，宏達電大降財測的利空衝擊恐將持續，也將連動供應鏈的表現。
今日盤面上還可以觀注的是蘋果概念股的表現，蘋果全球開發者大會在台灣時間9日凌晨在美國登場，除已宣布Apple Music之外，市場關注Ios、新版Mac OS X作業系統升級，還有Apple Watch、Apple Pay等產品與服務，外電報導指出，市場期待iPhone6S最新消息的宣布；台廠相關概念股可望搭上題材便車，鴻海、台積電、美律、聲寶、大同、億光、廣達、景碩、力旺等表現值得觀察。
另一個觀察的重點是MSCI是否將中國A股納入成份股，如果納入，可能造成外資進一步流出台股，如果沒有，有助減緩外資在台股的賣壓。", ,wantgoo
