,Post_Date_Time,News_ID,Headline,Author,Article_Content,Related_Stock_Number,Source
0,2015-04-28 14:30,224854,台股盤後─電子憂匯損 扯後腿翻黑！萬點只待5分鐘,鉅亨網記者胡薏文  台北,"【鉅亨網記者胡薏文  台北】美股道瓊指數仍維持1萬8000點之上震盪，陸股上證指數則是在4500點關卡震盪，台股挾熱錢持續湧入，新台幣匯率急升，一早開盤迅速衝上萬點關卡，今天高點更衝上10014點，雖然金融持續力挺，電子也有蘋果財報利多，不過眼見新台幣匯率往30.5元關卡衝，電子擔憂匯損擴大，紛紛臉綠軟腳。大盤在萬點之上，只停留了約5分鐘，隨即大盤震盪翻黑，加權指數收盤時下跌16.29點，以9956.83點作收，成交值縮至1166.4億元。
電子權值股中，今天雖有蘋果財報利多，但蘋果供應鏈表現卻相當「無感」，台積電、大立光力守平盤，不過聯發科軟腳，跌幅逾2%，封測族群同樣疲弱，日月光、矽品跌幅都逾2%鴻海也開高走低，跌幅逾1%，而今天下午將召開法說會的華亞科，跌幅逾3%，可成也同樣有莫名賣壓調節，跌幅逾1%，友達、廣達力守紅盤。今天相對強勢的為特斯拉帶動的車用電子族群，重獲買盤青睞。電子指數下跌0.61%，占大盤成交比重51%。
金融權值股部分，今天由富邦金、開發金帶隊，富邦金續漲2.8%、開發金漲幅1.1%，元大金、彰銀輪休小黑，但金融指數上漲0.8%，占大盤成交比重19%。
傳產族群部分，昨天軟腳的運輸類股，今天一吐悶氣，反彈1.8%，盤面也出現輪動，轉由紡織、機電、電器、造紙、鋼鐵、橡膠、汽車、營建、百貨力守紅盤，其餘各族群翻黑，玻陶跌幅1.5%最重。
外資熱錢持續湧入，讓台灣再現股匯市齊揚走勢，不過在匯市部分，熱錢太急，導致新台幣急升，今天早盤逼進30.5元關卡，超出預期，因此擔心外銷電子族群匯損擴大疑慮再起。台股連2天盤中都衝過萬點，但收盤都沒站穩，而這二天主攻部隊明顯以金融為主，電子族群「扯後腿」。儘管股民都認為這波是台股史上最「無感」的萬點行情，不過以今天大盤價小跌量縮，指數仍力守5日均線之上，短多攻勢仍在進行中，對於指數暫勿預設高點，需留意的是類股與個股輪動加速！", ,wantgoo
