,Post_Date_Time,News_ID,Headline,Author,Article_Content,Related_Stock_Number,Source
0,2015-01-22 08:15,192770,台股盤前─外資新資金來台虎虎生風 大立光領軍衝鋒,鉅亨網記者張欽發 台北,"【鉅亨網記者張欽發 台北】1月21日台北股市多方採取以大立光(3008)及台積電(2330)去年業績表現佳的兩大天王個股大漲領軍，集中市場加權股價指數終場上漲68.02點，以9319.71點作收，同時以大立光領軍的蘋果概念股獲外資方面看好，在今天將扮演突破台北股市集中市場加權股價指數的下降趨勢的重兵。
就今晨收盤的美股收盤數據方面，道瓊工業指數上漲 39.05 點，或 0.22%，收在 17554.28 點。標普 500 指數上漲 9.57 點，或 0.47%，收在 2032.12 點。那斯達克指數上漲 12.58 點，或 0.27%，收在 4667.42 點。
同時，外資昨日在台股買超金額達到172億元，成為18個月以來外資在台股買超金額新高，而在目前明顯在國際股匯市、油價及金價表現趨於穩定同時，外資券商交易室主管指出，目前市場資金由低價股轉而湧向高價股的趨勢相當明顯，也大力看好已進行整理一段時間的蘋果概念股族群。
目前的蘋果概念股以大立光的表現最為強勢，而如可成(2474)等個股也在昨日轉強，國泰證期顧問處協理簡伯儀指出，今天台股大盤將向上挑戰加權股價指數9593點連結9500點的下降趨勢線，位置在9350點附近，台北股市集中市場加權股價指數今晨如開高跳高翻越此一點位，將對於台股後勢更為有利。
簡伯儀強調，目前台北股新集中市場大盤技術線型來看，KD值及RSI指標都有偏多，且目前並沒有反轉訊號出現，有待量能進一步的激發台股攻勢。
聯華投顧證券分析師李政穎指出，昨日盤後的台指期結算後，外資在台股籌碼持續偏多操作，加上預期歐洲央行將推出量化寬鬆政策(QE)，指數有機會延續盤堅向上格局，而近期多空因素反應迅速，短線雖偏向多方格局，但行情操作漲跌風險較高，可觀察大立光是否有創新高機會，外資整體籌碼是否縮手，下周國際政策行情變化將擴大，仍建議謹慎應對。
就市場訊息方面，遠雄(5522)就大巨蛋的興建議題上，昨晚由遠雄巨蛋事業董事長趙藤雄出面與與台北市長柯文哲面對面進行會商，並獲致5點結論，遠雄並指出，遠雄與台北市政府就此一BOT案重新議約，市府同意忠孝東路和光復南路的樹木依照SOP辦理移植，同時，柯文哲市長也答應全力配合大巨蛋在2015年年底完工。
此外，昨天的台股兩大面板股友達(2409)、群創(3481)股價在盤中遇壓而爆大量重挫以跌停作收，也傳出係外資券商美林開出第一槍調降其評等所致。
大立光已召開法人說明會並公布其自結2014年全年稅後盈餘為194.31億元，每股稅後盈餘為144.85元，大立光的此一年度獲利成績也刷新了台北股市個股的獲利紀錄，外資方面估計其去年的股息將配發出58元。", ,wantgoo
