,Post_Date_Time,News_ID,Headline,Author,Article_Content,Related_Stock_Number,Source
0,2015-03-20 15:10,210173,台股盤後─拉尾秀重現江湖！砸171億元拉尾翻紅 守9700再登高,鉅亨網記者胡薏文  台北,"【鉅亨網記者胡薏文  台北】美股高檔震盪小回，讓台股早盤多頭略見觀望，台積電、面板雙虎等權值股將指數空間讓出，轉由鴻海率領鴻家軍，以及財報繳出亮麗成績單的可成，以及具「軋空」題材的中小型股表現，大盤雖壓抑在平盤下，但幾乎全場都守穩9700點之上，最後一盤「拉尾神技」又重現江湖，特定買盤砸下171億元，拉抬指數24點，神奇讓大盤翻紅並補量，加權指數收盤再創7年多來新高！加權指數收盤時上漲12.69點，以9749.69點作收，成交值放大至1212.04億元。
今天電子權值股盤面的「亮點」為可成，財報亮眼超出法人預期，加上今年展望樂觀，股價開盤即跳空漲停，外資並競相調高目標價。鴻海雖再傳「內鬼」案，但富智康去年獲利繳出年增190%亮眼成績，也讓買盤搶進鴻海，鴻海股價漲幅逾2%，鴻準也同步上攻，漲幅逾3%。台積電早盤壓抑在盤下，最後一盤拉尾站回平盤。友達跌幅逾3%，群創、華亞科、和碩、仁寶等跌幅都逾1%，包括砷化鎵等族群持續上演軋空行情，搭配財報、配息亮眼的中小型股，讓電子指數仍上漲0.27%，占大盤成交比重69%。
金融股今天也處於「休兵」狀態，由開發金、元大金、玉山金當「值日生」，穩在盤上，撐住指數，但彰銀跌幅逾2%，還是拖累金融指數翻黑，金融指數下跌0.23%，占大盤成交比重5.8%。
傳產族群部分，今天漲跌互見，盤面上以與中概關連性較強個股較有表現，其他類股漲幅1.7%，而生技類股也提前為新藥股王浩鼎下周上櫃掛牌暖身，漲幅達1.8%。各類股中，以水泥類股跌幅較大，跌幅1.2%，塑膠、玻陶、橡膠、汽車、運輸、觀光百貨壓抑在盤下，但跌幅不重，其餘各族群則力守紅盤。
台股今天再度上演神奇的「拉尾秀」，一舉將指數由盤下拉至翻紅，同時也成功補量，讓單日成交值放大至1200億元以上。以周線來看，指數上漲170.34點，以1根長紅棒吞噬前2周黑棒。以今天大盤走勢以及權值股間輪動來看，盤勢仍穩穩在多方方掌控中，至於指數是否要趕在3月底前衝關9859點？只要成交量能溫和放大，搭配「雙軋」行情，多頭仍將持續朝此一目標挺進！", ,wantgoo
