,Post_Date_Time,News_ID,Headline,Author,Article_Content,Related_Stock_Number,Source
0,2015-10-14 19:02,291733,外資提款大立光12億元 台指期獲利了結 三大法人賣超6億元,鉅亨網記者李宜儒 台北,"【鉅亨網記者李宜儒 台北】國際股市全面回檔，台股今天也連續2天盤整，儘管權值股包括聯電、中信金、友達、華亞科等，以及中小型股如LED族群勉力撐盤，但仍不敵大盤回檔賣壓，終場下跌45.41點，以8522.51點作收。三大法人進出動作也大為縮小，外資賣超9.12億元，投信買超2.56億元，自營商買超0.35億元，合計三大法人賣超6.21億元。
期貨部分，三大法人則是同步站在空方，不過減碼口數並不多，其中外資減碼多單至209口，淨部位淨多單微降到23263口；自營商則是加碼空單783口，淨部位淨空單回升到2588口；投信則續加碼空單152口，淨部位淨空單續升到4645口。合計三大法人今天共減碼多單1144口，淨部位淨多單降到16030口。
聯電大老包括曹興誠、宣明智等，近期重心放在智慧穿戴裝置，而聯電旗下IC設計廠包括聯發科、智原、原相、盛群等，也交出健康量測的成績單，外資看好聯家軍在智慧穿戴裝置布局可望逐漸收割，今天大買聯電高達46892張，高居今天外資買超首位。
儘管外資今天在集中市場轉為賣超，不過外資對於權值股依然大多站在買超，包括晶圓代工龍頭台積電，NB代工廠英業達、仁寶，面板廠友達，封測廠矽品，電信商中華電、遠傳等，都是外資買超標的，只不過買超張數並不大。
而蘋果接連傳出晶片門及侵權事件，也讓外資對於蘋概股買超動作明顯縮小，買超張數最多的是欣興，張數為1344張，F-臻鼎買超693張，鴻準買超465張，正崴買超261張。其他包括鴻海、台郡、和碩、日月光、、大立光、可成、國巨等，都遭外資賣超，其中外資更中止對鴻海連10買超紀錄。
股王大立光今天股價持續走跌，同時外資賣壓也跟著放大，今天賣超481張，是10月以來單日最大賣超張數，以大立光今天收盤2550元計算，外資一天之內又從大立光提款12.26億元，遠遠超過外資今天買超居冠的聯電5.58億元。
矽品股東臨時會明天舉行，外資今天買超矽品2934張，賣超日月光688張。
而外資對金融股也依然未減，今天賣超首位輪到開發金，賣超達15561張，兆豐金也遭外資賣超12507張，外資賣超前10名中，金融股就佔了6檔，除了開發金跟兆豐金，包括台新金、中壽、中信金、元大金等。
今天外資集中市場買超第1名為聯電，買超張數46892張，第2名英業達，買超4384張，第3名玉山金，買超4362張，第4名中鋼，買超4275張，第5名中華電，買超3388張。6到10名依序為，仁寶，買超3082張；矽品，買超2934張；F-中租，買超2744張；富邦金，買超2563張；力成，買超2455張。
外資集中市場賣超第1名開發金，賣超張數15561張，第2名兆豐金，賣超12507張，第3名華航，賣超9603張，第4名台新金，賣超5016張，第5名中壽，賣超4735張。6到10名依序為，中信金，賣超4364張；元大金，賣超4088張；鴻海，賣超2911張；廣達，賣超2580張；華新，賣超2294張。
法人指出，台股連續2天陷入盤整，包括5日線及8500點的支撐都相當強勁。儘管外資開始將手中的台指期多單部位進行獲利了結，不過從口數來看，昨天減碼1544口，今天減碼209口，其實幅度都不大，以外資目前所持有的台指期淨多單部位仍有近2.36萬口來看，外資對於台股看多的態度依然未變，未來影響台股走勢的關鍵，包括明天的矽品股東臨時會結果，台積電及大立光的法說會，如果這些變數都能夠維持正向發展，台股可望重新啟動新的漲勢。", ,wantgoo
