,Post_Date_Time,News_ID,Headline,Author,Article_Content,Related_Stock_Number,Source
0,2015-09-24 14:50,286490,台股盤後－摩台期壓低結算 中秋變盤疑慮湧現 指數下跌70點回測8100,鉅亨網記者李宜儒 台北,"【鉅亨網記者李宜儒 台北】台股受到中秋連假在即，以及摩台期下周2即將結算影響，儘管早盤開盤一度收復8200點，不過10點過後賣壓開始湧現，包括鴻海、大立光、宏達電等都由紅翻黑，加上之前表現強勁的生技股也出現明顯回檔，指數一度下探8100點，終場下跌70.32點，以8123.1點作收，跌落到月線之下，成交量則擴大到820.05億元。
櫃檯指數則是受到生技股走弱拖累，走勢明顯較集中市場疲弱，終場大跌2.2點，跌幅達1.87%，成交量微幅擴增到265.32億元。
台股今天各大類股表現，以玻陶、生醫、水泥、汽車等相對較弱，跌幅超過2%，橡膠，化學生醫、電腦設備、電子通路、電子零組件、鋼鐵、塑膠、紡纖、化學、造紙、電機機械、貿易百貨等，也跌逾1%。
由於摩台指9月契約只剩2個交易日即將結算，外資有壓低結算壓力，因此摩根成分股F-TPK、緯創、聯發科、華亞科、宏達電、群聯、晶電、可成、聯強、巨大、和泰車、瑞昱、英業達、仁寶、台泥、聯詠、台玻、宏碁等，跌幅都超過3%。
昨天台積電首度以重大訊息方式，上修第3季財報目標，也激勵今天台積電表現強勁，終場上漲2.5元，漲幅2%，成為台股今天撐盤要角。
明天蘋果新款手機iPhone 6S及iPhone 6S Plus將正式上市開賣，蘋概股表現卻未受激勵，包括大立光、鴻海、可成、和碩，台郡、F-臻鼎、F-GIS都下跌，甚至F-TPK跌幅更達8%。
受到台積電大跌近3.5%拖累，半導體類股是今天台股最弱勢類股，跌幅也將近3.5%，另外食品、電子、電腦設備、電子通路、建材營造、電子零組件等，跌幅也都超過2%。光電、電器電纜、貿易百貨、資訊服務、金融、油電燃氣、航運、化學、紡纖、汽車、電機機械等，也跌逾1.5%。
今天表現相對強勢的則是航空概念股，中國國家主席習近平訪美，將下單380億美元訂購波音客機，台系相關供應商包括漢翔、豐達科、晟田、榮剛、千附等逆勢抗跌，其中晟田更強攻漲停。
至於之前的強勢指標生技股，今天則出現獲利回吐賣壓，包括科妍、國光生、亞諾法、葡萄王、台耀、雃博、杏輝、F-麗豐跌幅都超過4%；上櫃生技股，安克因為遭到分盤交易處分，今天以跌停作收，杏國也大跌逾9%，創源、醣聯、強生跌逾8%，久裕、南光、易威、鐿鈦、合世、F*太景、台微體、鈺緯、合一、永日、聿新科、基亞、訊聯、健亞等，跌幅也都超過5%。
另外日月光及矽品今天表現也同步走弱，由於日月光董事長張虔生在拜訪矽品董事長林文伯時表示，基於維護股東權益的原則，反對矽品與鴻海換股結盟，因此這場三角關係，未來仍充滿變數。
法人指出，台股近期接連失守多個整數關卡，今天又跌破月線，加上之前已先跌破5日線，顯示台股在量能不足下，在缺乏上攻力道之際，很難有效向上突破，不過今天指數未跌破9月9日的跳空缺口，加上後面還有8000點的整數關卡做為支撐，只要沒有重大的國際利空事件發生，預料台股將在8000-8500點之間進行盤整。", ,wantgoo
