,Post_Date_Time,News_ID,Headline,Author,Article_Content,Related_Stock_Number,Source
0,2015-04-22 14:40,223056,台股盤後─滬台通來了？股王股后率高價股衝鋒 重返9600,鉅亨網記者胡薏文  台北,"【鉅亨網記者胡薏文  台北】美股道瓊指數回軟，但陸股牛氣沖天，原本沈悶的台股，隨大陸證監會官員首度拋出研議「滬台通」，讓多頭士氣大震，早盤開高後，股王大立光衝關3000元達陣，大漲逾4%，股后漢微科也漲停站上2000元，激勵高價股衝鋒，金融證券股更是興奮，大盤開高走高，不僅衝過月線，也順勢站回9600點大關！加權指數收盤時上漲79.02點，以9613.00點作收，成交值放大至1023.93億元。
電子權值股中，今天股王表現最搶眼，大漲4.07%，再創3065元新天價，而股后漢微科衝上2020元漲停，也讓上櫃中小型股一掃陰霾。大立光表現亮眼，激勵高價股，可成大漲逾6%，聯發科漲幅逾2%，重返400元，研華、華碩漲幅也都近4%，而NB族群中，英業達配息高殖利率，助攻漲停，仁寶漲幅逾1%。不過友達依舊跌幅逾2%，鴻海、廣達、矽品還是被壓抑在盤下，電子指數漲幅上漲1%，占大盤成交比重62%。
證券股部分，今天對「滬台通」議題，予以熱烈「漲聲」回應，權值股中，元大金漲幅2.5%一馬當先，國泰金漲幅也逾1%，台灣50成分股中，僅有台新金小黑、合庫金平盤，幾乎全數收紅。金融指數上漲0.62%，占大盤成交比重7.1%。
傳產族群部分，今天大多也順勢展開反攻，紡織、機電、化工、油電燃氣漲幅都逾1%，不過水泥、食品、電器、玻陶、營建、橡膠、觀光等，依舊壓抑在盤下。
沈悶了好幾天的台股，今天終於一吐悶氣！而今天台股能夠收復月線、9600點，同時量能終於又看到千億元的最重要關鍵字，就是「滬台通」！儘管金管會表示，大陸拋出「滬台通」議題，須有全民共識，但以今天台股以「漲聲」回應來看，顯然市場有所期待。大盤今天成交量能回升至千億元，指數則以紅棒突破月線、5日線與10日線，與9600點，暫時化解下檔失守季線疑慮。以大盤位置來看，仍舊在9700-9500點箱型區間中，多頭以今天的紅棒，爭取到再次挑戰9700點的機會，而後續攻勢能否延續，成交量能升溫將是不可或缺的要件！", ,wantgoo
