,Post_Date_Time,News_ID,Headline,Author,Article_Content,Related_Stock_Number,Source
0,2015-08-14 10:40,272616,MSCI個股權重台積電降最多 提防「摩」咒效應,鉅亨網記者趙曉慧 台北,"【鉅亨網記者趙曉慧 台北】MSCI(明晟)今(13)晨公佈最新季度調整，台股成分股均無變化，但個股權重降幅最大的個股是台積電(2330) ((US-TSM))，聯電(2303)((US-UMC))也在調降之列，顯示法人對台灣電子股旺季不旺的疑慮甚高，相當不利台積電後續走勢，今天盤中下跌近2%，以126元繼續下探波段新低。
MSCI全球指數是一般俗稱的「摩根指數」或「大摩指數」，每季調整一次，據信全球約有超過80%基金經理人，會以MSCI全球指數，作為資金配置與避險策略的參考指標，是為「摩根效應」。
如果成分股、個股獲得MSCI調高權重，表示將會吸引國際資金投資、後市看漲；反之，若遭到剔除，後市看跌。
根據今晨公佈最新的MSCI季度調整，台股成分股均無變化，但個股權重降幅最大的個股是台積電，其次依序為開發金，聯發科、宏達電、群創、台新金、研華、聯電、潤泰新。
調升權重為多依序為遠傳、F-臻鼎、玉山金、華航、陽明、仁寶、可成、日月光、中鼎。
昨天經濟部宣布鬆綁12吋晶圓登陸法令，明顯為台積電解套，但股價今天並未因此受到激勵，反而因為台積電成為MSCI最新季度調整當中個股權重降最多者，今天盤中下跌近2%，以126元繼續下探波段新低。", ,wantgoo
