,Post_Date_Time,News_ID,Headline,Author,Article_Content,Related_Stock_Number,Source
0,2015-10-16 14:40,292356,台股盤後－權值股甩尾 指數急拉16點 8600點失而復得,鉅亨網記者李宜儒 台北,"【鉅亨網記者李宜儒 台北】台積電下修半導體展望，加上金管會回復融券成數，台股今天開平低，儘管太陽能族群表現亮眼，鴻海集團也呈現抗跌，不過不敵晶圓雙雄走跌影響，指數陷入狹幅盤整，高低價差僅約53點，8600點附近多空交戰激烈，最後1檔出現136億元大量，推升指數由黑翻紅，終場上漲3.43點，以8604.95點作收，成交量增到940.38億元。周線上漲158.99點，連3紅。
櫃檯指數也在生技股轉強撐盤下，指數全場幾乎都在平盤之上，終場上漲0.37點，以122.34點作收，成交量251.40億元。周線上漲2.01點，連3紅。
台股今天以化學、資訊服務、化學生醫、造紙、生醫等表現相對強勁，漲幅都在1%以上，另外電子零組件、金融、汽車、航運、水泥、網路通信、建材營造等，漲幅在0.5%以上。不過橡膠、鋼鐵、玻陶、半導體、電機機械等，則是相對弱勢，跌幅也超過0.5%。
台積電昨天下修今年全年全球半導體展望，將成長率降到0，導致台積電今天開盤就大跌3元，盤中最低一度來到136元，尾盤跌幅小幅收斂，下跌2.5元，以137.5元作收。台積電走跌也拖累聯電，中止前2天的漲勢，終場小跌0.15元，以12.15元作收。
大立光昨天公布法說會公布財報，也間接否認掉單傳言，大立光雖然早盤一度開高，直逼2700元，不過追價買盤疲弱，漲幅逐漸收斂，終場以平盤2585元作收。
另外矽品股東臨時會否決了與鴻海的換股策略聯盟，外界紛以利空出盡解讀，推升矽品股價開高，全場漲幅在2-3%之間，終場上漲1.5元，以43.9元作收；日月光股價也跟著矽品反彈，開高後呈現整理，終場小漲0.95元，以38.5元作收。
太陽能及遊戲類股則延續昨天的漲勢，其中遊戲類股第三方支付商歐付寶效應持續發酵，包括辣椒、宇峻、歐買尬、網龍都亮燈漲停；太陽能股的元晶、昱晶也漲停，其他包括益通、茂迪、新日光、碩禾、中美晶也都收紅。
蘋概股部分則是漲跌互見，其中鴻海集團蘋果供應鏈包括鴻海上漲1.1元，鴻準上漲1元，F-臻鼎上漲0.1元，F-GIS則是以平盤作收，至於和碩、可成、台郡、F-TPK則是收黑。
法人指出，今天台股尾盤出現136億元的大單，拉抬包括台積電、聯電、日月光、矽品、友達、華亞科等權值股，推估這筆買盤主要來自外資，為了因應下周台指期將結算，先行穩住台股，等到下周結算前在伺機拉高結算。整體觀察，台股因為底部逐漸墊高，目前多空決戰點約落在8600點，不過因為金管會回復融券保證金成數，再加上指數也來到反彈的相對高點，空方會不會重啟攻勢，值得觀察。", ,wantgoo
