,Post_Date_Time,News_ID,Headline,Author,Article_Content,Related_Stock_Number,Source
0,2015-10-28 11:20,294472,蘋果財報獲利大增31% 蘋概股慶祝行情落空零星表現,鉅亨網記者李宜儒 台北,"【鉅亨網記者李宜儒 台北】智慧型手機龍頭廠蘋果((US-AAPL))公布7-9月財報，營收、毛利率、獲利均創新高，不過受中國地區營收不增反減影響，引發市場疑慮，台系蘋概股也未演出慶祝行情，僅有F-GIS(6456)大漲逾6%，大立光(3008)、和碩(4938)力撐小紅，鴻海(2317)、台積電(2330)、正崴(2392)均下跌。
同樣身為蘋果觸控供應商的F-TPK(3673)則是下跌逾1%，機殼廠也是漲跌互見，可成(2474)小漲1.5元，鴻準(2354)、F-鎧勝(5264)則是分別下跌0.3元及1.5元。
蘋果7-9月營收為515億美元(約新台幣1兆6634.5億元)，年增率22%，也優於市場預期的511億美元；毛利率39.9%，高於去年同期的38%；稅後純益111.2億美元，年增率30.6%；每股稅後純益1.96美元，高於外界預期的1.88美元，也優於去年同期的1.42美元。
主要產品出貨部分，單季iPhone手機出貨量為4805萬台，年增率22%，不過低於預期的4872萬台；Mac電腦出貨570萬台，創新高，年增率3%，創下新高；iPad銷售則是持續下滑，僅980萬台，年減率達20%。
展望10-12月，蘋果預估，營收將介於755-775億美元，毛利率介於39-40%，營業費用則約63-64億美元。", ,wantgoo
