,Post_Date_Time,News_ID,Headline,Author,Article_Content,Related_Stock_Number,Source
0,2015-09-11 08:42,281030,券商分析摘要,鉅亨台北資料中心,"【鉅亨台北資料中心】◆券商推薦個股排行： ◆ 大慶證：
上證小跌1.39%但仍守穩5日線、德股下跌0.9%、 美股四大指數小漲。經濟數據部分，中國8月PPI年減5.9%，差於預期年減5.5%， 中國製造業不振，通縮疑慮起，不過人民幣不貶反升，研判在人行強力干預股匯市情況下，短期內陸股已止跌回穩。美國部分，上周初領失業金人 數減少6000人，來到27.5萬人，連續27周低於30萬人，就業市場穩定成長。目前國際股市最大的兩個 變數為中國經濟趨緩以及美國聯準會利率決策，研判在下周利率決策出爐前，國際股市仍是震盪盤整格局。 ◆ 新光證：
油價大跌、蘋果產品發表會無亮點，拖累美股大跌，亦使得10日台股開低，所幸北市降囤房稅，帶動營建股衝高，另配合BTC閉幕，生技利多大放送，在買盤進場下，跌勢縮小，終場加權指數收在 8268.68點，下跌18.24點或0.22%，成交額859.26億元。OTC指數收在 114.35點，上漲1.17點或1.03%，成交額214.86億元。僅管亞股隨美股走弱而回檔整理，不過台股順利收紅K，表現僅弱於韓股，惟量能降溫，外資台指期未平倉淨多單大減萬餘口，現貨從大買轉小買，投信及自營則是轉賣超，顯示法人也不敢看太好，不過，下週證所稅拚三讀，行政院亦研擬「限制型股票改淨值課稅」，在政府作多效應下，8200點有撐，建議留意8月營收創新高個股。 ◆ 大昌證券：
昨日台股較不受國際股市走跌影響，呈現開低走高，逆勢抗跌，雖然未回平盤之上，但是跌幅逐漸收斂，終場僅小跌18.24點作收。三大類股漲跌互見，電子族群跌幅較重將近1%，由於權值股大幅反彈，短線整理修正，仍有族群維持走強，像是光通訊、手機零組件等。傳產類股中生技、紡織等相關個股維持走強，短線上紡織、生技族群仍可留意。金融指數平盤附近震盪收紅，10日成重要支撐，可多做留意。櫃買指數相對強勢，中小型個股輪漲態勢，加上生技族群帶動，依舊可持續留意。而營收昨日公布完畢，操作上建議留意營收有成長的個股較佳。 ◆ 統一證：
雖然受到前一日美股大跌影響，昨日台股開盤下跌39點以8247點開出，指數一度震盪走低，蘋果概念股在新產品發表後，大立光、可成、鴻海、台積電等相關個股反而走弱，拖累電子族群表現。不過，多頭反手拉抬傳產股，指數力守8200點整數關卡，尾盤跌幅縮小。觀察盤面變化，電子類股下跌0.91%，傳產類股上漲0.74%，金融類股上漲0.06%。電子次族群以電腦及週邊設備、通信網路業、資訊服務等表現較佳，分別上漲0.82%、0.5%、0.49%，而半導體及光電下跌1.95%、0.94%表現最差。傳產族群以橡膠類、營建類、汽車類等表現較佳，分別上漲3.86%、2.44%、2%，而塑膠類及電子類下跌0.33%、0.91%相對弱勢。終場加權指數下跌18點，收在8268點，成交量能為852億。", ,wantgoo
