,Post_Date_Time,News_ID,Headline,Author,Article_Content,Related_Stock_Number,Source
0,2015-04-29 14:45,225479,台股盤後─電子法說變跳水秀！摩台摜壓結算 倒退嚕破9859,鉅亨網記者胡薏文  台北,"【鉅亨網記者胡薏文  台北】美股、陸股都維持在高檔震盪，但台股面對史上最「無感」的萬點行情，內資多頭還是顯得相當躊躇。今天有摩台指結算，台股早盤以平低盤開出，電子族群中率先召開法說公布財報的華亞科、可成跌停，宏達電重挫5%，在法說會後上演「跳水秀」，電子半導體、蘋概股、手機相關零組件全都臉綠，連金融類股也都欲振乏力，大盤震盪走低，摩台指結算反而遭到外資反手摜壓，大盤重挫逾百點，9859前波高點未能守住！加權指數收盤時下跌103點，以9853.83點作收，成交值縮至1137.62億元。
電子權值股中，可成首季匯損2億元，遭到法人借題發揮，重挫跌停，加上華亞科、宏達電釋出的相關訊息，都不如預期，雙雙走軟，而可成首季匯損，也讓電子外銷族群臉色鐵青，華碩重挫4%，大立光、台達電、日月光、鴻準、友達跌幅都逾2%，電子軟趴趴，電子指數下跌1.71%，占大盤成交比重54%。
金融權值股部分，早盤還一度在開放陸客買保單的題材激勵下攻高，但力撐不到半場，隨電子指標股跳水，短線漲多金融股也出現調節賣壓，開發金跌幅逾3%，中信金跌幅逾2%，其餘各金融權值股跌幅多在1%上下，只剩下富邦金還力守紅盤。金融指數下跌1.07%，占大盤成交比重17.3%。
傳產族群部分，今天明顯較電子、金融抗跌，汽車、營建漲幅都逾1%，食品、紡織、電器、化工、玻陶、造紙、橡膠、運輸、觀光都力守紅盤！水泥、塑膠、機電、鋼鐵、百貨雖壓抑在盤下，但跌幅在1%以內。
加權指數連2天盤中都突破萬點，但隨即演出「萬點快閃秀」，停留在萬點之上的時間都極短，今天摩台指結算，華亞科、可成等電子指標股都重挫跌停，外資反手摜壓，後半場連金融族群也加入摜壓行列，讓加權指數重挫逾百點，今天收盤位置不僅跌破5日均線，也跌破9859點前高，短多優勢明顯面臨威脅！以K線來看，大盤在攻高後連2天量縮收黑，目前大盤仍力守在9839-9814點第2個跳空缺口之上，且也未失守帶1686億元超大量紅棒低點9839點，短多尚未遭到破壞。
不過今天電子、金融雙雙走軟，也得特別留意，如多頭要維持盤面輪動，就不能讓電子、金融雙雙續軟，否則有輪漲轉為輪跌疑慮。短線下檔仍以9839-9814，以及9630-9655點二道多方跳空缺口為支撐，不宜失守9800點，否則需提防這波的萬點行情，又變成夢一場！", ,wantgoo
