,Post_Date_Time,News_ID,Headline,Author,Article_Content,Related_Stock_Number,Source
0,2015-10-13 19:05,291382,台股盤整休息 外資低接權值股 三大法人買超12億元,鉅亨網記者李宜儒 台北,"【鉅亨網記者李宜儒 台北】台股今天權值股休息，改由金融股、非蘋手機陣營及中小型類股撐盤，指數呈現狹幅回檔整理，午盤過後跌幅開始收斂，終場小跌5.82點，以8567.92點作收。三大法人則是互有買賣超，其中外資持續買超23.85億元，投信也小幅買超2.56億元，自營商則因為避險需求，轉為賣超13.87億元，合計三大法人仍維持買超12.55億元。
期貨部分，三大法人也是多空分歧，其中外資減碼多單至1544口，淨部位淨多單微降到23611口；自營商則是持續回補空單88口，淨部位淨空單降到1732口；投信則續加碼空單41口，淨部位淨空單續升到4469口。合計三大法人今天共減碼多單1497口，淨部位淨多單微降到17410口。
儘管今天台股權值股呈現休息，不過外資買超標的依然集中在權值股，包括昨天買超的面板雙虎及晶圓雙雄，今天依然持續擠入外資買超前10名，另外DRAM股華亞科也持續獲外資買超；另外金融股也有新光金、合庫金、華南金也獲外資買超。
蘋概股部分，今天外資標的主要集中在鴻海、欣興、可成、F-臻鼎、正崴等。至於華通、和碩、F-TPK、鴻準、台郡、國巨、F-鎧勝、F-GIS等，則是遭到外資賣超。
至於股王大立光今天再度跌破2700元大關，外資也是由買超轉為賣超，賣超158張。
另外日月光及矽品的經營權大戰，外資今天則是同步賣超日月光及矽品，不過賣超日月光達8176張，至於矽品賣壓稍輕，僅遭賣超1654張。
至於外資對於金融股的主要賣壓，今天轉到玉山金身上，取代之前的中信金，總計玉山金遭賣超達13499張，不過中信金也依然遭外資賣超7997張，其他包括國泰金、中壽、第一金、富邦金、開發金、台新金、台中銀、聯邦銀等，也均遭外資賣超。
今天外資集中市場買超第1名為聯電，買超張數14127張，第2名華亞科，買超13079張，第3名英業達，買超9432張，第4名台積電，買超7894張，第5名友達，買超7341張。6到10名依序為，群創，買超6806張；新光金，買超5354張；中鋼，買超4341張；合庫金，買超3966張；華南金，買超3344張。
外資集中市場賣超第1名玉山金，賣超張數13499張，第2名兆豐金，賣超9014張，第3名日月光，賣超8176張，第4名中信金，賣超7997張，第5名國泰金，賣超6654張。6到10名依序為，滬深2X，賣超4561張；華通，賣超4440張；中壽，賣超4124張；和碩，賣超4117張；上証2X，賣超3929張。
法人指出，今天台股呈現漲多拉回整理走勢，不過因為多方氣勢仍強，因此拉回幅度不高，包括5日線及8500點的支撐都相當強勁。由於下周三10月台指期契約將進行結算，以目前外資台指期淨多單仍有將近2.4萬口來看，基本上拉高結算的機率將高於壓低結算，因此對於台股後市持續上攻仍屬有利。", ,wantgoo
