,Post_Date_Time,News_ID,Headline,Author,Article_Content,Related_Stock_Number,Source
0,2015-10-19 14:40,292606,台股盤後－蘋概沒電 大立光挫逾5% 指數無力攻高 8600點高檔整理,鉅亨網記者李宜儒 台北,"【鉅亨網記者李宜儒 台北】台股今天受到蘋概股走勢疲弱拖累，股王大立光大跌逾5%，儘管遊戲族群、節能群群依然延續上周的漲勢，但指數無法大幅攻高，陷入高檔整理，終場小漲26.55點，以8631.50點作收，成交量縮小到802.86億元。
櫃檯指數今天表現略遜於集中市場，午盤過後指數跌落平盤之下，尾盤重新拉回到平盤之上，終場小漲0.05點，以122.39點作收，成交量240.43億元。
台股今天以電機機械、油電燃氣、水泥、生醫、橡膠表現相對較好，平均漲幅都在1%以上，另外金融、塑膠、貿易百貨、化學生醫、航運、玻陶、化學、通信網路、建材營造等，也有0.5%以上的漲幅。至於光電則因為大立光大跌拖累，類股指數重挫1.5%，汽車、造紙、電子零組件、食品等也收黑。
受到研究機構指出，蘋果iPhone 6S銷售狀況將無法超過去年的iPhone 6，並可能下修零組件訂單15%，使得蘋概股今天成為拖累台股的關鍵，其中股王大立光盤中一度跌到2420元，再創今年新低，終場仍重挫5.2%。大立光表現不佳，也拖累包括鴻海、和碩、台郡、F-臻鼎、可成、鴻準等均全部收黑。
反觀宏達電近期動作頻頻，包括本周在紐約的新機發表會，外界預估宏達電此次發表的新機將是HTC One A9，激勵宏達電盤中一度攻上漲停，終場仍大漲8.2%，以81元作收，順利收復80元大關，也創下6月以來新高。
另外遊戲類股第三方支付商歐付寶效應持續發酵，包括辣椒、宇峻、歐買尬、網龍都亮燈漲停。節能股的LED也呈現反彈表現，其中新世紀亮燈漲停，光寶科、華興、雷笛克、兆遠、湯石等也以小紅作收。
儘管中國第3季GDP創下2009年以來最低，僅6.9%，中國官方保7宣告失敗，但仍優於外界預期的6.8%，至於中概股則因為中國五中全會下周召開，二胎開放政策可望列入十三五計畫，因此麗嬰房率先表態漲停。其他中概股包括正道、華星光、毅嘉、光環、F-大洋、廣宇、宏碁、萬海、漢平、堤維西、為升、江申、雙美、胡連、遠百等，漲幅均超過3%。
而中國南通富士通宣布斥資3.7億美元，收購超微馬來西亞與蘇州封測廠，南通富士通將與超微合資成立公司，南通富士通持股85%，超微持股15%，排名可望擠進全球前十強，恐對台灣封測廠造成衝擊，包括日月光下跌1.5%，矽品更大跌近3%。
法人指出，今天台股類股輪動明顯，不過身為攻堅要角的蘋概股卻因為蘋果銷量不如預期，反倒拖累台股，也讓台股今天指數無法有效向上拉高，整體來看，台股指數從9月底開始就沿著5日線緩步向上，包括月線及季線都已逐漸轉為台股下檔有力支撐，今天8600點也相對有撐，預料台股仍將維持沿著5日線，以盤整方式逐漸墊高底部。", ,wantgoo
