,Post_Date_Time,News_ID,Headline,Author,Article_Content,Related_Stock_Number,Source
0,2015-08-25 18:51,275530,蘋果香誘搶反彈 外資淨買超蘋概股金額達48億元,鉅亨網記者張欽發 台北,"【鉅亨網記者張欽發 台北】台北股市股王大立光(3008)今天拉出長紅棒以漲停價2945元作收，加上台股精神領袖的台積電(2330)及鴻海(2317)的上漲，三者在今天台北股市的漲勢中奠定終場以上漲265.5點的7675.64點作收的基礎；同時，依盤後資料顯示，今天外資在台股集中市場淨買超蘋果概念股的金額達到48.48億元，並以買超台積電2.09萬張，買超金額24.6億元最高。
而會計師、證券及期貨分析師張陳浩分析，在政府公部門對於台北股市的漲跌注意力提高，加上傳出將動用國安基金進場對台股護盤的市場搶反彈氣氛之下，目前則以最具產品出貨題材的蘋果iPhone 6s系列新手機最夯，這在今年以來非蘋陣營手機銷售不振之下，蘋果的9月新機題材下成為外資在台股跌深之後搶進質優個股的重要標的。
同時，在今天台股早盤因投資人搶反彈及外資搶回補與台積電競飆的大立光走勢也引人注意，大立光今天拉出長紅棒以漲停價2945元作收，貢獻台北股市集中市場加權股價指數有12.19點的漲點；連同台積電貢獻的75.61點及EMS大廠鴻海貢獻的17.66點漲點，該三劍客今天合計在台北股市集中市場加權股價指數高達105.46的漲點。
就今天台股外資在個股的淨買超張數和均價計算，外資在台積電買超24.6億元局首位，對大立光淨買超409張金額11.66億元，對於可成(2474)淨買超1336張，金額達4.11億元，買超鴻海金額4.26億元
在蘋果供應鏈PCB相關個股方面，外資今天買超CCL廠台光電(2383)3221張，淨買超金額為2.13億元，買超華通(2313)金額3681萬元；在軟板類股上，外資買超嘉聯益(6153)5741張，淨買超金額也達到1.3億元；值得注意的是，今天外資對於台郡(6269)屬於小幅賣超的格局。
張陳浩也指出，在全球股災的同時，投資人更應沈穩以對，並等待籌碼的有效沈澱，而見到今天外資大搶蘋果供應鏈相關個股，不僅突顯蘋果新機出貨帶來的題材，更顯示股市「跌時重質」的特性。", ,wantgoo
