,Post_Date_Time,News_ID,Headline,Author,Article_Content,Related_Stock_Number,Source
0,2015-04-30 09:25,225976,瑞儀下半年智慧手機訂單動能強 拚全年營收成長20%,鉅亨網記者楊伶雯 台北,"【鉅亨網記者楊伶雯 台北】
瑞儀(6176)首季營運淡，董事長王本然指出，下半年智慧手機訂單將正式出貨，預期將是今年重要的成長動能，占營收比重將達20-25%，今年第1季可以說是全年低點，預估第2季營收季增1成，全年營收可較去年成長15-20%。
瑞儀第1季營收94.38億元，季減37.2%，年減24.9%，主要受客戶新舊產品世代交替及淡季影響，毛利率降至10.2%，較去年第4季毛利率14.08%及去年同期毛利率13.51%下滑，稅後淨利3.95億元，較去年第4季稅後淨利13.87億元大減71.5%，每股盈餘0.85元，較去年第4季每股盈餘2.98元減少71.5%，較去年同期1.69元減少49.6%。
王本然表示，今年資本支出30億元，主要是投入智慧手機生產線，去年原本規劃要在第4季量產出貨智慧型手機用背光模組產品，因客戶指定的零件廠商良率無法達到預期，造成無法如期出貨，經過去年的準備，今年拿到4.7吋和5.5吋智慧手機背光模組訂單，預計下半年將正式出貨。
在今年各產品的營收占比部分，王本然說，預估9.7吋和7.9吋的平板出貨減少20%，但下半年12.9吋大尺寸iPad出貨，將抵銷一部分的衝擊，預期筆電和平板占營收比重將由去年的70%降低到55-60%；4.7吋和5.5吋智慧手機背光模組訂單下半年正式出貨，預估智慧型手機占營收比重將達20-25%；另外，去年拿到小米電視訂單，預估今年電視、監視器等相關產品營收占比17-18%。
他表示，今年上下半年營業額比重可能是35:65，或是30:70，要看下半年智慧手機的出貨情況而定，今年第1季為全年低點，第2季營收預估可成長10%，全年營收成長15-20%。
瑞儀去年營收513.71億元，年減19.2%，稅後淨利37.26億元，年減20.9%，每股稅前盈餘10.3元，每股盈餘8.01元，董事會通過股利政策，擬配發5.5元現金股利，配息率約為68.66%。", ,wantgoo
