,Post_Date_Time,News_ID,Headline,Author,Article_Content,Related_Stock_Number,Source
0,2015-09-18 14:55,283012,台股盤後－憂央行降息 金融尾盤遭摜壓 指數小漲16點,鉅亨網記者李宜儒 台北,"【鉅亨網記者李宜儒 台北】美國確定不升息，國際股市回檔整理，加上證所稅確定進入朝野協商，台股今天表現溫吞，早盤開低一度跌破8400點，指數隨即翻回到平盤之上，尾盤市場擔憂下周央行可能降息，金融股利差將遭壓縮，彰銀、國泰金、元大金、中信金等均遭摜壓，台股漲幅收斂，終場小漲16.64點，以8462.14點作收，成交量943.1億元。
櫃檯指數則是在紡纖、網通、生醫等族群大漲推升下，終場上漲1.7點，以119.65點作收，漲幅達1.44%，順利站上季線118.88點，成交量278.78億元。
台股類股今天以造紙表現最強勁，漲幅超過2%；鋼鐵、生醫、化學、貿易百貨、紡纖也上漲1%以上。至於昨天相對強勢的油電然氣類股，今天反成為弱勢指標，下跌逾2%，水泥也下跌逾1%。
金融族群今天尾盤急殺，出乎外界預料，主要是市場擔憂台灣央行下周可能反向降息，因此包括權值股彰銀、兆豐金、中信金、國泰金、合庫金、元大金、富邦金、新光金均收黑。
電子權值股今天表現相對壓抑，鴻海收在平盤，台積電小漲0.5元，大立光小跌15元，漢微科下跌50元。雙D族群也是漲跌互見，DRAM廠華亞科小漲0.35元，南科小漲0.45元；友達及群創則是同步下跌0.1元。
紡纖股在美國運動品牌UA創下歷史新高帶動下，儒鴻盤中一度飆高到549元，再創歷史新高，尾盤上漲13元，聚陽則是開平走高，最後收在最高279.5元；布廠得力則是強攻漲停，銘旺實上漲4.1元。
生技股也持續成為資金關注焦點，永昕、醣聯、安克、展旺、德英亮燈漲停，健喬、健亞、中天、智擎、浩鼎、永日、基亞、易威、鈺緯也上漲逾5%，而昨天受到海外存託憑證定價低於市價衝擊的安生藥，今天止跌回穩，上漲6.25%。
至於矽品及日月光，其中矽品今天表現相對強勁，終場上漲1元，以43.15元作收，距離日月光公開收購的45元價差越來越小，創下近2個月新高。而日月光早盤公布，收購矽品股票已達5%，收購案已經成案，但是日月光股價卻收黑，下跌0.35元。
蘋概股部分，可成上漲4元，鴻準下跌0.5元，F-鎧勝上漲4.5元，F-臻鼎下跌0.5元，台郡小漲0.1元，和碩下跌1元。
法人指出，今天台股因為美國確定暫緩升息，因此之前押寶不升息而先行搶進的買盤獲利了結，同時市場也擔憂央行下周理監事會議可能出現降息的決議，因此金融股反倒成為尾盤摜壓的標的。不過台股今天回檔下探8400點，低接買盤隨即進場，顯示在短期均線都翻揚向上的態勢下，回檔就會有買盤接手，但追高意願不高，因此預料台股將在8400點附近先行盤整，緩步挑戰季線8522點。", ,wantgoo
