,Post_Date_Time,News_ID,Headline,Author,Article_Content,Related_Stock_Number,Source
0,2015-06-02 11:30,238189,台股盤中─外資在權值股提款中 中小型個股擔綱秀彈力,鉅亨網記者張欽發 台北,"【鉅亨網記者張欽發 台北】台北股市6月2日的整體表現上以中小型個股擔綱演出為主，其中在OTC的指數表現並遠勝於集中市場股價指數，包括台積電(2330)、聯發科(2454)、可成(2474)及大立光(3008)等權值及指標個股的股價表現不振；證券分析師陳唯泰指出，由於6月的新台幣匯率走勢依過去以來的慣性走勢可能趨貶，使外資在6月可能分批調節手中大型權值股。
台北股市目前已跌破月線及季線，但陳唯泰認為，近期台北股市集中市場加權股價指數仍將維持在季線及半年線之間的區間整理走勢。
以昨日的台股盤後數據來看，外資6月1日在台股賣超金額為91億元，其中賣超台積電的金額即占24.95億元，而今天早盤台積電在美國ADR也呈現下跌作收。外資交易室主管認為，未來台積電可能出現較先前來自UPS(瑞銀)所提出的庫存說之外的更多利空。
同時，外資今天在台北股市電子股的參與強度並不高，這從今天台股盤中電子股占集中市場的成交比重僅及58%可見一斑。
台北股市集中市場加權股價指數6月2日以9619.66點開出，最高9657.02，最低9584.56，預估全場成交值為1012億元，各類股走勢以食品類股最強，漲幅為1%，其次為塑化類股的0.91%漲幅。
同時，南韓出現的傳染力遠較SARS強大的MERS-CoV病毒疫情攪局，目前並獲證實25人確診且已兩人因此一疫情死亡。", ,wantgoo
