,Post_Date_Time,News_ID,Headline,Author,Article_Content,Related_Stock_Number,Source
0,2015-03-22 11:03,210935,〈名師解盤〉杜富國:續攻9859目標不變！軋空股忌放空,鉅亨網記者胡薏文  台北,"【鉅亨網記者胡薏文  台北】美國聯準會主席葉倫對於升息，強調雖在文字上拿掉「耐心」但不代表沒耐心，不僅激勵美股大漲，台股的「熱錢派對」也展開續攤，價量齊揚，讓加權指數周線大漲170.34點，以9749.69點作收，登上7年多來新高。美嘉國際資產管理公司總經理杜富國指出，台股中期區間為9220點至9859點，短線上只要9593點未破前，續攻9859點目標不變！同時台股進入股東會前2個月融券強制回補高峰，「軋空」行情登場，軋空股在未做頭之前，切忌放空！
杜富國表示，3月台指期拉高結算後，外資熱錢派對「續攤」，迅速在4月台指期建立大量的偏多留倉部位，本周淨多單仍達1.3萬口，與前一波「熱錢派對」相同，外資目的仍是為指數。不過這波，因台股進入融券強制回補高峰清明前有近20萬張融券需強制回補，因此內資也同步在個股部分，順勢演出「軋空秀」！
杜富國分析，台股指數區間，以中期角度看，為9220-9859點區間，短線上9593點未破前，指數仍看漲。除非本波低點9472點遭到長黑摜破，才有轉弱疑慮。
至於短線在選股操作上，杜富國指出，投資人可留意具底部型態股，其中鴻海(2317)、國泰金(2882)為2大龍頭指標，小型股部分還包括旺宏(2337)、閎暉(3311)、云辰(2390)、禾瑞亞(3557)等，也可列入觀察。但更重要的是，「正在軋空」的個股，在未做頭前，切忌放空！軋空指標股，包括和碩(4938)、F-TPK(3673)、宏捷科(8086)、原相(3227)、可成(2474)、穩懋(3105)等。
富蘭克林華美傳產基金經理人楊金峰也認為，相較過去幾次對萬點行情的期待，無論就資金面、基本面及題材面，今年都是最有機會達陣的一年，且目前盤勢類股輪動健康，外資期貨淨多單回到萬口以上水準，加上大盤中期均線維持多頭排列，不排除指數最快有機會在第1季末至第2季初上攻萬點。短線上，因近關情卻加上9800點反壓不輕，不排除指數衝關時會有一段時間震盪，但震盪過後，可望延續一段走勢。
在選股方面，楊金峰表示，電子可續抱的次產業包括晶圓代工、鏡頭、金屬機殼、POS系統等，可伺機佈局的則為封測、Apple pay相關概念股；傳產股則持續關注歐美復甦概念的製鞋、織帶鞋帶、汽車零組件、房屋修繕、衛浴設備等，若下半年中國經濟明顯好轉，則可留意中國內需消費相關的環保工程、零售通路、連鎖餐飲等。", ,wantgoo
