,Post_Date_Time,News_ID,Headline,Author,Article_Content,Related_Stock_Number,Source
0,2015-05-20 14:45,233323,台股盤後─逃過「520魔咒」難敵結算賣壓！金電軟 9700站不穩,鉅亨網記者胡薏文  台北,"【鉅亨網記者胡薏文  台北】美股道瓊指數衝過1萬8300點，再登新高，陸股上證也勇闖4500點達陣，漲幅逾2%，但台股今天又演出「獨憔悴」行情。不過今天造成台股表現黯然的原因，並非「520魔咒」，而是5月台指期結算。台股今天一早開平後，市場一度擔憂「520魔咒」再發威，不過總統馬英九記者會結束，大盤跌幅並未擴大，仍力守9700點之上，反而是12點半過後，電金權值股明顯遭到壓盤，9700點失守。加權指數收盤時下跌31.46點，以9685.31點作收，成交值縮至976.27億元。
電子權值股部分，今天鴻海、鴻準雙雙都「近關情怯」，在百元關卡前徘徊，以小黑作收，股王大立光挑大樑，盤中再改寫3350點新天價記錄，台積電遭壓盤，勉強撐住平盤，面臨百元關卡保衛戰的宏達電，跌幅逾1%，也拖累可成翻黑，跌深的聯發科力守紅盤。今天盤面中小型股以跌深股反彈為主，包括USB 3.1、電子零組件、弱勢網通股等，都出現反彈。電子指數下跌0.06%，占大盤成交比重61%。
金融權值股部分，今天是前半場力抗「520魔咒」的重要功臣，元大金、兆豐金、永豐金、中信金力守紅盤，但尾盤期指結算賣壓，包括富邦金、彰銀、台新金跌幅都逾1%，拖累金融指數下跌0.31，占大盤成交比重8.86%。
傳產族群部分，今天也多壓抑在盤下，玻陶、汽車、百貨、油電燃氣跌幅都逾1%，僅有食品、機電力守紅盤。今天盤面最強勢的傳產族群為低價紡織股，今天共有9檔紡織股漲停，其中低於20元的「銅板股」多達5檔！
外資在台指期淨空單部位仍達1.2萬口，似乎註定今天的台股，就算逃得過「520魔咒」，但還是躲不過台指結算摜壓。今天台股前3分之2場力抗魔咒，撐住9700點，但尾盤還是出現電子金融權值股遭到壓盤，9700點還是沒站穩，外資空單結算還是大賺。不過以今天K線來看，量縮收黑，下檔仍力守住季線與5日線、10日線之上，在今天台指期結算後，明日「換邊發球」，多頭如能順利帶量上攻，第一目標區將為月線！", ,wantgoo
