,Post_Date_Time,News_ID,Headline,Author,Article_Content,Related_Stock_Number,Source
0,2015-09-30 18:50,287719,就是看多！外資淨多單直逼2.4萬口 三大法人小賣7億元,鉅亨網記者李宜儒 台北,"【鉅亨網記者李宜儒 台北】台股今天隨著國際股市回穩，早盤開低後在台積電、鴻海等權值股帶動下，指數緩步上攻，終場上漲48.89點，收在最高點8181.24點，成交量也回升到1022.31億元。三大法人今天雖然持續站在賣方，不過幅度已大幅縮小，外資賣超3.09億元，自營商賣超1.81億元，投信賣超2.57億元，合計賣超7.47億元。
期貨部分，外資及自營商延續上周態勢，今天持續站在多方，其中外資續加碼多單1801口，目前淨部位淨多單已經來到23248口；自營商也回補空單424口，淨部位淨空單降到4045口。投信則是加碼空單155口，淨部位淨空單續增到3995口。合計三大法人今天共計加碼多單2070口，淨部位淨多單為15208口。
蘋果公布iPhone 6S及iPhone 6S Plus首波開賣銷售量達1300萬支，讓外資對於蘋概股後市翻多，今天大買台積電19361張，為外資買超首位，另外鴻海也獲外資買超7671張，鴻準也獲買超3136張，其他包括買超可成1898張，買超國巨1034張，買超正崴846張，買超F-GIS 619張，買超F-臻鼎478張，買超奇力新198張。
不過也不是所有蘋概股都獲得外資青睞，股王大立光就遭外資續砍798張，連續4個交易日賣超，和碩也遭賣超5456張，F-TPK也遭賣超1187張，欣興也遭賣超536張，F-鎧勝遭賣超475張，台郡遭賣超288張。顯示外資仍較青睞鴻海集團相關的蘋概股。
至於持續陷入僵局的日月光與矽品，雙方在中秋節假期中也是繼續各自放話，外資今天對矽品續買超8789張，連2天買超；另外也買超日月光407張，由於外資仍持有矽品超過50%股權，外資對於矽鴻戀的態度，也頗受外界注意。
金融股今天持續成為外資提款機，賣超前10名中，金融股就包辦了8檔，包括中信金、元大金、兆豐金、富邦金、台新金、第一金、國泰金、永豐金等，顯示上周央行調降重貼現率，依然衝擊外資對金融股獲利的信心。
今天外資集中市場買超第1名為台積電，買超張數19361張，第2名中華電，買超15107張，第3名玉山金，買超13642張，第4名矽品，買超8789張，第5名長榮航，買超8237張。6到10名依序為，鴻海，買超7671張；華亞科，買超5606張；統一，買超4846張；鴻準，買超3136張；群益證，買超2762張。
外資集中市場賣超第1名中信金，賣超張數59141張，第2名元大金，賣超30538張，第3名友達，賣超22116張，第4名兆豐金，賣超16427張，第5名富邦金，賣超15226張。6到10名依序為，台新金，賣超9629張；第一金，賣超8523張；國泰金，賣超7970張；永豐金，賣超7818張；和碩，賣超5456張。
法人表示，國際股市近日表現疲弱，原本外資應該會持續賣超台股，不過因為台股周一補假，周2又因為颱風休市，國際股市剛好在這幾天回穩，使得外資賣壓減緩。不過目前的關注重點在於外資的台指期部位，外資已經連續3天加碼台指期多單，使得淨多單部位持續增加，也顯示外資對於台股後市仍是偏多，尤其今天台股又是演出開低走高的格局，成交量也跟著放大，如果台股能維持千億元以上的成交量，後市仍有機會以盤整向上走勢，緩步墊高底部，繼續挑戰前波高點8488點。", ,wantgoo
