,Post_Date_Time,News_ID,Headline,Author,Article_Content,Related_Stock_Number,Source
0,2015-03-23 12:30,211100,清明前軋空秀上演！逾20萬張融券強制回補 20檔高券資比股出列,鉅亨網記者陳慧菱 台北,"【鉅亨網記者陳慧菱 台北】台股進入融券回補首波高峰期，高達434家上市櫃公司融券將在清明節前最後一個交易日4月2日前強制回補，初估將有逾18萬張融券需強制回補，如果加上借券回補，恐超過20萬張，因此內資也同步在個股部分，順勢演出「軋空秀」，同時，也要注意高券資比個股。
台股近期多頭重新拿回發球權，登上9700點，創7年新高，主要有兩大關鍵，首先，是外資熱錢派對尚未落幕，再度回頭加碼台股；其次，是近期將進入股東會前的融券密集回補期，軋空力道正逐步增溫。
事實上，根據法令規定，股東會的前2個月，融券須強制回補，金管會今(2015)年將上市櫃與興櫃公司每日召開股東會的「限額」調降至100家，目前的股東會「旺日」，包括5月28日35家、6月1日27家、6月2日81家、6月9日41家、6月10日36家、6月11日25家、6月12日34家等。
以時程推算，目前已公布股東會召開日期的上市櫃公司中，首波強制回補高峰期落在清明節前，計有434檔個股、近20萬張的融券，須在清明節前全數回補融券。
軋空指標股，包括和碩、F-TPK、宏捷科、原相、可成、穩懋等。據統計，本周率先回補融券的個股，以友達仍有1.8萬張融券最多，宏捷科9234張排名第二。另外，和旺、宏達電、云辰、穩懋等融券也都超過1500張。
截至上周五(20日)券資比打死不退、超過5成的還有6檔，其中，最高的為合庫金和台灣50，都超過70%，和碩、億光、旺詮也都屬高券資比個股，而高券資比個股向來又是軋空主力股，切忌放空。
由於上市櫃公司自5月中旬起、逐漸進入召開股東會高峰，台股已開始進入今年度融券強制回補的高峰期，目前台股融券餘額還有39萬張，也就是說，未來這39萬張融券都將強制回補成為墊底的多單，軋空行情一觸即發。", ,wantgoo
