,Post_Date_Time,News_ID,Headline,Author,Article_Content,Related_Stock_Number,Source
0,2015-10-19 18:39,292675,外資買權值股企圖拉高台指期結算 三大法人買超57億元,鉅亨網記者李宜儒 台北,"【鉅亨網記者李宜儒 台北】台股今天類股輪動明顯，不過儘管遊戲族群、節能族群依然延續上周漲勢，但仍不敵蘋概股走弱的壓力，終場指數小漲26.55點，以8631.50點作收。三大法人今天外資再度大買台股，買超達59.04億元，投信賣超0.6億元，自營商賣超1.43億元，合計三大法人買超57.01億元。
期貨部分，由於台指期10月契約結算在即，今天自營商大舉回補空單達2315口，淨空單轉為淨多單305口；至於外資則逐漸進行獲利了結，今天再度小幅減碼多單125口，目前淨部位仍維持淨多單近2.1萬口，為20965口。投信則增加空單152口，淨部位淨空單增加到4804口。合計三大法人今天加碼多單2038口，淨部位淨多單回升到16466口。
外資今天買超標的主要集中在權值股，包括電子及金融權值股都看到外資買超標的，包括面板雙虎群創及友達，更分居外資買超首位及第4名。另外晶圓雙雄的聯電及台積電，也雙雙擠入外資買超前10名，而鴻海、華亞科、宏達電等，也均獲外資買超。
金融股部分，上次外資開始轉為買超的中信金，今天持續獲得外資買超，還以唉9791章成為外資買超第3名，另外包括玉山金、新光金也擠入外資買超前10名，其他包括元大金、富邦金、台新金、永豐金、三商壽、合庫金、國泰金、第一金、台企銀、國票金、大眾銀、開發金、高雄銀等，也同樣是外資買超標的。
另外在蘋概股部分，除了台積電跟鴻海外，僅有台郡、F-鎧勝獲外資買超；其他包括和碩、鴻準、可成、華通、欣興、F-TPK、廣達、國巨、正崴、F-GIS、F-臻鼎等，則全遭外資賣超，其中和碩更是外資賣超第2名。
而今天傳出中國南通富士通宣布斥資3.7億美元，收購超微馬來西亞與蘇州封測廠，台灣封測廠恐遭衝擊，不過外資今天仍分別買超日月光2757張及矽品1612張。
今天外資集中市場買超第1名為群創，買超張數16438張，第2名聯電，買超13634張，第3名中信金，買超9791張，第4名友達，買超9304張，第5名台積電，買超8561張。6到10名依序為，華亞科，買超7771張；玉山金，買超6407張；中華電，買超6164張；新光金，買超5772張；台泥，買超5702張。
外資集中市場賣超第1名兆豐金，賣超張數7777張，第2名和碩，賣超2845張，第3名T50反1，賣超2388張，第4名微星，賣超2205張，第5名金像電，賣超1968張。6到10名依序為，鴻準，賣超1942張；彩晶，賣超1853張；可成，賣超1779張；集盛，賣超1638張；華通，賣超1565張。
法人指出，台股在上周五順利站上8600點大關後，今天指數雖然一度漲近70點，但因為蘋概股走弱，成交量萎縮，使得指數漲幅無法擴大，拉回震盪整理，不過三大法人在台指期部位仍持續作多，其中外資淨多單部位依然維持2萬口的高水位。值得注意的是，自營商也開始偏多操作，使得淨部位也由淨空單轉為淨多單，是今年8月以 來首次翻多，台股在進入呈現高檔震盪整理下，法人對台股後市依然深具信心，預料指數將維持沿5日線緩步向上。", ,wantgoo
