,Post_Date_Time,News_ID,Headline,Author,Article_Content,Related_Stock_Number,Source
0,2015-04-29 18:10,225680,萬點倒退嚕？外資買超縮至72億元 台指多空大PK！,鉅亨網記者胡薏文  台北,"【鉅亨網記者胡薏文  台北】台股今天再度被台指周選擇權、摩台指結算干擾？電子法說後，華亞科、可成、宏達電上演跳水秀，電子領跌，金融被拖累，大盤開平走低，加權指數收盤時下跌103點，以9853.83點作收，成交值縮至1137.62億元。外資今天買超縮至72.69億元，依舊以買超金融股為主，不過在台指期部分，多空各自增援，未平倉合約雙雙大增，呈現多空大PK，淨多單增至6800多口。內資法人則是轉為賣方，投信賣超7.83億元、自營商賣超5.77億元，三大法人共買超59.08億元。
外資買超元大金3萬多張，玉山金1.1萬張，永豐金9400多張，聯電8000多張，長榮7000多張，國泰金、中信金、兆豐金各逾6000張，中鋼、中華電、南亞各逾5000張，合庫金、日月光、富邦金、彰銀各逾4000張。
外資賣超友達4.5萬張，開發金1.2萬張，華亞科8000多張，緯創、新光金各逾5000張，遠百、台灣50、台泥各逾2000張，群創、台積電各逾1600張。
投信買超群創5400多張、開發金3800多張，旺宏2500張，FB上證、國泰金、富邦金、漢翔、聯電、健和興各逾1000張，亞聚、廣隆各逾500張。
投信賣超華邦電4000多張，上證反、友達、中鋼各逾2000張，鴻海、可成、華新科、尖點、國喬各逾1000張。台聚、美律、豐泰、華航各逾600張。
自營商買超開發金6700多張，FH滬深、上證2X、CFA 50、台積電各逾2000張，元黃金、新光金、元上證、神達、寶滬深各逾1000張。
自營商賣超友達1.4萬張、上證反9000多張，長榮航、鴻海各逾4000張，中信金、群創、台新金各逾2000張，元大金、國泰金、達運、長榮、神基各逾1500張。
台股今天「倒退嚕」，不僅未再衝上萬點，反而開低走低，失守9900與前高9859等二道關卡。這波由買盤堆砌出來的萬點行情，今天外資雖仍站在買方，但買超縮至72億元，大盤即撐不住9900點之上。儘管大盤目前仍力守9839-9814點第2個跳空缺口之上，且也未失守帶1686億元超大量紅棒低點9839點，短多尚未遭到破壞。
但令人憂心的是，如外資未再持續展現強勁買超力道，而內資買盤又跟不上，要讓台股撐住萬點，恐非易事。短線上先觀察下檔多方跳空缺口支撐力道，並留意大盤再度發動攻勢時的量能表現，如大盤轉為高檔震盪，個股輪動加速，震盪也將加劇！", ,wantgoo
