,Post_Date_Time,News_ID,Headline,Author,Article_Content,Related_Stock_Number,Source
0,2015-09-21 14:30,285434,台股盤後－國際股市疫弱 禁空令解禁助跌 大跌155點守8300,鉅亨網記者李宜儒 台北,"【鉅亨網記者李宜儒 台北】歐美股市上周5大跌，亞股也跌多漲少，加上金管會解除平盤以下禁止放空，台股早盤開盤就重挫近百點，直接摜破8400點，盤中更持續走低，甚至跌破8300點，來到8285.43點，不過大跌中卻只有台燿及恒大健2檔個股跌停，尾盤在台積電等權值股稍稍回溫下，終場下跌155.1點，以8307.04點作收，成交量再度縮到800億元之下，僅756.7億元。不僅跌破5日線，也回補了9月17日的跳空缺口。
櫃檯指數表現也偏弱，終場下跌1.38點，以118.27點作收，季線得而復失，成交量226.4億元。
台股類股今天以光電類股最弱勢，主要是受到面板雙虎友達及群創分傳裁員消息，儘管友達澄清是員工自願離職，群創也說明是汰弱留強，但依然止不住跌勢，群創大跌近5.8%，友達更大跌5.9%，也拖累光電類股指數大跌逾3.5%。
其他各大類股部分，資訊服務、金融、玻陶、電腦設備、半導體、塑膠也跌逾2%。電子通路、其他電子、汽車、電器電纜、航運、電子零組件、鋼鐵、水泥、化學、生醫、電機機械也下跌逾1%。
今天強勢族群則以中小型股為主，其中生技族群繼續成為資金流入焦點，上櫃股中就有醣聯、佰研、永昕、安克、商之器、杏國、瑞基、展旺、F*太景等亮燈漲停，上市股杏輝漲幅也逾7%。
金融族群今天延續上周5的跌勢，主要還是市場央行本周可能降息，包括玉山金、旺旺保、台壽保、台新金、中信金、富邦金、元大金、中壽、兆豐金、國泰金等，跌幅均超過2.6%。
另外日月光公開收購矽品將在明天截止，矽品今天股價卻出現大跌，盤中一度跌破40元，終場下跌1.7元，以41.45元作收；日月光也同步走弱，終場下跌1.15元，以35.75元作收。
電子權值股今天表現持續壓抑，其中台積電下跌2元，鴻海也下跌1.3元，大立光下跌105元，跌破2800元大關，以2790元作收。漢微科也下跌55元，以1270元作收。DRAM廠華亞科下跌0.6元，南科也下跌0.9元。蘋概股部分，可成下跌8元，鴻準下跌2.7元，F-鎧勝下跌2元，F-臻鼎下跌1.8元，台郡下跌2.3元，和碩下跌1.9元。
法人指出，台股本波反彈最高來到8488點，加上8月外銷訂單也恐連5黑，使得市場觀望氣味濃厚，尤其金管會的禁空令解除後，更讓原本已經沉寂許多的賣壓重新湧現，不過隨著月線已經翻揚向上，預料月線將是台股短線支撐所在，至於長線部分，預料台股將在季線及10年線之間盤整。", ,wantgoo
