,Post_Date_Time,News_ID,Headline,Author,Article_Content,Related_Stock_Number,Source
0,2015-12-15 14:42,310212,台股盤後－權值股扯後腿 百點漲勢消失 8100點得而復失,鉅亨網記者李宜儒 台北,"【鉅亨網記者李宜儒 台北】台股在矽品、華亞科、南科等電子股跳空漲停帶動下，指數開盤一度大漲逾百點，順利攻克8100點，也回補了昨天的跳空缺口，不過追價買盤意願不高，指數漲幅逐漸收斂，儘管生技及太陽能等前波主流族群重新領軍，仍無法穩住大盤，尾盤在台積電、聯電、日月光、新光金、中鋼等權值股走跌或漲幅縮小下，指數小漲33.19點，以8073.35點作收，成交值723.29億元。
櫃檯指數表現則遠較集中市場強勢，主要受惠於生技及太陽能股回穩，終場大漲2.95點，漲幅達2.38%，以127.09點作收，成交值為256.37億元。
台股類股漲多於跌，僅建材營造、航運、金融下跌，至於漲幅最高的則是生醫，漲幅將近2%，紡纖、化學生醫、資訊服務、電腦設備、橡膠上漲幅度則超過1%，油電燃氣、食品、光電、化學、塑膠、半導體、觀光、電機機械、電子零組件、電器電纜、造紙、水泥、電子通路等也都收紅。
今天盤面指標是矽品及華亞科，雙雙挑空漲停並一路鎖死，矽品尾盤還有超過3萬張的買單高掛，華亞科則因為溢價幅度更大，因此漲停買單更有超過320萬張。而投資人買不到華亞科，便將目標轉向南科，也讓南科跟著跳空漲停，尾盤漲停買單也有將近3萬張，甚至台塑集團的南亞也成為投資人搶進的標的。
至於生技股在昨天民進黨總統副候選人陳建仁公開宣示，明年新國會將重新檢討法規及健保，激勵生技股重新主導領漲，生技股王浩鼎由於分盤交易處分即將解禁，今天股價也蠢蠢欲動，終場大漲51元，重新站上700元大關，距離前波收盤高點729元也僅差2元。中裕新藥也跟進走揚，終場上漲14元，以274元作收。另外醣聯、南光、東洋、大江、永昕更以漲停作收。
另外太陽能股也持續耀眼，其中達能再攻漲停，帶動益通、海德威、昱晶、綠能、台勝科、新日光、碩禾、中美晶、茂迪等聯袂收紅。
不過蘋概股卻因為外資法人紛紛調降明年iPhone出貨量，今天也表現疲弱，包括可成、鴻海、大立光、鴻準等也紛紛走跌，其中大立光更大跌50元，以2150元作收，走勢持續疲弱。
顧德投顧分析師顧奎國表示，台股尾盤漲幅收斂，主要還是因為成交值不足，權值股缺乏上攻動能，因此指數也無力上揚，基本上，目前台股將為在8000-8100點附近盤整，只要能夠守住9月2日的7907點，台股維持盤整的態勢將不變，重點還是要成交值回升，如果無法回到912億元以上，再加上配合紅K棒，台股恐難出現較稍具樣子的反彈。", ,wantgoo
