,Post_Date_Time,News_ID,Headline,Author,Article_Content,Related_Stock_Number,Source
0,2015-11-17 17:27,303212,掰了證所稅！內資開香檳 三大法人同步轉買21億元,鉅亨網記者李宜儒 台北,"【鉅亨網記者李宜儒 台北】紛擾3年的證所稅終於在今天塵埃落定宣告廢除，台股也以大漲回應，不過受成交量略縮影響，加上高檔反壓，尾盤漲幅收歛，終場仍上漲124.02點，以8419.42點作收。三大法人今天同步轉買，外資買超13.28億元，中止連7賣，自營商買超5.75億元，投信買2.21億元，合計買21.26億元。
期貨部分，隨著台股回穩，三大法人也同步加碼台指期多單，其中外資續加碼多單1267口，淨部位淨多單回升到18651口。自營商也加碼多單745口，淨部位淨多單為5700口；投信微幅回補空單450口，淨部位淨空單微降到8767口。合計三大法人今天加碼多單2462口，淨部位淨多單重新回到1.5萬口以上，達15584口。
台股大漲120點，但是外資買超金額卻僅有13.28億元，顯示今天外資並非是主角，內資才是推升今天台股大漲的主力，也是內資打臉政府復徵證所稅的決策。
至於外資今天的操盤動作則是道歉回補，其中主角是鴻海，外資從11月6日到昨天一共連賣了鴻海7個交易日，賣超張數將近11.5萬張，隨著鴻海在昨天公布第3季財報後，表現略優於市場預期，也讓外資在今天重新回補鴻海持股，買超10557張，為外資買超第2名。
鴻海重新獲得外資買盤加持，也帶動蘋概族群同步受惠，包括台積電、大立光、台郡、F-臻鼎、日月光、F-GIS、F-鎧勝、可成等，都獲外資買超。
至於外資在賣超族群則主要集中在3D族群，包括面板、DRAM及LED，至於金融股外資賣壓則有減緩跡象。值得注意的是，網通股智邦近期是外資最愛，但是昨天跟今天，外資卻連續2天賣超，而今天賣超張數更將近4400張，外資是否在短線已漲多下是否先行獲利了結，將是觀察重點。
今天外資集中市場買超第1名為聯電，買超張數22029張，第2名鴻海，買超10557張，第3名中信金，買超7654張，第4名微星，買超6912張，第5名中華電，買超5440張。6到10名依序為，台積電，買超4527張；長榮航，買超3993張；力成，買超3566張；元大金，買超2942張；彰銀，買超2822張。
外資集中市場賣超第1名友達，賣超張數12463張，第2名永豐金，賣超12071張，第3名群創，賣超10020張，第4名華亞科，賣超7912張，第5名萬海，賣超6863張。6到10名依序為，仁寶，賣超6695張；寶成，賣超6265張；中鋼，賣超6230張；鴻準，賣超5659張；華航，賣超4449張。
法人指出，今天台股以大漲方式跳空收復季線8351點，對於台股多方來說，是近期難得的上攻表現，顯示紛紛擾擾3年的證所稅正式宣告廢除，對於台股來說依然是一劑強心針，只不過，台股在連續之前從8871點回檔至今，指數最低來到8217點，短點跌點超過600點，今天的台股表現仍以反彈視之，等到重新站上頸線8500點及半年線8680點之後，才能確定台股重新展開一波多方走勢。", ,wantgoo
