,Post_Date_Time,News_ID,Headline,Author,Article_Content,Related_Stock_Number,Source
0,2015-11-03 19:49,295991,外資大買105億元 重押權值股 台指期淨多單續創高,鉅亨網記者李宜儒 台北,"【鉅亨網記者李宜儒 台北】證所稅爭議可望消彌，台股多頭信心大增，包括電子、金融及傳產等各大類股同步齊揚，指數開高走高，終場上漲98.42點，以8713.19點作收。三大法人則是呈現土洋對作，外資連2天買超，今天更大買105.84億元，自營商則是賣超7.63億元，投信續賣超2.23億元，合計買超95.95億元。
期貨部分，也是呈現土洋對作，外資大舉加碼多單3872口，淨部位淨多單回升到2.6萬口以上，達26205口，為8月底以來新高水位。自營商則是加碼空單833口，淨部位淨空單增加到1508口，投信則小幅回補空單203口，淨部位淨空單小降到7206口。合計三大法人今天共加碼多單3242口，目前淨部位淨多單回升到17491口。
台股可望解除證所稅的枷鎖，外資顯示信心十足，今天大舉買進電子及金融權值股，其中台積電再度以買超19180張，躍居外資買超首位，外資今天買超台積電就達26.75億元，聯電也同樣受到外資買盤青睞，買超近1.2萬張，買超金額達1.46億元。另外不畏DRAM報價續跌，外資也繼續大買華亞科1.6萬張。
而金融股今天也一吐之前遭外資大賣的怨氣，外資買超前10名中，就有台新金、華南金、富邦金、彰銀及元大金入榜，另外包括合庫金、永豐金、玉山金、台企銀、第一金、兆豐金、三商壽、國泰金、國票金、遠東銀、台中銀、群益證、統一證、聯邦銀、元富證、安泰銀等，也獲外資買盤加持。
蘋概股今天也持續吸引外資買盤回流，除了台積電、鴻海外，欣興、日月光、華通、F-鎧勝、國巨、可成、和碩、大立光、F-臻鼎等，也是外資買超標的。至於鴻準、F-TPK、台郡、正崴、F-GIS等則是遭外資賣超。其鴻海獲外資買超9679張，買超金額約8.49億元，大立光也獲外資買超358張，買超金額約9.82億元
合計外資今天光是台積電、鴻海及大立光這三檔權值股，買超金額就達45億元，佔外資總買超金額的42%。
今天外資集中市場買超第1名為台積電，買超張數19180張，第2名華亞科，買超16099張，第3名聯電，買超11891張，第4名台新金，買超11638張，第5名鴻海，買超9679張。6到10名依序，華南金，買超6990張；富邦金，買超6814張；彰銀，買超6570張；元大金，買超6373張；欣興，買超5900張。
外資集中市場賣超第1名群創，賣超張數33508張，第2名中信金，賣超4764張，第3名新光金，賣超4612張，第4名晶電，賣超4281張，第5名開發金，賣超3740張。6到10名依序為，滬深2X，賣超3717張；統一，賣超2545張；中石化，賣超1987張；鴻準，賣超1923張；台達電，賣超1826張。
法人指出，今天外資作多態度相當明顯，包括在現貨市場及台指期都大幅加碼，顯示台股在陸續站上5日線及月線等短期均線之後，外資追高意願也明顯加溫，配合國際股市已回穩，內外在因素都有利於台股繼續上攻，以今天台股跳空上漲來看，只要不出現回補缺口的狀況，對於台股仍都屬於有利上攻的盤勢。", ,wantgoo
