,Post_Date_Time,News_ID,Headline,Author,Article_Content,Related_Stock_Number,Source
0,2015-06-23 16:21,249837,南亞吳嘉昭：EG未來5年穩賺的！今年需求成長5%,鉅亨網記者趙曉慧 台北,"【鉅亨網記者趙曉慧 台北】全球第2大EG廠南亞(1303)今(23)日召開股東會，董事長吳嘉昭表示，EG全球需求量每年可穩定成長5%，今年將可成長4.9%，最大市場中國的進口量仍將超過800萬噸，預估未來5年EG的獲利都可以期待。
對於全球景氣預測，吳嘉昭表示「越來越不易捉摸」，美國經濟成長一枝獨秀，其他地區卻在減緩，歐元區的德國內需疲弱導致通貨緊縮升溫，日本則在安倍經濟學的效應逐漸遞減下、通貨膨脹不如預期等；中國則持續調整結構，經濟由高速成長減緩至中低速成長。
「紅色供應鏈」崛起成為今年股東會的熱門話題，對此，吳嘉昭表示，中國近年來積極支持供應鏈本土化，先後建立鋼鐵、石化、面板供應鏈，下一步將進軍半導體業，紅色供應鏈持續擴大成型。台灣對大陸市場的高度依存性，對產業的發展將是一大威脅，加上對外經濟開放與區域經濟整合沒有進展，不利於台灣經濟長期發展。
回歸南亞的主力本業EG產品，他說，由於聚酯纖維近年來全球每年約有5至6%的成長，預估未來全球EG需求每年成長約5%，市場需求穩定成長，特別是中國、印度等亞洲地區每年仍將進口EG總量超過1,000萬噸。
他指出，南亞的麥寮乙二醇廠位置接近亞洲各主要乙二醇消費市場，預估往後5年期間EG需求量仍高，獲利可期。
去年EG受到全球經濟成長放緩、原油在第4季大跌影響，年需求量僅增加31萬噸。吳嘉昭說，今年原油價格漸回穩，乙二醇市場需求回升，全球需求量年增4.9%，但平均價格變動不大。
中國為全球EG的主要市場，南亞去年供應123萬噸、佔其進口量的14.2%。吳嘉昭預估，今年中國EG進口量仍將超過800萬噸，南亞因具有地理位置優勢，交貨準時且可送達中國沿海各大小港口，品質優良，擁有較佳競爭力。
至於今年的投資重點，吳嘉昭表示，多數位於海外的大陸及越南。他說，台灣增設光電級聚酯薄膜生產設備預定今年第3季投產，寧波的可塑劑與丙二酚廠業已投產，昆山的電子材料產品也將於今年全數完工投產，越南聚酯纖維與塑膠加工產品在今、明年陸續有新產能加入。", ,wantgoo
