,Post_Date_Time,News_ID,Headline,Author,Article_Content,Related_Stock_Number,Source
0,2016-01-12 07:55,326759,台股盤前─美股走穩有助台股止跌 金融股將成急先鋒,鉅亨網記者張欽發 台北,"【鉅亨網記者張欽發 台北】台北股匯市1月11日演出雙殺的戲碼，收盤集中市場加權股價指數下跌105.55點，收盤指數報7788.42點，成交值850.21億元，跌破10年線及7800點，在這樣的表現之下，對於1月12日的台北股市的走勢，國泰證期顧問處協理簡伯儀指出，台股昨天的破底走勢中，相對呈現下跌量縮的走勢，有利於台股尋求止穩反彈。
同時，證券、期貨分析師及會計師張陳浩指出，在中國大陸官方打擊匯市炒作空頭之下，金融股將成為台股反攻的急先鋒。
事實上，在2016年開年以來國際股市表現差，其中在亞洲地區方面，中國股市下跌14.7%，台北股市下跌6.5%，韓國股市下跌3.3%，在這樣的走勢之下，也出現一絲希望，一者中國人民銀行已著手打擊匯市人民幣空頭進行軋空；二者今晨收盤的美股也有走穩的格局。
今晨收盤的美股數據顯示，道瓊工業指數上漲 51.84 點，或 0.32%，收在 16398.29點。標普 500 指數上漲 1.64 點，或 0.09%，收在 1926.67 點。那斯達克指數下跌 5.64 點，或 –0.12%，收在 4637.99 點。而關係台北股市蘋概台積電(2330)、大立光(3008)、可成(2474)表現的蘋果股價收盤上漲1.62%。
外資昨日在台股賣超98.39億元，2016年開年以來外資在台股賣超近500億元，但針對台股的走勢研判上，證券、期貨分析師及會計師張陳浩指出，昨日高價股及權值股下跌的背後，出現中華電(2412)量增走揚的格局，外資買超1.49萬張，顯示防禦型個股的走揚成為外資的避風港，外資並沒有大舉離場。
在市場訊息部分，台塑四寶的台塑(1301)、南亞(1303)、台化(1326)、台塑化(6505)在2015年大賺1414億元，其中台塑化去年淨利473.01億元，每股稅後盈餘達到4.97元。", ,wantgoo
