,Post_Date_Time,News_ID,Headline,Author,Article_Content,Related_Stock_Number,Source
0,2016-01-08 11:55,323535,台股盤中─國家隊全力護盤 指數跌深反彈盤中翻紅,鉅亨網記者楊伶雯 台北,"【鉅亨網記者楊伶雯 台北】陸股今年開盤以來二度啟動熔斷機制，引發全球股市跟著跳水，美股周四大跌，道瓊工業指數重挫392.41點，拖累台股今(8)日開低，早盤一度失守7800點，不過，國家隊全力護盤，財政部長張盛和信心喊話強調，國安基金一直都在場內，加上陸股暫停熔斷，蘋概股初步止穩，金融股也有反彈，推升指數走高翻紅，盤中高低震盪近百點，法人認為，技術指標低檔背離，指數位置負乖離過大，指數呈現跌深反彈。
美股周四重挫，道瓊工業指數重挫392.41點，收在16514.10點；NASDAQ指數下跌146.34點，收4689.43點；S&P500下跌47.17點，收1943.09點；費城半導體指數收跌20.95點；美股重挫拖累亞股表現，日、韓股市開盤下跌，台股今日以7811.2點開出，下跌40.86點。
台股早盤開低後一度失守7800點關卡，下滑至7788.71點，面對大盤指數今年來一路走跌，政府護盤不遺餘力，8大官股連續4天買進137億元，另外，據指出，財政部也要求券商買進，金管會則是宣布調高融券保證金成數，由90%上調至120%，加上國家隊全力護盤，拉升大盤指數開低走高，盤中翻紅收復7800點。
盤面上，蘋概股今日反彈，股王大立光(3008)在外資連續2天買超，加上短線跌深，早盤開低後快速反彈翻紅，盤中漲幅逾6%，另外，台積電也是開低走高翻紅的表現，聯發科、華通、廣達、晶電、F-TPK也是上漲，可成跌幅縮小，鴻海盤中也企圖反攻，拉升至平盤附近。
金融股也呈現跌深反彈的攻勢，國泰金、兆豐金、新光金、元大金等股上漲，富邦金盤中翻紅，官股行庫與政府基金進場護盤，拉升金融股指數，傳產股漲跌互見，生技股及化學股表現領漲，觀光、汽車、橡膠股堪現較弱。
台股大盤今日開低走高，盤中一度拉升至7888.27點，高低點震盪達99.56點；國泰證期顧問處協理簡伯儀指出，台股開低走高，從線型架構上來看，技術低檔背離，且是二度背離，再加上指數位置負乖離過大，蘊釀跌深反彈的表現。", ,wantgoo
