,Post_Date_Time,News_ID,Headline,Author,Article_Content,Related_Stock_Number,Source
0,2016-01-05 19:17,320705,亞洲投顧 獲利全壘打 盤後分析,鉅亨台北資料中心,"【鉅亨台北資料中心】◆盤勢分析
C之3波
大盤今日在蘋概股持續弱勢破底下以以8075點作收，成交量為802億。波浪位置:11/5日8871點~11/16日8217點~A波…11/16日8217點~12/7日8535點~B波…12/7日8535點~12/14日7980點C~1波…12/14日7980點~12/28日8394點~C~2波…現在進行C之3波.由富邦金及弱勢蘋概股表態! 指標股破底個股有:F~TPK、玉晶光、昨天華碩、台達電、可成、台泥、亞泥、上週聯發科破底，金控指標股富邦金，蘋概股5264F愷勝、4938和碩、6176瑞儀、6456F~GIS業成破底。，南韓股市跌破12/14低點1919點(相當於台股12/14低點7980點)後反彈，收在1930點。，也是一項重要觀察指標！慢性盤跌走勢機會大，盤面上並無明顯的多方主流族群及指標股，加上1/16總統大選不確定因素，盤面無明顯主流，弱勢指標股F~TPK、可成、華碩、聯發科及F愷勝、和碩、瑞儀、上銀。金控指標富邦金能否止跌也是觀盤重點，零星點火的多方強勢股有:網通智邦、智易、被動元件廠奇力新..後勢需觀察12/14日低點7980點的支撐力道。
亞洲投顧 楊基政 分析師
以上資料僅供參考,投資時應審慎評估", ,wantgoo
