,Post_Date_Time,News_ID,Headline,Author,Article_Content,Related_Stock_Number,Source
0,2016-01-21 18:50,332744,外資轉進中小型股 金控賣超大滿貫 三大法人續砍30億,鉅亨網記者李宜儒 台北,"【鉅亨網記者李宜儒 台北】美股盤後期指上漲，加上蘋果股價止跌，激勵台股一度開高，然而追價買盤意願低落，且美股期指又翻黑，壓抑指數回跌，終場下跌35.11點，以最低點7664.01點作收。三大法人也持續賣超，外資賣超23.32億元，投信小幅買超3.8億元，自營商賣超10.93億元，合計賣超30.46億元。
期貨部分，三大法人則是呈現土洋對作，外資重新加碼多單5241口，淨部位淨多單回升到2萬口以上，達22829口；自營商加碼空單725口，淨部位淨空單為3317口；投信也是加碼空單113口，淨部位淨空單6997口；合計三大法人今天共加碼多單4403口，淨部位淨多單為12461口。
金控股今天繼續成為提款的重災區，集中市場14檔金控股，全部遭外資賣超，且除了國票金外，包括中信金、富邦金、新光金、台新金、開發金、元大金、第一金、國泰金、兆豐金、玉山金、合庫金、永豐金、華南金等13檔，更是全部名列外資賣超前20名之列。
反觀蘋概股，外資賣壓已開始減緩，包括日月光、可成、鴻海、欣興、台積電、F-TPK等，都是外資買超標的，是否意味外資也開始認為蘋概股跌幅已深，因此開始回補持股，值得觀察。
外資集中市場買超第1名為英業達，買超張數12652張，第2名華邦電，買超10270張，第3名上証2X，買超10201張，第4名群創，買超9373張，第5名日月光，買超3486張。6到10名依序為，智邦，買超3437張；東陽，買超3032張；寶成，買超2577張；友達，買超2409張；仲琦，買超1727張。
外資集中市場賣超第1名中信金，賣超張數34192張，第2名富邦金，賣超張數16426張，第3名新光金，賣超12215張，第4名台新金，賣超11944張，第5名開發金，賣超11412張。6到10名依序為，元大金，賣超9510張；第一金，賣超9071張；華亞科，賣超8852張；國泰金，賣超8492張；兆豐金，賣超6359張。
國泰證期顧問處協理簡伯儀表示，儘管外資持續加碼台指期多單，原本市場寄望週一盤中低點7627點能有所支撐，現在觀察，就目前的全球經濟環境，基本上，國際油價下跌所引發的連鎖效應仍持續發酵，導致國際股市持續走跌，再加上5日線也已跌破，除非國際股市能率先守穩，否則周一低點恐怕也很難有太強勁的支撐。", ,wantgoo
