,Post_Date_Time,News_ID,Headline,Author,Article_Content,Related_Stock_Number,Source
0,2016-01-20 10:42,331531,台股盤中─個股漲勢稀落 指數一度大跌百點 台指期難拉高結算,鉅亨網記者王莞甯 台北,"【鉅亨網記者王莞甯 台北】受到月線反壓、外資籌碼面持續偏保守的影響下，台股期現貨今(20)日同步下壓，加權指數開低走低，盤中最多一度跌107點，最低來到7742點，預估成交量約830億元，由於台指期今日結算，萬寶投顧投資總監蔡明彰指出，從目前盤勢來看，今日要拉高結算的難度很高。
隨著蘋果股價繼續走跌，相關供應鏈也受到壓抑，瑞儀今盤中跌逾半根停板、可成、廣達和奇力新均有逾3%跌勢，大立光、和碩和欣興跌幅在3%上下，族群表現相對弱勢。
漢微科法說指出，目前訂單能見度約3個月，預期本季營運仍弱，第2季起恢復成長動能，今日股價走跌逾半根停板，半導體設備廠同步受到衝擊，家登跌逾2%，辛耘、世禾也遭壓抑在盤下。
市場傳出，宏達電將從華為手中奪回今年Google原生手機Nexus系列訂單，一次拿下2款Nexus機種，有助提升營運，盤中有買盤支撐，跌幅僅在0.3%左右。
儘管電金個股表現弱勢，但紡織類股萬綠叢中一點紅，宏益漲停，集盛、南緯、台南、聚隆、聯發和得力均有超過半根停板漲幅，宜進和宏遠漲幅4%上下，分析師指出，隨著新台幣走弱有利出口，以及奧運中長多題材陸續發酵，紡織股相對具抗跌能力。
蔡明彰進一步說明，IMF調降全球經濟成長，可能將讓外資在全球的投資部位減少，後續必須留意。
分析師指出，低量突顯買盤觀望，若要突破盤跌趨勢，必須放量克服1月7日創下的今年最大量1175億元，才有助脫離7770-7980點套牢區。
元大投顧表示，外資心態並未因選舉結束而修正持續偏空，只是賣壓相對不重，同時觀察到投信操作更加萎縮，僅少量進出特定個股，融資餘額則是低檔徘徊，目前未脫離空頭市場格局，靜待月底聯準會召開。", ,wantgoo
