,Post_Date_Time,News_ID,Headline,Author,Article_Content,Related_Stock_Number,Source
0,2016-01-06 07:55,320790,台股盤前－兩岸貨貿+陸客中轉選前釋利多 可望收復8100,鉅亨網記者陳慧菱 台北,"【鉅亨網記者陳慧菱 台北】台股昨(5)日跌破8100點關卡，下跌39點，指數收在8075點，成交值802億元。歐美股市今晨止穩，若陸股、人民幣也能反彈，帶動金融股率先止跌，且兩岸貨貿將加速談判，加上選前11天，捎來陸客中轉試點開放的好消息，相關概念股可望受惠，台股可望收復8100點。
人民幣中間價連跌6日，再創逾4年半新低，其中，離岸價一度跌穿6.64兌1美元，創近6年低位；新台幣因外資偏匯出而跟著下探逾3個月新低，連續7個交易日收貶，收在33.27元兌1美元。
人民幣昨日重貶至6.64元兌1美元價位，TRF再爆斷頭潮，金融圈估計，由於此波比去年8月貶值幅度更大，估計損失將超過約新台幣2000億元。
第13輪兩岸貨貿談判時程還未敲定，不過為加速貨貿談判進展，經濟部宣布，預定今天在北京先舉行技術性磋商，進行小範圍溝通，並在選後舉行第13輪會議。據了解，兩岸談判已久的貨貿協議，我主要目標在爭取石化、工具機、汽車及面板四大產業出口大陸免關稅，相關概念股是否發威值得觀察。
此外，在選前11天，兩岸合作有重大進展，兩岸針對陸客中轉協商已完成，陸方已點頭同意，由南昌、昆明、重慶三城市首批試點，可以率先陸客中轉；航運股是否表態可期。
今天觀盤重點還有，股王大立光昨日公布去年12月營收39.79億元，月減30%，下探九個月來低點，遠低於市場預期，法人圈感到「驚嚇」。大立光昨天股價下跌65元、收2110元，隨著基本面表現不如預期，今天股價恐測試2000元整數關卡。i6s的失色，不指大立光營收驟減，可成月減17%、新普月減21%、瑞儀月減3%，蘋概股今天恐續弱。
台股昨天跌破8100點，對台股而言，8000點有強力支撐、前波低點7980點關卡是國安基金的護盤重點所在，今日應能守住，不過之前月線8241點成為壓力區，儘管止穩反彈，反彈力道也不大，預估選舉前台股會在此區間震盪整理。", ,wantgoo
