,Post_Date_Time,News_ID,Headline,Author,Article_Content,Related_Stock_Number,Source
0,2016-02-03 11:25,340951,台股盤中─金融氣虛拖累羊尾封關行情 守穩5日線是關鍵,鉅亨網記者張欽發 台北,"【鉅亨網記者張欽發 台北】台股今天開低走低，金融股盤中下跌超過2%，為台股羊年封關日下殺的元凶，而蘋果兩大主力台積電(2330)、大立光(3008)則為今天盤中撐盤的主力戰鬥部隊，其中台積電股價衝高到146元，為今天大盤的最大亮點。
台股春節前的最後一個交易日，指數開低走低，早盤以8117.22點開出，最低8036.6點，預估全場成交值800億元；證券、期貨分析師及會計師張陳浩指出，在昨日美股大跌走勢中，台積電ADR價格送勢上漲0.45%，固然與台積電決議配發6元的股息訊息有關，但整體而言，台積電與大立光股價的走穩，其他如可成(2474)、-F-TPK(3673)早盤走勢也堅挺；顯然蘋果的新機iPhone 7題材正在醱酵中。
張陳浩指出，集中市場加權股價指數能否守住5日線為短線強弱關鍵，而金融股能否止跌，也是影響多空重大的變數。
不過，國泰證期顧問處協理簡伯儀說，固然台股開低走低，但相對OTC中小型個股表現強勢，大盤以生技、網通及汽車零組件個股強勢，也顯示為市場在猴年開年後的重點類股在此，買盤為春節後先行卡位。
台股今天開低走低，主要受美股收盤下跌的影響，八大類股全數走低，其中並以金融類股下跌2.14%跌幅最大，其次為水泥類股下跌1.74%。", ,wantgoo
