,Post_Date_Time,News_ID,Headline,Author,Article_Content,Related_Stock_Number,Source
0,2016-01-08 08:32,322745,券商分析摘要,鉅亨台北資料中心,"【鉅亨台北資料中心】◆券商推薦個股排行： ◆ 統一證：
台股連續四個交易日重挫，整數關卡都未見買盤進駐，指數一路破底，昨日盤中更是一度跌破7800點整數關卡及十年線。展望後市，觀察重點如下：第一、國際市場方面，近期市場利空消息接踵而來，舉凡人民幣重貶、沙伊斷交、北韓氫彈試驗、油價持續破底等，種種因素都導致全球股市劇烈震盪，其中尤以人民幣重貶再加上熔斷機制，導致陸股新的一年開始短短四天就啟動熔斷機制兩次，更進一步造成其它市場恐慌。原先獨強的美國股在跌破原有支撐力道的頸線位置後，指數也持續下探，顯現目前全球多方信心已不如先前，短期內難有多方波段機會，僅能先尋求止跌回穩。第二、盤面方面，昨日台股以空運族群及水泥類股較為抗跌，而近期的主流網通類股如智易、神準、台揚、建漢等表現相對亮眼，仍屬盤面上較為強勢的題材族群。而市場上原先期待太陽能族群能在基本面轉虧為盈的題材下蓄勢待發，反而在營收公布後大跌，綠能、昱晶昨日盤中更是一度跌停。近日弱勢表現的蘋果概念股昨日持續破底，大立光、可成、和碩、臻鼎、華通、F-GIS等紛紛重挫。不過昨日尾盤一點過後買盤進駐，由龍頭權值股點火，台積電、鴻海、日月光、國泰金、遠東新、台泥、正新、台塑四寶等都有明顯拉抬，頗有護盤意味，而護盤標的更以傳產龍頭股為主要方向，電子、金融類股反而較不受青睞。第三、政策消息方面，昨日台灣金管會宣布自 1/8起上調融券保證金成數至120%、而中國證監會亦於昨晚宣布從1/8起暫停實施熔斷機制，減少干預市場，不過後續是否能讓股市止跌回穩仍有待觀察。第四、就技術面觀察，昨日台股再次失守前波低點7980點，所幸尾盤買盤進駐，留下82點的下影線。不過考量目前均線空頭排列下彎，且昨日已跌破十年線支撐，短期內僅能先觀察指數能否複製去年八月底的走勢，在十年線附近上演止跌反攻戲碼。目前在操作上建議逢反彈減碼，待指數重回8000點之上再重新布局題材績優股即可。 ◆ 新光證：
人行讓人民幣兌美元中間價再貶0.51%，資金加速外逃，陸股十點即啟動熔斷機制，引發亞股恐慌性殺盤，7日台股開低走低，僅水泥股逃過一劫，可成調降資本支出、外資看淡聯發科今年獲利，蘋概股哀鴻遍野，玻璃、百貨、生技、光電等類股亦為重災區，跌逾3%，所幸跌逾220點後，國安基金進場護盤，午後跌勢漸縮，終場加權指數收在 7852.06點，下跌138.33點或1.73%，成交額1175.77億元。 OTC指數收在 121.11點，下跌3.7點或2.96%，成交額300.85億元。國際油價仍無止跌跡象，市場預期去年12月台進出口貿易數字仍為二位數衰退；加上世界銀行下修今年中國 GDP預估值至6.7%，今年全球GDP至2.9%，引發中國經濟走緩疑慮，使得7日台股連四日收黑，再失7900點及十年線二道關卡，成交量擴增逾1100億。籌碼方面，三大法人連四日同步賣超，金額擴大為137.14億，其中外資增至119.3億，考量技術、籌碼、基本面欠佳，建議觀望並減碼持股，待選後局勢穩定再做決策。 ◆ 統一證：
台股連續四個交易日重挫，整數關卡都未見買盤進駐，指數一路破底，昨日盤中更是一度跌破7800點整數關卡及十年線。展望後市，觀察重點如下：第一、國際市場方面，近期市場利空消息接踵而來，舉凡人民幣重貶、沙伊斷交、北韓氫彈試驗、油價持續破底等，種種因素都導致全球股市劇烈震盪，其中尤以人民幣重貶再加上熔斷機制，導致陸股新的一年開始短短四天就啟動熔斷機制兩次，更進一步造成其它市場恐慌。原先獨強的美國股在跌破原有支撐力道的頸線位置後，指數也持續下探，顯現目前全球多方信心已不如先前，短期內難有多方波段機會，僅能先尋求止跌回穩。第二、盤面方面，昨日台股以空運族群及水泥類股較為抗跌，而近期的主流網通類股如智易、神準、台揚、建漢等表現相對亮眼，仍屬盤面上較為強勢的題材族群。而市場上原先期待太陽能族群能在基本面轉虧為盈的題材下蓄勢待發，反而在營收公布後大跌，綠能、昱晶昨日盤中更是一度跌停。近日弱勢表現的蘋果概念股昨日持續破底，大立光、可成、和碩、臻鼎、華通、F-GIS等紛紛重挫。不過昨日尾盤一點過後買盤進駐，由龍頭權值股點火，台積電、鴻海、日月光、國泰金、遠東新、台泥、正新、台塑四寶等都有明顯拉抬，頗有護盤意味，而護盤標的更以傳產龍頭股為主要方向，電子、金融類股反而較不受青睞。第三、政策消息方面，昨日台灣金管會宣布自 1/8起上調融券保證金成數至120%、而中國證監會亦於昨晚宣布從1/8起暫停實施熔斷機制，減少干預市場，不過後續是否能讓股市止跌回穩仍有待觀察。第四、就技術面觀察，昨日台股再次失守前波低點7980點，所幸尾盤買盤進駐，留下82點的下影線。不過考量目前均線空頭排列下彎，且昨日已跌破十年線支撐，短期內僅能先觀察指數能否複製去年八月底的走勢，在十年線附近上演止跌反攻戲碼。目前在操作上建議逢反彈減碼，待指數重回8000點之上再重新布局題材績優股即可。 ◆ 大慶證：
受到中國官方昨晚宣布暫停熔斷機制激勵，昨日美股開盤後跌幅快速收斂，不 過由於市場持續擔憂中國經濟疲弱、國際政局情勢緊張、商品價格持續有壓，讓美股拉高後越走越低，四大指數終場幾乎收在當日最低點。從經濟數據來看，美國上週初次請領失業津貼人數來到27.7萬人，高於預期，不過已經連續 44 週維持在30萬人以下，顯示美國就業市場仍佳，但由於全 球經濟狀況持續惡化，加上過去幾年的資金泡沫破裂、歐美股市已轉弱，短線恐持續修正。雖然歐美股市週三大跌，但 亞股因先前跌深，開盤後跌幅有限，然因離岸人民幣匯價大貶影響下，使得陸股開盤後立即觸及熔斷機制，於十點前就收盤，讓亞股全數重挫，而 台股也難置身事外，尤其是金融股因處在人民幣貶值的災難中心，成為台股的重災區，指數盤中更大跌逾200點，尾盤靠特定買盤拉抬台積 電以及台塑四寶下跌幅收斂，終場下跌138點，成交量增至1169億，指數則持續維持呈現空頭排列的狀況。從法人籌碼觀察，外資現貨賣超119億元，期貨多單減碼2046口，淨多單口數降至17881口，而近期籌碼面已開始轉向，加上時間離總統大選越來越近，整體不確定性升 高，市場進場意願保守不說，一旦盤勢稍弱，投資人減碼的意願提升，更不利台股反彈，後續若國際股市表現持續弱勢，則台股難脫修正格局。 ◆ 大昌證券：
台股昨日持續開低走低，依舊弱勢整理，盤中一度跌破7800點，市場觀望氣氛濃厚，尾盤雖有見買盤介入，但跌幅仍然沉動，終場以下跌138.33點作收。三大類股齊跌，其中金融指數跌逾2%，持續向下探底，率先指數跌破去年低點位置，目前月線仍處下彎，壓力甚重，恐持續整理格局。而電子族群權值股未見回穩，股王大立光及蘋概股持續走弱，僅網通、散熱模組部分題材股表現。傳產類股中水泥、鋼鐵族群較為抗跌，但恐只是跌深反彈表現。櫃買指數昨日季線下彎，所有均線趨勢向下，恐也較不利表現。從技術面觀察，大盤指數連四黑，所有均線呈現下彎，壓抑指數表現，且國際股市震盪加劇。指標部分，日KD死亡交叉向下，缺口擴大趨勢稍見放緩，不過短線上仍不利盤勢表現。量能部分，價跌量增至1175億左右，再創去年12月以來至今最大量，但由於國際股市疲弱，買盤力道趨緩，指數相對受到壓抑。從籌碼面觀察，外資連4賣，金額約 120億左右，投信連7賣，金額約6.4億，自營商連4賣，金額約10.7億，三大法人同步賣超，對台股動能恐不利表現。", ,wantgoo
