,Post_Date_Time,News_ID,Headline,Author,Article_Content,Related_Stock_Number,Source
0,2016-01-15 17:40,329313,亞洲投顧 獲利全壘打 盤後分析,鉅亨台北資料中心,"【鉅亨台北資料中心】◆盤勢分析
大盤今日在生技族群及蘋概股破底下以7768點作收，小跌19點，成交量    為862億。
1/16總統大選不確定因素，已經跌破8/24日7203點的弱勢指標股可成、鴻海、鴻準、股王大立光，股后漢微科持續探底。前波生技族群重量級指標股:浩鼎、中裕、佰研、F麗豐、F康友、F金可、精華紛紛慣殺到跌停！大盤跌破2015年9/30日8059點頸線後，等幅測量滿足點在7247點(8871-8059-7247)。104年4/28日10014點跌破103年10/16日大井線位置8501點後等幅滿足在6988點。國際油價及人民幣能否止貶也是重要觀察重點。後續仍需提防融資多殺多的可能，指數三日不創新低才是初步的止跌訊號，融資連續兩到三日單日減幅日減40到50億也是一個較明確的落底訊號。
---------------------------------------------更多消息歡迎加入搜尋""http://www.88988.com.tw/""臉書""台股來就發分享團(88988)""社團https://goo.gl/NxE0iiLine : ""寶得富""不時會有活動，千萬別錯過囉！---------------------------------------------
作者：亞洲投顧 楊基政 分析師以上資料僅供參考,投資時應審慎評估", ,wantgoo
