,Post_Date_Time,News_ID,Headline,Author,Article_Content,Related_Stock_Number,Source
0,2016-01-28 14:50,336855,台股盤後－股王權王領軍 摩台拉高結算 指數漲21點 站上7900,鉅亨網記者李宜儒 台北,"【鉅亨網記者李宜儒 台北】美國宣布暫緩升息，亞股陷入盤整，台股則是在股王大立光及權值王台積電聯袂穩盤下，早盤雖然開低回測7800點，不過低接買盤隨即出籠，蘋概股強勢表態，加上摩台也拉高結算，推升指數順利回到平盤之上，並朝向7900點邁進，盤中最高來到7921.06點，終場上漲55.27點，以7905.1點作收，成交值也回升到700億元以上，達787.71億元。
櫃檯指數也是開低走高，早盤回測119點支撐後，就直接拉高到120點之上，終場上漲1.11點，以120.71點作收，成交值為214.38億元。
台股各大類股漲多於跌，僅玻陶、油電燃氣及鋼鐵類股收黑，至於漲幅最高的則是光電類股，上漲1.8%，食品、電機機械、貿易百貨、橡膠、紡纖、化學等，漲幅也都在1%以上，資訊服務、化學生醫、觀光、金融、水泥、建材營造、航運、塑膠、半導體、生醫、電子通路、電腦設備、汽車、電子零組件、電器電纜、造紙、通信網路等，也均收紅。
蘋果股價大跌，不過台灣蘋概股卻是利空不跌，其中股王大立光開低後就一路拉升，接連收復2100元及2200元的整數關卡，最高衝到2285元，頗有挑戰季線2307元的氣勢，終場上漲100元，以2260元作收。蘋概四雄除了大立光大漲外，可成也上漲6.5元，終場收在230元，不過和碩及鴻海則稍弱，分別下跌0.6元及0.2元。
台積電也是在平盤上下震盪，終場小漲0.5元，以140元作收。而今天將舉行法說會的聯電，盤中則是一度攻上漲停，終場大漲1.05元，以12.75元作收。其他的蘋概股表現相對強勢的則有，景碩上漲9.4%，瑞昱上漲7.4%，F-鎧勝上漲5%，欣興上漲4%。
至於原先的強勢族群網通股今天則是呈現拉回整理，智邦下跌0.75元，以35.6元作收；仲琦也下跌0.75元，收在20.9元；建漢下跌0.75元，以21.55元作收。
另外金融股也扮演了撐盤要角，包括兆豐金、第一金、合庫金、永豐金、新光金、國票金等，漲幅都在1%以上。
顧德投顧分析師顧奎國表示，台股今天表現強於亞股，不過就目前的台股盤勢來看，還是維持區間整理格局，預料在農曆封關年前，台股指數區間仍將維持在7600-7980點之間。至於會影響台股表現的因素，除了各家公司陸續公布的財報外，國際油價走勢也要持續觀察。", ,wantgoo
