,Post_Date_Time,News_ID,Headline,Author,Article_Content,Related_Stock_Number,Source
0,2016-01-06 12:40,320945,蘋果光黯淡 和碩營運恐遇壓 股價再破底,鉅亨網記者蔡宗憲 台北,"【鉅亨網記者蔡宗憲 台北】蘋果概念股12月營收驟降，大立光(3008)、可成(2474)純正蘋概股營收表現都令市場意外，市場也看淡其他供應鏈營收走勢，其中組裝廠和碩(4938)11月營收驟減，當時就引市場議論，股價也開始反映利空，今(6)日在蘋概股營收不佳利空打擊下，盤中開低走低，跌幅持續加大，午盤前跌幅逾5%以上，並已67.6元再創波段低價，走勢相當疲軟。
上市櫃公司近日開始公布12月營收，其中股王大立光12月營收驟降到39.8億元，月減30.3%，年減30.8%，可成營收也掉到69億元，月減17%，年增14%，為市場投下震撼彈。
在大立光與可成12月營收揭曉後，市場更確定蘋果iPhone 6S銷售狀況不如原先預期，外電報導也指出，蘋果已針對iPhone 6S與iPhone 6S Plus等產品生產狀況砍單，幅度高達3成，現有通路庫存堆滿滿，供應鏈營運短期都有逆風。
日前和碩董事長童子賢對於11月營收表現不佳未多做看法，僅強調營運應以年為單位，短期波動不用太在意，不過由於和碩近年營運都靠蘋果帶動強勁成長，若蘋果訂單轉弱，和碩今年營運恐也有不小壓力。
和碩日前則透露，昆山廠區將持續擴大生產規模，市場解讀是為蘋果iPhone 7做準備，童子賢日前也說，去年下半年都在忙昆山廠相關事宜，員工數今年將較去年持續增加。", ,wantgoo
