,Post_Date_Time,News_ID,Headline,Author,Article_Content,Related_Stock_Number,Source
0,2016-01-27 11:19,335895,聯發科與交大成立卓爾榮譽學會 蔡明介、李開復等任青年導師,鉅亨網記者蔡宗憲 新竹,"【鉅亨網記者蔡宗憲 新竹】手機晶片聯發科(2454)今(27)日宣布成立「卓爾榮譽學會」，以增進青年學子對科技領域的興趣與了解，促進科技教育，進而培育國際性人才，同時也將邀請交大前校長吳重雨、聯發科董事長蔡明介以及創新工廠董事長李開復擔任青年導師，親自與高中生交流、互動，傳授年輕學子科技領域知識，以及寶貴的人生經驗，以持續為台灣科技發展向下扎根。
聯發科宣布，與交大成立卓爾榮譽學會分會，會務包含進行科技領域教學、舉辦演講與高中營隊、促進高中生科學社團交流以推廣科技領域知識，會務將由交大工程系多位教授跨領域協作領軍，專任助教為骨幹，加上電子工程學系學生，以及聯發科志工擔任種子教師，至各校以專題教案方式進行。
在推廣科技應用上，聯發科將提供物聯網平台Mediatek Linkit，帶領學生發揮創克精神，嘗試開發、實現各種對物聯網與穿戴產品之想像與應用。
聯發科指出，卓爾榮譽學會預計3年內在全國12所主要高中設立卓爾榮譽學會分會，今年底在新竹區主要3所高中包括新竹園區實驗中學、新竹高中與新竹女中籌設分會，對科技領域有興趣，且品德與成績達一定水準之上，經理事會審核通過後，即可成為會員。
聯發科董事長蔡明介指出，台灣科技產業經過30多年來的發展而有今日規模，是過去科學教育培養大量理工人才的成果，台灣產業若要繼續轉型、升級，科技人才是關鍵，需加強國內科技教育，培養具國際水準人，如果人才供給出現短缺，恐影響台灣產業競爭力，因此贊助成立卓爾榮譽學會，就是希望從教育百年大計著手，培養更多優秀人才，為台灣科技發展向下扎根。", ,wantgoo
