,Post_Date_Time,News_ID,Headline,Author,Article_Content,Related_Stock_Number,Source
0,2016-01-21 15:20,332555,台股盤後－蘋概股獨木難撐 殺尾盤收跌35點 7700得而復失,鉅亨網記者李宜儒 台北,"【鉅亨網記者李宜儒 台北】美股昨晚大跌，不過盤後期指一度翻紅，加上蘋果收紅，激勵台股早盤開小高，重回7700點之上，然而追價買盤意願低落，指數回到平盤上下震盪，受到節能股等原本強勢族群走弱，指數翻黑，終場以下跌35.11點，以最低點7664.01點作收，成交值也萎縮到731.3億元。
櫃檯指數也同步走弱，包括生技及半導體均收黑拖累，終場指數下跌0.39點，以117.83點作收，成交值更跌破200億元大關，僅194.27億元，創下今年最低。
台股今天各大類股仍是跌多於漲，光電類股上漲2.16%最高，資訊服務、半導體也是收紅。至於跌幅最高的則是塑膠，跌幅將近2%，建材營造、玻陶、紡纖、金融、貿易百貨、電子通路、水泥、食品等跌幅均超過1%，橡膠、航運、觀光、造紙、通信網路、電腦設備、生醫、化學生醫、電機機械、電器電纜、鋼鐵、油電然氣等則收黑。
蘋概股今天終於見到台股主流族群的氣勢，在蘋果股價終於止跌的帶動下，激勵大立光大漲135元，以2035元作收，重回2000元大關，也順利收復5日線及10日線；台積電雖然一度下跌，但是終場也小漲0.5元，以135元作收，持續朝5日線136.3元邁進。另外可成也上漲4.5元，以219.5元作收，和碩上漲1.1元，在67.2元。
美中不足的是鴻海集團並未跟進，鴻海全場在平盤上下震盪，終場下跌0.4元，以72.7元作收，跌破73元，續創2013年10月以來新低；鴻準收在平盤60元，F-臻鼎更是下跌2元，跌幅達3%，以64元作收。
另外網通及遊戲類股也相對強勢，包括網通股仲琦、訊舟、建漢強攻漲停，遊戲股大宇資也因為進入寒假旺季而漲停。
至於金融股則持續弱勢，新光金、中信金、開發金、華南金、富邦金、第一金、永豐金、合庫金、兆豐金等，跌幅均超過1%。
顧德投顧分析師顧奎國表示，國際油價跌不停，使得各國對於全球景氣仍多有疑慮，股市也很難有所反應，加上國安基金也只是防守護盤，而非領軍強攻，再加上台股成交值不足，使得台股目前陷入整理，在成交值不足的狀況下，台股當務之急是必須要站回5日線之上，否則上方均線反壓將越來越沉重。", ,wantgoo
