,Post_Date_Time,News_ID,Headline,Author,Article_Content,Related_Stock_Number,Source
0,2016-01-07 08:42,322070,券商分析摘要,鉅亨台北資料中心,"【鉅亨台北資料中心】◆券商推薦個股排行： ◆ 大慶證：
雖然陸股昨日午盤急拉收紅，但由於市場持續擔憂中國經濟疲弱的情況，國際 政局情勢緊張、商品價格持續有壓，讓美股昨日開盤後即下跌，四大指數終場全數重挫。從經濟數據來看，美國11月工廠訂單下降 0.2%，符合預期，美國11月貿易赤字下跌5%，但進出口同步衰退，去年12月份 ISM製造業指數降至 55.3，顯示目前全球經濟狀況不佳，由於擔憂全球經濟狀況恐持續惡化，讓過去幾年的資金泡沫破裂，加上歐美股市近期已轉弱，即便短線出現 反彈，幅度可能也有限。雖然歐美股市週二略有止 穩，但亞股昨日開盤後仍持續弱勢，使台股在開盤後也隨即走低，加上人民幣對美元持續貶值，讓台股開盤後越走越低，盤中在中國股市拉抬下跌 幅略有收歛，但終場仍以下跌84點作收，收在當日相對低點， 成交量增至984億，指數則持續維持呈現空頭排列的狀況。從法人籌碼觀察，外資現貨賣超 48億元，期貨多單減碼2626口，淨多單口數降至20180口，雖然近期籌碼面並未明顯轉空，但因時間離總統大選越來越近，整體不確定 性升高，市場進場意願也會轉為保守，因此一旦盤勢稍弱，投資人減碼的意願提升，不利台股反彈，後續若國際股市表現持續弱勢，則台股難脫修 正格局。 ◆ 新光證：
6日台股連三天開低走低，類股跌多漲少，金融及生技股亦遭提款，蘋果為消化多餘庫存，首季刪減iPhone6s產量三成，連帶使得蘋概股12月營收及股價向下修正，包括大立光、可成、和碩、鴻準、台郡等皆重挫，8000點宣告失守，終場加權指數收在 7990.39點，下跌84.72點或1.05%，成交額991.44億元。OTC指數收在 124.81點，下跌1.39點或1.1%，成交額247.8億元。6日台股吹寒風，盤中一度大跌126點，刷新波段新低至7948點，大立光更殺至跌停，午後在財政部次長兼國安基金操盤手吳當傑信心喊話後，買盤進場低接跌深蘋概股，使得跌幅萎縮，成交量則放大近千億。考量三大法人連三天同步賣超，目前景氣未見好轉，陸客來台中轉放行利多刺激效果有限，台股恐持續探底，建議減持觀望，並留意美、台大型股財報及營收表現。 ◆ 大昌證券：
台股昨日開低走低，依舊弱勢整理，盤中直接跌破前波低點7980點，市場觀望氣氛濃厚，尾盤雖先站回8000點整數關卡，仍無功而返，終場以下跌84.72點作收。三大類股齊跌，其中金融指數跌逾1%，持續向下探底，目前月線仍處下彎，壓力甚重，恐持續整理格局。而電子族群權值股向下探底，股王大立光打入跌停，影響蘋概股走弱，僅網通、散熱模組仍有題材股表現。傳產類股中航空族群較為抗跌，由於陸客中轉題材利多激勵向上，但中長期操作仍需觀察。櫃買指數無法站回季線，也有向下探底的疑慮。從技術面觀察，大盤指數連三黑，所有均線呈現下彎，壓抑指數表現，且國際股市震盪加劇，台股也可能向下回測低點。指標部分，日KD死亡交叉向下，缺口明顯擴大，短線上不利盤勢表現。量能部分，價跌量增至990億左右，成去年12月以來至今最大量，但由於國際股市疲弱，買盤力道趨緩，指數相對受到壓抑。從籌碼面觀察，外資連三賣，金額約48.8億左右，投信連6賣，金額約11億，自營商連三賣，金額約7.6億，三大法人同步賣超，對台股動能恐不利表現。 ◆ 統一證：
台股連續三個交易日下挫，跌破8000點整數關卡，指數再創近期新低。展望後市，觀察重點如下：第一、權值股走弱拖累大盤表現：近期台股受制於權值類股表現疲弱影響，台股指數已經連續三個交易日下挫，其中電子股的部分，主要係受到蘋果iPhone6s與6s Plus銷售不如預期，蘋果下修2016年第1季的備貨量約30%，加上大立光公布15年12月營收MOM大幅衰退30%，而可成15年12月營收也較前一月衰退17%，昨日兩檔個股紛紛重挫，盤中一度均打到跌停，其他蘋概股表現亦是一片慘綠，台郡、F-臻鼎、華通均重挫5%以上：而金融股的部分，在本周一受到人民幣貶值以及周二傳出TRF造成鉅額虧損的利空消息衝擊後，昨日股價仍未見明顯回穩，為壓抑盤勢的另一主因。第二、籌碼面觀察：雖然今年開盤前三個交易日外資持續賣超，但所幸觀察量能逐漸回溫，昨日台股量能回到986億元的水位，可見逢低仍有低接買盤，加上觀察盤面上個股仍有表現，昨日2345智邦、2485兆赫、表現依然強勢股價續創新高，以及散熱族群中3324雙鴻、6230超眾，表現也依然強勢，加上CES展題材對台股應仍有所激勵，建議選股以市場題材性佳的個股為優先考量。第三、題材面分析：1/6~1/9美國將舉辦CES展，本次展覽市場關注於車聯網、虛擬實境應用、無人機、機器人、無線充電技術等題材相關概念股，可能為盤面相對有表現機會的族群。而昨日北韓宣布氫彈試驗成功，國際地緣政治風險在中東問題及大陸在南沙群島永暑礁新機場試飛，引起越南、菲律賓、日本抗議之後再添一筆，近期國際政治動盪，恐不利台股後續表現。第四、就技術面觀察，昨日台股大盤指數失守8000點大關，加上各期均線空頭排列下彎，上檔各期均線反壓，短線指數上難有表現，下檔先觀察十年線7900點附近的支撐性，在美股未止跌之前，目前仍保守操作。", ,wantgoo
