,Post_Date_Time,News_ID,Headline,Author,Article_Content,Related_Stock_Number,Source
0,2016-03-03 19:00,358314,揮軍直指年線 外資狂買台灣50 三大法人買超123億,鉅亨網記者李宜儒 台北,"【鉅亨網記者李宜儒 台北】台股持續演出驚驚漲行情，指數開高震盪，電子股休息整理，改由鴻海集團、金融、鋼鐵接棒上攻，終場上漲67.74點，以8611.79點作收。三大法人則呈現對作，外資買超144.7億元，投信賣超3.97億元，自營商賣超17.46億元，合計買超123.25億元。
期貨部分，三大法人同樣對作，外資重新加碼多單2595口，淨部位淨多單回升到34357口；投信續加碼空單765口，淨部位淨空單突破1萬口，來到10236口；自營商回補空單735口，淨部位淨空單續降到946口；合計三大法人今天共加碼多單2565口，淨部位淨多單持續站穩2萬口以上，達23175口。
資金輪動快速，是近期台股呈現驚驚漲的原因，尤其外資更是在期現貨同步加碼， 與內資法人投信及自營商對尬企圖明顯，就目前觀察，自營商已經有認輸的跡象，台指期淨空單部位已大幅縮小，不過投信則不認輸，持續加碼空單，因此本波軋空行情仍是欲罷不能，預料年線附近將是主要決戰點。
除了台指期外，台灣50更是外資大舉加碼的標的，而且外資加碼對象更是遍及電子、金融及傳產等三大族群，包括晶圓雙雄台積電、聯電、中鋼、鴻海、群創外，金融股更是外資資金新的避風港，中信金、國泰金、開發金、元大金、兆豐金、永豐金、富邦金、玉山金、第一金、新光金、合庫金等，全部都獲外資買盤加持，值得注意的是，除了台積電因為是佔台股最大權重外，其他外資大舉加碼的標的，仍是以股價處於低檔的低價位權值股，拉抬指數意味濃厚。
外資集中市場買超第1名為台灣50，買超張數29911張，第2名群創，買超22567張，第3名聯電，買超20051張，第4名中信金，買超18638張，第5名國泰金，買超17920張。6到10名依序為，中鋼，買超16753張；台積電，買超16358張；浩鑫，買超15256張；鴻海，買超15221張；開發金，買超14710張。
外資集中市場賣超第1名台新金，賣超張數3874張，第2名英業達，賣超張數3067張，第3名華通，賣超3026張，第4名上証反，賣超2561張，第5名智邦，賣超2488張。6到10名依序為，萬海，賣超2361張；和大，賣超2153張；億光，賣超1399張；群益證，賣超1247張；可成，賣超1181張。
法人指出，推升台股本波漲幅最大的動能就是熱錢，尤其當美國再度升息機率已低，原本流入美國的資金也陸續回到亞洲，從目前台股資金在傳產、金融、電子三大族群輪動的架構來看，外資又大舉買入台灣50及台指期，顯示外資企圖在央行理監事會議之前，要在股市及匯市雙賺，因此在外資轉為賣超之前，台股將持續維持多方架構走勢，搭配成交值穩定放量，短線目標將先上看年線。", ,wantgoo
