,Post_Date_Time,News_ID,Headline,Author,Article_Content,Related_Stock_Number,Source
0,2017-01-08 13:34,538793,衝新南向 鎖定川普機會 東元今年審慎樂觀目標突破500億,鉅亨網記者楊伶雯 台北,"東元 (1504-TW) 去年底獲得經濟部能源局 5000 萬元推動 IE3 馬達補助款「大紅包」，第 4 季表現較第 3 季好蠻多的，法人推估去年獲利將有近兩位數成長，董事長邱純枝指出，在今年的布局上，配合新南向衝刺印度及東南亞市場會有進一步成效，另外，鎖定川普上台後政策，將有機會在電力及水利上拓展，對今年持審慎樂觀態度，目標合併營收突破 500 億元。

邱純枝表示，今年有太多不確定因素，但相對也有比較多的機會，川普上台後的政策將牽動東元一部分的布局，雖然目前還無法預測，但是東元在美國的設備及廠房是現成的，包括美國的國防及政府標案都可以做，在設備、人員都是準備好的情況下，就看川普就任後他要怎麼做再來因應。

她說，目前較擔心的是川普的美墨政策，可能會影響東元在墨西哥的經營策略，但是美國是相對成熟穩定的市場，川普也強調將加強美國的基礎建設，這部分值得期待，將鎖定電力及水利行業加強拓展。

另外一個影響今年的因素是油價，因石油減產實施，油價上漲，相關產業對馬達的需求也將提升，這部分對東元來說很重要，也是正面看待的消息，整體來看，今年不會比去年差，全年「審慎樂觀」。

在新南向的布局上，邱純枝指出，將持續布局印度和東南亞市場，外銷商用空調部分，今年在菲律賓、印尼、越南等市場將正式開打，預計外銷商用空調將成長 4 成，去年海內外整體家電營收超過 90 億元，今年將突破 100 億元。

至於中國的布局，邱純枝表示，去年第 4 季開始中國的小馬達市場出現起色，另外，鐵路、貨物運輸、城市捷運的建設也帶動電機的需求，中國市場的下一步將鎖定水利及污水處理的需求商機。

印度市場成長快速，東元先投資小馬達廠試水溫，預估今年可生產 3 萬多台小馬達，另外，在高效率馬達上也積極布局，計畫與印度當地企業集團合資設廠，雙方已簽署合作意向書，預計今年第 1 季可望敲定，將鎖定印度及非洲市場，預估設廠約需 1-1.5 年的時間。

東元 2017 家電新品亮相，邱純枝說，預估今年空調產品內外銷營收可成長 20%，在反映原料成本下，將不排除調漲 5-10% 售價，至於其他家電產品也有 3-5% 調漲的可能。

她表示，去年投入 20 億元進行兩岸智能工廠設置，今年目標要將非智能工廠智能化，因應消費者的差異化需求，未來家電將朝客製化、差異化、個人身份識別化等方向發展，未來會從個人商品工業 4.0 製造延伸至家庭。

邱純枝指出，電冰箱、冷氣機、洗衣機、電視 (液晶顯示器) 向來是東元家電的四大產品線，且稱霸國產家電市場，其中空調向來是品牌金雞母，1 月起新能效標準全面推行，因此在產品規劃上，已準備好全系列變頻 CSPF 1 級機，今年除部份特殊通路還有定頻產品的需求外，銷售將要全部轉成 CSPF 變頻機種銷售，佔比要提升至 70%(其餘為窗機)，市佔率挑戰由 9% 提昇至 11%。


東元日 K 線圖", ,wantgoo
