,Post_Date_Time,News_ID,Headline,Author,Article_Content,Related_Stock_Number,Source
0,2017-01-11 13:08,540676,蘋果新機玻璃機殼真有譜？可成、鴻準訂單恐承壓,鉅亨網記者李宜儒 台北,"外電報導，蘋果 (AAPL-US)iPhone 新機機體可能大部分是玻璃，而連接兩片玻璃的不銹鋼機殼另有供應商，市場預期，蘋果現有機殼供應鏈可成 (2474-TW) 及鴻準 (2354-TW) 訂單恐受影響，法人更將可成目標價降到 228 元，壓抑可成今天股價下跌 1.5%，鴻準則是相對抗跌。

《CNBC》報導指出，蘋果新機用來連接兩片玻璃的不銹鋼機殼，是由鴻海旗下富士康與先前曾收購台灣手機零組件廠的美商 Jabil Circuit(JBL-US) 所提供，未來有可能取代現行鋁合金框架設計。

一旦相關蘋果新機用來連接兩片玻璃的不銹鋼機殼由富士康與 Jabil Circuit 拿下，意味現有蘋果金屬機殼供應商可成與鴻準面臨壓力，甚至可能遭取代。可成等業者目前暫未對此有所回應。

法人指出，蘋果今年新機還是以 OLED 面板為主，因此根據蘋果的慣性，相關的新材料也會以新機種為主，要擴大到全部機種的機率不大，而且根據之前的經驗，蘋果對於新材料的態度是相當保守的，如果沒有一定的供應量，蘋果不太會輕易採用，就像之前傳得沸沸揚揚的，iPhone 螢幕的保護玻璃將採用藍寶石基板，但最後也是因為良率不佳因此無疾而終。

可成董事長洪水樹在去年股東會上也提前打預防針，他當時表示，玻璃背板明年就算有幾款機種量產，數量也不會太多，而且如果前後都是玻璃，因為玻璃無法長任何結構，因此金屬邊框的結構會更複雜，有些設計不會亞於現在的一體成形，包括加工時間及難度等都會提高。", ,wantgoo
