,TIME,TITLE,CATEGORY,DESCRIPTION,CONTENT,KEYWORDS,FROM,LINK
0,2019-12-03 12:33:17,《盤中解析》權值股坐鎮，11500有撐,財經,美國製造業指數意外疲弱，美股四大指數周一收黑，道瓊指數大跌268.37點。台股加權指數周二開低29.51點、失守10500點，早盤一度下跌42.77點至11460.06點。不過，隨後多頭敲進權值股拉抬，帶動指數翻紅小漲，力守10500,"美國製造業指數意外疲弱，美股四大指數周一收黑，道瓊指數大跌268.37點。台股加權指數周二開低29.51點、失守10500點，早盤一度下跌42.77點至11460.06點。不過，隨後多頭敲進權值股拉抬，帶動指數翻紅小漲，力守10500點關卡。



截至12點，加權指數上漲12.37點、為11515.20點，最高上漲25.76點、至11528.59點，成交量估萎縮至近1100億元。櫃買指數同步開跌0.1點，一度下跌0.52點至143.11點，隨後亦翻紅持穩盤上，最高上漲0.57點至144.20點，表現較加權指數強勢。



觀察盤面類股，由成交量較大的電子零組件漲近1.5％領軍，其他電子、電腦周邊、水泥漲逾1％居次，電子、金融亦持穩紅盤。玻陶、油電燃氣、光電跌逾0.5％，塑膠、紡織跌約0.3％，表現則相對偏弱。



權值股今日漲跌互見，由鴻海（2317）開低後翻紅漲近1.5％領軍，聯發科（2454）漲逾1％居次，國泰金（2882）、台達電（2308）漲近0.5％。台塑（1301）跌逾1％、股王大立光（3008）跌近1％，台積電（2330）及兆豐金（2886）齊跌約0.5％，表現則相對偏弱。



國泰證期認為，台股近期高檔震盪拉回，導致短線技術面指標全面轉弱，以籌碼面觀察，市場資金轉進低位階極低單價電子族群，顯示主力及法人心態漸趨保守。整體而言短、中期趨勢對多方不利，指數仍有震盪拉回可能，近期操作不宜過度偏多。



元富投信則認為，由於中美貿易首階段協議雜音漸多，外資中期雖仍站在多方，但投信及市場大戶開始加速減碼，加權指數靠權值股撐盤、上櫃及中小型股則明顯轉弱。預期短期指數將在11200～11800點區間震盪，建議利用震盪汰弱換強。",,中時新聞網,https://www.chinatimes.com/realtimenews/20191203002506-260410
