,TIME,TITLE,CATEGORY,DESCRIPTION,CONTENT,KEYWORDS,FROM,LINK
0,2019-11-11 15:06:11,《盤後解析》「權」面失控，回防11400點,財經,中美貿易談判仍存不確定性，美股上周五雖收高，但亞股今日普遍走疲。台股在權值股疲軟下高檔拉回，加權指數開低走低，失守11500關卡並跌逾百點，尾盤一度重挫169.71點、下探11409.83點。櫃買指數亦開低走低、摜破月,"中美貿易談判仍存不確定性，美股上周五雖收高，但亞股今日普遍走疲。台股在權值股疲軟下高檔拉回，加權指數開低走低，失守11500關卡並跌逾百點，尾盤一度重挫169.71點、下探11409.83點。櫃買指數亦開低走低、摜破月線，最低下跌2.6點至141.82點。



終場加權指數重挫152.26點或1.31％、收於11427.28點，成交量略為放大至1492.74億元。櫃買指數終場下跌2.45點或1.7％、收於141.97點，成交量萎縮至353.63億元。分析師認為，台股今日回檔屬短線籌碼及技術面漲多修正，整體格局仍偏多，對後市不看淡。



盤面各類股漲多跌少，僅電子通路、食品股小漲約0.05％力撐紅盤，汽車、通信網路小跌約0.05％。成交量較大的電子零件股重跌2.1％，電子、半導體類股下跌1.64％、1.45％。其他電子、光電股分別重挫3.43％及3％，表現偏弱。



權值股成為殺盤元凶，鴻海（2317）及股王大立光（3308）重挫3.3％，聯發科（2454）跌2.54％，台塑化（6505）、台積電（2330）各跌1.72％、1.47％。中華電（2412）、台灣大（3045）小漲約0.5％，統一小漲0.27％，中鋼（2002）、統一超（2912）持平，表現相對穩健。



分析師表示，中美貿易協商朝正向發展，短期國際股市多頭格局不變，資金流向亞洲引導亞幣強勢。然而，美企第四季展望下修、香港局勢動盪，加上台幣近期強升，導致外資偏多態勢趨緩，使近期位居高檔的台股出現震盪拉回。



分析師認為，台股短線在技術面及籌碼面均面臨拉回修正壓力，櫃買指數率先跌破月線，加權指數則回測上周多方缺口11399～11451點，後市須關注外資動向是否轉變，月線約11360點能否守穩，短線不宜過度追高。



不過，分析師指出，在基本面未見轉向前，台股修正拉回均視為技術面修正及籌碼盤整，在台幣未由升轉貶前，資金行情將延續，指數震盪後仍有持續創高機會。操作上仍關注5G概念的電子元件股、PCB上下游產業及散熱族群，財報及法說會個股亦可留意。",,中時新聞網,https://www.chinatimes.com/realtimenews/20191111002575-260410
