,TIME,TITLE,CATEGORY,DESCRIPTION,CONTENT,KEYWORDS,FROM,LINK
0,2019-11-06 04:10:07,價量齊揚 十檔半導體股法人愛,證券．權證,美股四大指數4日同步創歷史新高，費城半導體指數更強漲2.19％，台股5日由台積電（2330）及聯發科（2454）等大型半導體龍頭股領軍大漲，上市半體指數大漲1.27％；市場資金也開始快速輪動至上櫃中小型半導體族群，上櫃,"美股四大指數4日同步創歷史新高，費城半導體指數更強漲2.19％，台股5日由台積電（2330）及聯發科（2454）等大型半導體龍頭股領軍大漲，上市半體指數大漲1.27％；市場資金也開始快速輪動至上櫃中小型半導體族群，上櫃半導體指數更勁揚2.03％，成為盤面最亮眼的類股。

據統計，南亞科、聯發科、環球晶、威剛、穩懋、群聯、中美晶、創意、宏捷科、台勝科等十檔半體股，5日價量齊揚，且獲得法人買盤青睞，股價漲幅達2.85～7.83％，成交量也較前一日大增27～492％，約有半數個股量能翻一～四倍。

投資專家指出，5G時代來臨，半導體族群搭上5G熱潮，成最大受惠股。法人5日鎖定近期股價表現相對落後，但第三季之後營運現轉機或成長的個股，法人大敲近期股價在70～73元之間整理的DRA龍頭股南亞科，在法人合計買超8,213張力拱下，股價站上73元大漲4.58％。

同樣也是股價表現落後的群聯，第三季營收衝高至123.94億元，年成長12.3％，是近12季來最大年增，營收俏獲利看升；矽晶圓三雄中美晶、環球晶及台勝科均呈現爆量大漲；去美化的受益者功率放大器（PA）大廠穩懋及宏捷科也是盤面當紅炸雞。

至於台積電5日蹺尾盤收310.5元、市值攻上8.05兆元，雙創新高，不過，量能明顯萎縮；IC設計股聯發科5日股價續攻堅，收425元價量齊揚，市值增至6,756.2億元，股價與市值都創2015年6月底來，約四年四個月來新高；受到聯發科股價大漲帶動，創意近來也在法人看多下緩步上揚。",,中時新聞網,https://www.chinatimes.com/newspapers/20191106000431-260206
