,TIME,TITLE,CATEGORY,DESCRIPTION,CONTENT,KEYWORDS,FROM,LINK
0,2019-12-02 10:34:22,《半導體》外資看好Q1不淡，台積電帶勁,財經,美系外資看好台積電(2330)第四季業績將有機會超越預期，明年第一季持續不淡，台積電今開高2元為307元，帶動台股開高。花旗環球證券指出，台積電受惠16、28奈米等製程需求增加，預料第四季業績將突破財測上緣，且受惠,"美系外資看好台積電(2330)第四季業績將有機會超越預期，明年第一季持續不淡，台積電今開高2元為307元，帶動台股開高。

花旗環球證券指出，台積電受惠16、28奈米等製程需求增加，預料第四季業績將突破財測上緣，且受惠7奈米製程需求強勁，可望於2020年第一季、第二季傳統淡季，甚至交出營收季增佳績。

雖市場預期台積電明年首季營收將呈季減5~10%，也仍淡季不淡，但花旗環球證券提出明年首季逆增的更樂觀預期，且喊出新天價375元，若以對台積電最樂觀假設狀況計算，股價上看435元。



台積電製程技術領先，受惠7奈米製程高度成長，台積電今年下半年業績可望逐季創歷史新高，全年營收將可較去年微幅成長，續創歷史新高。

台積電訂於本周四（12月5日）舉行2019「供應鏈管理論壇」，台積電今年領先推出7奈米製程，預計明年再領先全球生產5奈米產品，先進製程的進展將持續受到關注。上周，外資賣超台積電17482張。



",,中時新聞網,https://www.chinatimes.com/realtimenews/20191202001528-260410
