,TIME,TITLE,CATEGORY,DESCRIPTION,CONTENT,KEYWORDS,FROM,LINK
0,2019-11-29 10:51:07,《盤中解析》近關情怯、國際再傳利空，台股量縮下跌,財經,美股因為感恩節休市，國際消息多偏向利空，北韓試射兩枚短程導彈、加上美國總統川普簽屬香港法案，美中關係再度陷入膠著，亞股今日僅剩日股相對有撐在平盤附近，港股、陸股明顯逢壓，台股今開盤跌0.2點、報在11616.8,"美股因為感恩節休市，國際消息多偏向利空，北韓試射兩枚短程導彈、加上美國總統川普簽屬香港法案，美中關係再度陷入膠著，亞股今日僅剩日股相對有撐在平盤附近，港股、陸股明顯逢壓，台股今開盤跌0.2點、報在11616.88點，其後指數一路壓低，跌幅一度逾70點，台股今同步收周線、月線，現階段呈現近關情怯，量能也同步萎縮，且亞股普遍下跌，未來仍要持續關注美中貿易協議進度，12月15日關稅是否生效的影響至關重要，大陸對香港法案的後續反應將是關鍵，個股部分仍要慎防漲多拉回。



電子權值股今普遍沒有表現，股王大立光(3008)震盪於平盤附近，台積電(2330)開低震盪，跌幅近1%，鴻海(2317)亦震盪於平盤附近，在三大蘋果指標股走弱下，可成(2474)、和碩(4938)跌幅也分別逾3%、2%，其餘權值股方面，聯發科(2454)開高走低，早盤股價創今年新高後翻黑，跌幅達1.5%，面板雙虎友達(2409)、群創(3481)則逆勢走揚，盤中股價聯袂上揚約1%。

金融股中，今大型金控股亦壓回修正，幾乎全數下跌，其中富邦金(2881)、國泰金(2882)、永豐金(2890)跌幅更達1%。

今不僅大型龍頭權值股熄火、中小型股也只呈現題材性的零星點火，新唐(4919)砸下美金2.5億元(折合新台幣約76億2750萬元)，收購Panasonic旗下由Panasonic Semiconductor Solutions.Ltd(PSCS)為主所經營之半導體事業，今開出慶祝行情，股價一度大漲7.5%，股價最高達51.1元；愛普(6531)搶進藍牙無線耳機市場，外資連8日買超，股價衝上漲停，創53.1元波段新高點；嘉聯益(6153)受惠5G手機內建天線軟板需求大增，股價上漲2%。

分析師表示，預期外資逐漸缺席，加上指數下跌且成交量量縮，後市下跌須量縮、反彈則須量增，預估下檔支撐11,400點附近，上檔壓力在11700點附近，盤勢將轉為較清淡的內資主導盤，建議可留意趨勢正向，投信籌碼偏多的中小型績優股，區間偏多因應，操作上，建議加碼前景較佳之類股，如5G概念股、PCB、網通及IC測試等族群。



",,中時新聞網,https://www.chinatimes.com/realtimenews/20191129001707-260410
