,TIME,TITLE,CATEGORY,DESCRIPTION,CONTENT,KEYWORDS,FROM,LINK
0,2019-11-06 10:51:15,《盤中解析》金融股接棒，台股續攀高,財經,美股道瓊工業指數再創歷史新高，但權值王台積電(2330)因這兩天急漲後今早暫熄火，壓抑電子股指數，反倒是國泰金(2882)等大型金控率領金融股強攻，支撐台股早盤表現，加權指數盤中由小黑逆轉為小紅，一度達11650點之,"美股道瓊工業指數再創歷史新高，但權值王台積電(2330)因這兩天急漲後今早暫熄火，壓抑電子股指數，反倒是國泰金(2882)等大型金控率領金融股強攻，支撐台股早盤表現，加權指數盤中由小黑逆轉為小紅，一度達11650點之上；台股持續攀高並維持高姿態整理，類股輪動加速。

美國企業財報大致優於市場預期、聯準會降息，以及美國經濟數據樂觀，美股續創新高。周二收盤，道瓊工業指數漲30.52點或0.11%，為27,492.63點。標普500指數跌3.65點或0.12%，為3,074.62點。那斯達克指數收漲1.48點或0.02%，為8,434.68點。



台積電周二收最高310.5元，今早小開低，另兩檔蘋概指標鴻海(2317)及股王大立光(3008)股價早盤續攻；鴻海10月合併營收達5958.82億元，月增1.38%，年增1.04%，為歷年同期新高。股王大立光10月營收66.26億元，較9月的65.96億元小增，連續3個月創歷史新高，年增27%。

股王大立光今早股價續揚力挺多頭信心，台股早盤高檔狹盤震盪，各類股表現不一；電子股今早休兵，金融股由國泰金、富邦金(2881)、新光金(2888)接棒攻擊；電子次族群方面，本波股價大漲的欣興(3037)早盤股價回檔。

回顧周二，台股再創新高點，加權指數持續沿五日線走強，均線多頭排列，短線上外資熱錢持續以買超權值股拉抬指數，周二中鋼(2002)率鋼鐵股上攻，今早則由金融股接棒續在高檔，短期台股輪動，後市若要續攻，成交量必須再放大。



",,中時新聞網,https://www.chinatimes.com/realtimenews/20191106001760-260410
