,TIME,TITLE,CATEGORY,DESCRIPTION,CONTENT,KEYWORDS,FROM,LINK
0,2019-12-31 04:10:10,今年上市十強 外資買超皆逾百億,證券．權證,2019年即將畫下句點，外資今年大舉回補台股，帶動大盤漲幅逾二成，權值股漲勢兇猛，更是指數衝高的主要推手，今年以來外資買超金額前十大的上市股有台積電（2330）、鴻海（2317）、聯發科（2454）等，買超金額皆突破,"2019年即將畫下句點，外資今年大舉回補台股，帶動大盤漲幅逾二成，權值股漲勢兇猛，更是指數衝高的主要推手，今年以來外資買超金額前十大的上市股有台積電（2330）、鴻海（2317）、聯發科（2454）等，買超金額皆突破百億規模。

外資今年以來買超台股達2,535.79億元，助攻加權指數站上「萬二」大關，大型權值股更是備受資金寵愛，統計前十大外資狂敲的個股以台積電為首，其次依序為鴻海、聯發科、上海商銀、大立光、緯創、智邦、緯穎、台達電，10檔合計買超金額達2,948.54億元，顯示買盤往權值股靠攏趨勢明確。

台積電今年獲外資買超779.09億元，名列外資排行榜第一，今年來股價上漲接近5成，目前外資持股占比達78.4％，較年初增加1.21個百分點，增持27.88萬張。

法人分析，台積電除了在半導體產業扮演關鍵角色，為科技股最大指標外，其在高階製程取得領先優勢，隨著5G應用發酵，對高階需求可望持續成長，支撐業績表現，為外資鎖定加碼的原因之一。再加上市場資金充沛，美元指數走弱，熱錢流入台股也會停泊在台積電做為穩健投資標的，激勵股價大漲。

另外，聯發科同樣受惠5G題材及美中貿易戰和緩，扭轉去年外資大舉減碼183.47億元態勢，今年反手回補343.8億元，目前外資持股比重已超越六成，今年漲幅接近一倍。",,中時新聞網,https://www.chinatimes.com/newspapers/20191231000421-260206
