,TIME,TITLE,CATEGORY,DESCRIPTION,CONTENT,KEYWORDS,FROM,LINK
0,2020-03-24 01:20:03,權證星光大道－中國信託證券 台積電 國家隊頻加碼,證券．權證,因歐美地區新冠肺炎疫情持續爆發，美國多各地區封城，拖累23日美國期貨開盤不久隨即跌到熔斷，台股開盤重挫跌破失守十年線，台積電（2330）23日股價下挫15元，跌幅5.56％，收在255元。23日台股跌破十年線，國安基金,"因歐美地區新冠肺炎疫情持續爆發，美國多各地區封城，拖累23日美國期貨開盤不久隨即跌到熔斷，台股開盤重挫跌破失守十年線，台積電（2330）23日股價下挫15元，跌幅5.56％，收在255元。

23日台股跌破十年線，國安基金傳言進場護盤，護盤標的首重台積電，盤中一度拉高至262.5元，但外資賣壓仍持續，最後一盤下挫2元，終場收在255元。

台積電儘管將下修今（2020）年半導體產業的成長預估，成長幅度的強弱為晶圓代工優於半導體產業、台積電優於晶圓代工產業的趨勢仍不變，市場持續看好台積電領先量產5奈米最先進製程，在智慧手機AP、HPC的AI等相關應用的業績成長動能。

法人指出在全球各種隔離檢疫情況升高之下，下半年砍單勢將無可避免。反映前景極端不確定，市場陸續調降台積電今年的獲利預估值，然而台積電在晶圓代工領域的龍頭地位，加上可望受惠於5G及HPC等趨勢，投資人可在台積電重挫之際撿便宜布局權證。

＊【權證投資必有風險，本專區資訊僅供參考，並不構成邀約、招攬或其他任何建議與推薦，請讀者審慎為之】",,中時新聞網,https://www.chinatimes.com/newspapers/20200324000413-260206
