,TIME,TITLE,CATEGORY,DESCRIPTION,CONTENT,KEYWORDS,FROM,LINK
0,2020-02-21 04:10:04,台積投資不停手 設備廠同樂,證券．權證,台股20日區間盤旋，權值王台積電（2330）走勢相對平穩，市場看好台積今年資本支出估高於去年水準，積極研發5奈比等先進製程，預期投資動作不受疫情干擾，且符合資金「買長不買短」操作策略，帶動家登（3680）、帆宣,"台股20日區間盤旋，權值王台積電（2330）走勢相對平穩，市場看好台積今年資本支出估高於去年水準，積極研發5奈比等先進製程，預期投資動作不受疫情干擾，且符合資金「買長不買短」操作策略，帶動家登（3680）、帆宣（6196）等半導體設備廠同步走揚，躍居盤面焦點。

台積電5奈米製程預計第二季量產，且下半年訂單爆滿，在先進製程持續取得優勢，20日雖因新冠肺炎疫情利空消息影響，外資連五日賣超調節，股價表現受到壓抑，不過，多方資金看好台積積極投資先進製程，資本支出連兩年創下新高，推升買盤大舉轉進半導體設備股。

相關個股以台積EUV光罩盒生產廠商的家登為領漲先鋒，盤中一度觸及漲停，終場漲逾半根停板，成功封閉開紅盤新冠肺炎跳空缺口，帆宣、弘塑漲幅4.48％、3.25％，量能放大，並獲三大法人同步敲進，族群漲勢整齊。

第一金投顧董事長陳奕光表示，台積電7奈米具競爭優勢，且產線不受停工問題影響，公司並擴大今年資本支出，衝刺先進製程與產能，中長線營運動能無虞，預估評價有機會更上層樓，帶動「台積大聯盟」供應鏈業績。

法人指出，家登受惠5G及高效能運算（HPC）帶動先進製程晶圓代工需求直線上升，國際半導體大廠積極建置7奈米及5奈米等先進製程產能，紫外光光罩盒（EUVPod）在上半年接單全滿，2月營收可望逐步回溫。

群益投顧表示，京鼎主要產品為半導體蝕刻，及薄膜製程設備模組與零組件，產能大多在上海、昆山兩廠，目前昆山廠已向當地政府申請復工，訂單部分因應終端半導體廠資本支出擴張，大客戶持續下單，出貨動能延續。

針對新冠肺炎疫情，法人認為，即便設備廠今年首季難以避免受到干擾，但預估僅是工程進度延宕、既有在手訂單遞延，半導體設備投資回溫趨勢不變，帶動全年營運維持成長態勢。",,中時新聞網,https://www.chinatimes.com/newspapers/20200221000365-260206
