,TIME,TITLE,CATEGORY,DESCRIPTION,CONTENT,KEYWORDS,FROM,LINK
0,2020-01-09 04:10:07,台積電、聯發科 權證買氣回籠,證券．權證,國際局勢有美伊爭端擴大，產業面則受到華為傳出砍單事件影響，市場近日緊盯權值指標台積電（2330）行情表現，隨外資疾呼真相應為台積電產太緊、憂華為過度建立庫存，而逆向縮減供貨所致，其股價8日彈回平盤，另一指,"國際局勢有美伊爭端擴大，產業面則受到華為傳出砍單事件影響，市場近日緊盯權值指標台積電（2330）行情表現，隨外資疾呼真相應為台積電產太緊、憂華為過度建立庫存，而逆向縮減供貨所致，其股價8日彈回平盤，另一指標股聯發科（2454）接單報喜、股價翻紅，相關權證買氣也回籠。

華為近日傳出對台積電砍單事件，引發市場疑慮，造成台積電股價連2日收黑，惟外資指出，華為旗艦智慧機Mate 30系列海外銷售不振，導致部分砍單，市場其實早已有心理準備，砍單事件的真相實為台積電所發起的縮減、與重新分配產能，而非由華為主動砍單。

隨外資挺身而出、呼籲勿錯殺下，台積電8日股價一度上漲1.06％，終場漲幅收斂至平盤，以333元作收，成交量為37,426張，較前一日減少約27％，不過在權證市場中，已提前見買氣回籠，多檔以台積電為標的之權證躍居熱門排行榜。

近日大盤技術面轉弱，分析師指出，所幸，聯發科8日股價翻紅、盤中最大漲幅2.46％，終場上漲1.06％，以430.5元作收，成交量9,668張，同樣呈日減、約17％。

聯發科近日4G手機晶片接單報喜，主要受惠華為、OPPO、Vivo與三星等追單，供應鏈傳出，聯發科MT6762手機晶片今年上半年累計訂單至少2,500萬套，缺貨情況則有可能至3月；此外，聯發科發布天璣800系列5G晶片，以台積電7奈米製程打造，瞄準中階智慧手機市場，上半年將搭載客戶端手機問世，好消息再添一則。",,中時新聞網,https://www.chinatimes.com/newspapers/20200109000465-260206
