,TIME,TITLE,CATEGORY,DESCRIPTION,CONTENT,KEYWORDS,FROM,LINK
0,2020-02-10 04:10:10,訂單外溢 聯電、世界吞補丸,證券．權證,美中貿易摩擦趨緩，半導體市況明顯回溫，加上5G推升8吋晶圓供給吃緊，龍頭股台積電（2330）法說率先定調2020年首季淡季不淡，產能外溢效果可期，聯電（2303）、世界（5347）二大概念股展望正向，業績有望連帶吞大補,"美中貿易摩擦趨緩，半導體市況明顯回溫，加上5G推升8吋晶圓供給吃緊，龍頭股台積電（2330）法說率先定調2020年首季淡季不淡，產能外溢效果可期，聯電（2303）、世界（5347）二大概念股展望正向，業績有望連帶吞大補丸。

聯電受惠通訊和電腦領域需求暢旺，2019年Q4營收交出418.5億元佳績，季增10.9％、年增17.8％。　就產業面，28奈米仍產能過剩，然聯電積極與客戶接洽，預期2020年第三季將有多個專案導入量產。今年資本支出10億美元，亦較2019年的7億美元提升，除例行性支出外，主要用在廈門廠擴增28奈米及各製程節點去瓶頸提升產能，而擴增產能預計於2021年產出。

廈門廠目前尚有30～35％空間可擴充，擴產後每月上看25K片，產能具經濟規模，屆時將容易達收支平衡。此外，日本富士通廠2019年第四季已小幅獲利，併入此廠相當於新增12吋產能26％，預估經2～3季度整合後將更能發揮綜效。

世界受到中美貿易戰衝擊，2019年整體營運承壓，但公司指出，中國大力實行去美化動作，目前已見PMIC 廠商紛紛投片，即使2020年併購新加坡FAB廠，8吋晶圓產能依然吃緊，加上取得高毛利微機電系統（MEMS）代工技術，今年營收有機會逐季攀高。

法人分析，8吋產能利用率將逐季走升，世界2020年營收可望呈雙位數成長；同時也預估，世界因大尺寸顯示面板驅動IC（LDDIC）需求優於預期，2019年第四季業績將達財測中上緣。",,中時新聞網,https://www.chinatimes.com/newspapers/20200210000342-260206
